Title,Author,Description,Category,Published Date,Page Count,Language,Average Rating,Preview Link,Thumbnail
The Secret Garden,"Frances Hodgson Burnett, Francis Hodgson Burnett, Miller, Steve, Luisa Uribe",WHEN MARY LENNOX WAS SENT TO MISSELTHWAITE MANOR to live with her uncle everybody said she was the most disagreeable-looking child ever seen.,"Fiction, general, Friendship, fiction, People with disabilities, fiction, Great britain, fiction, Child and youth fiction, Children's fiction, Gardens, fiction, England, fiction, American literature, Orphans, fiction, Great britain, history, fiction, English language, Orphans, Juvenile fiction, Gardens, Fiction, Children with disabilities, Loneliness in children, Fiction, coming of age, Fantasy fiction, Toy and movable books, American fiction, People with disabilities, Stories, Huérfanos, Ficción juvenil, Jardines, Impedidos, Friendship, Sick children, History, Families, Pictorial works, Familles, Romans, nouvelles, etc. pour la jeunesse, Amitié, Jardins, Ouvrages illustrés, Children's stories, American, Great Britain, Personnes handicapées, Girls, fiction, American literature, study and teaching, American fiction, history and criticism, Children, Enfants, Romans, nouvelles, Orphelins, Roman pour la jeunesse, Physically handicapped, England, Literature, Dictionaries, Chinese, Selbsterziehung, Freundschaft, Garten, Waisenkind, Korean, Spanish, French, Therapeutic use, Gardening, Cousins, Spanish language materials, Detective and mystery stories, reading, strategies, classic, Accessible book, Protected DAISY, Physically disabled children, Children's stories, English, People with physical disabilities, Juvenile literature, Children's stories, JUVENILE FICTION / Family / Orphans & Foster Homes, JUVENILE FICTION / Girls & Women, JUVENILE FICTION / Social Themes / Friendship, JUVENILE FICTION / Lifestyles / Country Life, JUVENILE FICTION / Disabilities & Special Needs, English language, textbooks for foreign speakers, Readers, British and irish fiction (fictional works by one author), Grandparents, fiction, Great britain, history, 19th century, fiction, Grandfathers, Language and languages, study and teaching, Love, fiction, Mystery and detective stories, Holmes, sherlock (fictitious character), fiction, Fiction, mystery & detective, general, Private investigators, fiction, Literature and fiction, juvenile, Fiction, action & adventure, Fiction, thrillers, suspense",1911,No page count available,"cat, fre, spa, und, eng",No rating,https://openlibrary.org/works/OL69612W,https://covers.openlibrary.org/b/id/12622062-M.jpg
Harry Potter and the Deathly Hallows,J. K. Rowling,"Les deux hommes surgirent de nulle part, à quelques mètres l’un de l’autre, sur le chemin étroit éclairé par la lune. Pendant un instant, ils restèrent parfaitement immobiles, chacun pointant sa baguette magique sur la poitrine de l’autre.","the Elder Wand, children's books, dementors, good and evil, Juvenile literature, Juvenile works, Death, Fiction, Wizards, New York Times bestseller, nyt:series_books=2006-09-16, Schools, Magic, Magia, Ficción juvenil, Novela fantástica, Magos, Escuelas, Juvenile fiction, dark magic, Coming of age, heroics, fantasy, action, adventure, orphans, foster homes, young adult, children, children's literature, boarding school, wizardry, mystery, kids, witchcraft, war, Magie, Magiciens, Roman pour la jeunesse, Mort, Sorcellerie, Romans, nouvelles, etc. pour la jeunesse, Internats, Fantasy fiction, Roman fantastique, Ecoles, Boarding schools, Sorciers, Hogwarts School of Witchcraft and Wizardry (Imaginary place) -- Juvenile fiction, Hogwarts School of Witchcraft and Wizardry (Imaginary place), Harry Potter (Fictitious character), Potter, Harry (Fictitious character) -- Juvenile fiction, Wizards -- Fiction, Magic -- Fiction, Schools -- Fiction, Magos -- Ficción juvenil, Magia -- Ficción juvenil, Escuelas -- Ficción juvenil, England -- Fiction, Inglaterra -- Ficción juvenil, Hermione Granger (Fictitious character), Hogwarts School of Witchcraft and Wizardry (Imaginary organization), Ron Weasley (Fictitious character), School stories, Family, Orphans & Foster Homes, Social Themes, Fantasy & Magic, Fictional Works, Bildungsromans, Witches, Friendship, Reading Level-Grade 9, Reading Level-Grade 11, Reading Level-Grade 10, Reading Level-Grade 12, Potter, harry (fictitious character), fiction, Wizards, fiction, Hogwarts school of witchcraft and wizardry (imaginary organization), fiction, England, fiction, Schools, fiction, Magic, fiction, Children's fiction, English literature, Fiction, fantasy, general, Méchanceté, Quête (Littérature), Potter, Harry (Personnage fictif), Large type books, New York Times reviewed, Poudlard (Organisation imaginaire), Écoles, Illusion (performing art), Schools (institutions), Schools (buildings), Child and youth fiction",2007,No page count available,"por, gre, jpn, heb, bul, rus, geo, ger, cze, spa, hin, fre, eng, pol, glg, chi, ben, ita, est, hun, cat, dan",No rating,https://openlibrary.org/works/OL82586W,https://covers.openlibrary.org/b/id/10110415-M.jpg
The Adventures of Sherlock Holmes [12 stories],Arthur Conan Doyle,"I had called upon my friend, Mr. Sherlock Holmes, one day in the autumn of last year and found him in deep conversation with a very stout, florid-faced, elderly gentleman with fiery red hair.","Classic Literature, Murder, Mystery, Conclusions, amorality, Anglo-Saxons, Apaces, aristocracy, banks, barques, beryls, brain fever, bushrangers, cabinet cards, carbuncles, Christmas dinners, churches, Classic fiction, Classics, commissionaires, Confederate States Army, coronets, counterfeit money, crime, Crime & Mystery Fiction, darkrooms, Detective and mystery stories, detective fiction, electric blue, Encyclopædia Britannica, English Children's stories, English Detective and mystery stories, English Mastiffs, English Short stories, fiction, footprints, Fuller's earth, governesses, half-pennies, History, Honourable Society of the Inner Temple, hydraulic presses, jewellery, Juvenile fiction, Juvenile literature, Ku Klux Klan, lascars, locked-room mysteries, maids, Mystery and detective stories, Mystery and Suspense, opium dens, pawnbrokers, pennies, police inspectors, prima donnas, Private investigators, Private investigators in fiction, prospecting, red hair, revolvers, sailing ships, Short Stories, smoke bombs, snow, thumbs, Adventures of Sherlock Holmes (Doyle, Arthur Conan), John H. Watson (Fictitious character), Sherlock Holmes (Fictitious character), Influence, Influence (Literary, artistic, etc.), Sherlock (Television program : 2010- ), Large type books, LITERARY CRITICISM / European / English, Irish, Scottish, Welsh, Fiction, mystery & detective, general, Fiction, suspense, Holmes, sherlock (fictitious character), fiction, Private investigators, fiction, England, fiction, Fiction, mystery & detective, historical, Doyle, arthur conan, sir, 1859-1930, fiction, Watson, john h. (fictitious character), fiction, Fiction, mystery & detective, traditional, Fiction, short stories (single author), English literature, Mystery and detective, Bibliography, Detectives in literature, Children's stories, English, Children's fiction, Fiction, thrillers, suspense, British and irish fiction (fictional works by one author), Fiction, mystery & detective, collections & anthologies, Fiction, action & adventure, Fiction, general, Nowele kryminalne angielskie, Tłumaczenia polskie, Detective Verhalen Nederlands Sherlock Holmes Avonturen",1892,No page count available,"chi, dut, cat, gle, fre, pol, ger, gre, mon, und, spa, tur, may, por, jpn, rus, eng",No rating,https://openlibrary.org/works/OL262421W,https://covers.openlibrary.org/b/id/6717853-M.jpg
Harry Potter and the Philosopher's Stone,J. K. Rowling,"Bhí conai ar mhuintir Dursley in uimhir a ceathair Privet Drive, agus é le smaiomh acu go raibh siad an-normalta go deo, agus iad bréa sasta de.","Ghosts, Monsters, Vampires, Witches, Challenges and Overcoming Obstacles, Magic and Supernatural, Cleverness, School Life, school stories, Wizards, Magic, MAGIA, MAGOS, Juvenile fiction, Fiction, NOVELAS INGLESAS, Schools, orphans, fantasy fiction, England in fiction, Witches in fiction, Wizards in fiction, Alchemy, New York Times bestseller, Juvenile literature, Magic in fiction, Open Library Staff Picks, Juvenile audience, Children's stories, Juvenile works, Schools in fiction, Fantasy, Hogwarts School of Witchcraft and Wizardry (Imaginary place), Harry Potter (Fictitious character), Ficción juvenil, Escuelas, Hogwarts School of Witchcraft and Wizardry (Imaginary organization), Translations from English, Chinese fiction, Hermione Granger (Fictitious character), Reading Level-Grade 9, Reading Level-Grade 11, Reading Level-Grade 10, Reading Level-Grade 12, Hogwarts school of witchcraft and wizardry (imaginary organization), fiction, Children's fiction, Schools, fiction, England, fiction, Potter, harry (fictitious character), fiction, Wizards, fiction, Magic, fiction, Fiction, fantasy, general, Large type books, Magier, Fabeltiere, Lehrling, Kinderbuch, Stein der Weisen, Ungeheuer, Junge, English language, Translating into Welsh, Modern history to 20th century: c 1700 to c 1900, Literary theory, English literature, Ron Weasley (Fictitious character), Latin language materials, Romans, nouvelles, etc. pour la jeunesse, Poudlard, école de sorcellerie (Organisation imaginaire), Sorciers, Sorcières, Magie, Internats, Adventure and adventurers, fiction, Action & Adventure, Fantasy & Magic, Social Themes, Friendship, Harry Potter (Fictional character), Friendship, fiction, German language materials, Witchcraft, fiction, Wizard, NOVELAS FANTÁSTICAS, NOVELAS JUVENILES INGLESAS, LITERATURA JUVENIL ESTADOUNIDENSE, Écoles, Hechicería, Novela juvenil, Ingleterra, Mystery, roman, English Fantasy literature, Translations into Marathi, English fiction, Translations into Chinese, Children - harry potter, Teen fiction, Children - fiction & literature, Science fiction & fantasy, Fiction - people, Places & cultures, Adventure, Supernatural",1997,No page count available,"ara, ukr, afr, pol, ger, vie, dan, grc, ben, hin, wel, ltz, chi, gla, gle, fre, fin, lat, ita, tur, swe, kor, heb, ice, dut, cat, cze, spa, lit, tib, gre, eng, rus, per, hrv, tha, kal, mar, urd, lav, hun, por, rum, jpn, bul, alb",No rating,https://openlibrary.org/works/OL82563W,https://covers.openlibrary.org/b/id/10521270-M.jpg
Alice's Adventures in Wonderland / Through the Looking Glass,Lewis Carroll,"Alice was beginning to get very tired of sitting by her sister on the bank, and of having nothing to do: once or twice she had peeped into the book her sister was reading, but it had no pictures or conversations in it, ""and what is the use of a book,"" thought Alice, ""without pictures or conversations?""","adventure and adventurers, adventure and adventurers, fiction, adventure stories, adventure travel, animals, anthropomorphism, artists' illustrated books, books and reading, british and irish fiction (fictional works by one author), child and youth fiction, children, children's fiction, children's literature, children's literature, english, children's stories, children's stories, english, classic literature, classics, croquet, curiosity, curiosity in children, english, english adventure stories, english fantastic fiction, english fantasy fiction, english fantasy literature, english language, english literature, english nonsense verses, fairy tales, fantasy, fantasy & magic, fantasy fiction, fantasy in fiction, fantasy  magic, fiction, friendship, girls, girls, fiction, hookahs, humor, humorous stories, illustrations, imaginary places, imagination & play, juvenile fiction, juvenile literature, legends, literary nonsense, logic, mythical animals, nonsense verses, playing cards, rabbits, readers, reading materials, short novel, tea, texts, Specimens, Textual Criticism, Criticism and interpretation, Open Library Staff Picks, Ficción juvenil, Novela fantástica, Portuguese language materials, Fantasía, History, History and criticism, CHR 1960, PRO Tehon, Susan (donor), Alice (Fictitious character : Carroll), PRO Tehon, Atha (former owner) (Tehon Collection copy), Littérature anglaise, 18.05 English literature, Alice (fictitious character : carroll), fiction, Fiction, fantasy, general, Carroll, lewis, 1832-1898, Large type books, Translations into French, JUVENILE FICTION / Action & Adventure / General, JUVENILE FICTION / Classics, JUVENILE FICTION / Fairy Tales & Folklore / Adaptations, English fiction (collections), 20th century, Rabbits, fiction, English fiction, Picture books, Alice (Fictitious character), Accessible book, Condensed books, Through the looking glass, Alice's adventures in Wonderland (Carroll, Lewis), Through the looking-glass (Carroll, Lewis), Literature, Translations into Polish, Imaginary Voyages, Literatură engleză, Roman, Literatură pentru copii, Novela fantástica inglesa, Traducciones al español, Literatura inglesa, Flickor, Barn- och ungdomslitteratur, Drömmar, Fantasiresor, Parallella världar, Fiction, general, Philosophy, Literature, collections, Tong hua, Zuo pin ji, Philosophy in literature",1889,No page count available,"chi, fre, pol, ger, spa, ita, por, rum, und, rus, eng",No rating,https://openlibrary.org/works/OL151411W,https://covers.openlibrary.org/b/id/8595966-M.jpg
Harry Potter and the Chamber of Secrets,J. K. Rowling,"Ce n’était pas la première fois qu’une dispute éclatait au petit déjeuner dans la maison du 4, Privet Drive. Mr Vernon Dursley avait été réveillé à l’aube par un hululement sonore qui provenait de la chambre de son neveu Harry.","Fantasy fiction, school stories, Fiction, Fantasy, Nestlé Smarties Book Prize winner, Juvenile fiction, Wizards, Magic, Schools, Spanish language materials, Magia, Escuelas, Ficción juvenil, Novela fantástica, Hogwarts School of Witchcraft and Wizardry (Imaginary place), Harry Potter (Fictitious character), Wizards -- Juvenile fiction, Witches, Hogwarts School of Witchcraft and Wizardry (Imaginary organization), Magos, Translations from English, Chinese fiction, Orphans, Aunts, Uncles, Cousins, Determination (Personality trait) in children, Friendship, Potter, Harry (Fictitious character), Witches Fiction, Wizards Fiction, Schools Fiction, England Fiction, Magic -- Juvenile fiction, Hogwarts School of Witchcraft and Wizardry (Imaginary place) -- Juvenile fiction, Schools -- Juvenile fiction, Wizards -- Fiction, Magic -- Fiction, Schools -- Fiction, England -- Juvenile fiction, England -- Fiction, Fantasy & Magic, Action & Adventure, Witchcraft, Harry Potter (Fictional character), Engels, Social Themes, Reading Level-Grade 11, Reading Level-Grade 12, Schools, fiction, England, fiction, Potter, harry (fictitious character), fiction, Hogwarts school of witchcraft and wizardry (imaginary organization), fiction, Wizards, fiction, Magic, fiction, Children's fiction, Adventure and adventurers, fiction, English literature, Fiction, fantasy, general, Large type books, Hermione Granger (Fictitious character), Ron Weasley (Fictitious character), Latin language materials, Children's stories, Magiciens, Romans, nouvelles, etc. pour la jeunesse, Nécromancie, Écoles, Potter, Harry (Personnage fictif), Romans, nouvelles, Magie, Family, Orphans & Foster Homes, Magía, Novela juvenil, Juvenile, Children's stories, English, Sieg, Basilisk, Das Böse, Das Gute, Internat, Lebensgefahr, Lebensrettung, List, Magier, Jugendbuch, Kampf, Schule, Basilisk (Fabeltier), Junge, Phönix, Deutschland Grenzschutzkommando Mitte Schule, Deutschland, Friendship, fiction, Hogwartes School of Witchcraft and Wizardry (Imaginary place), General, Social Issues, Witches, fiction, English Fantasy literature, Translations into Marathi, Humor, Toy and movable books, New York Times bestseller, Specimens, Juvenile literature, Adventure, Open Library Staff Picks, Books and reading, Blind, Braille books",1998,No page count available,"ara, ukr, pol, ger, vie, dan, hin, chi, fre, fin, lat, ita, tur, swe, heb, dut, cze, spa, lit, tib, gre, rus, eng, per, tha, mar, urd, hun, por, rum, jpn, bul, alb",No rating,https://openlibrary.org/works/OL82537W,https://covers.openlibrary.org/b/id/8392798-M.jpg
The Great Gatsby,F. Scott Fitzgerald,In my younger and more vulnerable years my father gave me some advice that I've been turning over in my mind ever since.,"Married people, fiction, American fiction (fictional works by one author), Fiction, psychological, Long island (n.y.), fiction, Fiction, Rich people, Mistresses, Married women, Traffic accidents, First loves, Revenge, American Manuscripts, Facsimiles, Manuscripts, Antiheroes, l fiction, Man-woman relationships, fiction, Upper class, American literature, Young adult fiction, comics & graphic novels, classic adaptation, Young adult fiction, social themes, class differences, Young adult fiction, classics, Fiction, historical,  New york (n.y.), fiction"", Comic books, strips, Love, YOUNG ADULT FICTION, Comics & Graphic Novels, Classic Adaptation, Social Themes, Class Differences, Historical, Literary, Man-woman relationship, Rich, Criticism and interpretation, Drama, Modern fiction, Classics, Literature, Open Library Staff Picks, Wealth, Readers, Economic conditions, American fiction, Social life and customs, Long Now Manual for Civilization, Fictional Works Publication Type, Rich people -- Fiction, Romance fiction, Long Island (N.Y.) -- Fiction, Psychological fiction, Love stories, Novela, Relaciones hombre-mujer, Spanish language materials, Nouveau riche, Reading Level-Grade 11, Reading Level-Grade 12, FICTION / General, Moral conditions, Manners and customs, Fitzgerald, f. scott (francis scott), 1896-1940, Large type books, Nineteen twenties, English fiction, New york (state), fiction, Wives, Relations entre hommes et femmes, Romans, nouvelles, Classes supérieures, Nouveaux riches, Premier amour, Riches, Maîtresses, Vengeance, Roman américain, Textual Criticism, Great Gatsby (Fitzgerald, F. Scott), Romance Norte Americano, Fiction, friendship, Fiction, classics, Adultery, Accidents de la route, Millionaires, American Dream, Millionnaires, Rêve américain, Années vingt (Vingtième siècle), Tránsito, Accidentes, Mujeres casadas, Primer amor, Cuentos de amor, Fiction, city life, Fiction, romance, historical, american, Fiction, romance, historical, 20th century, Fiction, historical, world war i, Traffic accidents--Fiction, First loves--Fiction, Rich people--Fiction, Mistresses--Fiction, Revenge--Fiction, Long Island (N.Y.)--Fiction, Novel, American fiction (collections), 20th century, Fiction, fantasy, romance, Fiction, action & adventure, Translations into Chinese, American literature, history and criticism, 19th century, Chang pian xiao shuo, New York (State), First loves -- Fiction, Rich people -- New York (State) -- New York -- Fiction, New York (State) -- Long Island, New York (State) -- New York, Fictional works [publication type], Man-woman relationships--new york (state)--long island--fiction, Upper class--new york (state)--long island--fiction, Ps3511.i9 g7 1995b, 813/.52, Fiction, general, Fiction, romance, general, Man-woman relationships",1920,No page count available,"eng, kor, swe, fre, ger, dan, ind, heb, jpn, rum, por, pol, chi, dut, ita, spa",No rating,https://openlibrary.org/works/OL468431W,https://covers.openlibrary.org/b/id/10590366-M.jpg
A Christmas Carol,"Charles Dickens, Ricardo Abraham, Arthur Rackham, John Leech, Harry Furniss, Luis Barthe, Viggo Johansen, Federigo Verdinois, Lluís Nonell i Brunés, David Aliaga Muñoz, Julius Seybt, Edward Aubrey Moriarty","Marley was dead, to begin with.","Ghost stories, Readers, Ebenzer Scrooge (Fictitious character), open_syllabus_project, Cartoons and comics, Promptbooks, Christmas stories, French language books, Poor families, Navidad, Esperanto, Sick children, French language, Repentance, Criticism and interpretation, Facsimiles, Christmas, English Manuscripts, English Christmas stories, Fiction,, Poor, Empathy, Animals, Adaptations, Recluses, French language edition, Translations into Portuguese, Comic books, strips, Recitations, Generosity, Literary collections, Cuentos de fantasmas, London(England), Children's stories, Ficción, Manners and customs, Fiction, Misers, History, Ebenezer Scrooge (Fictitious character), Social life and customs, Trials (Breach of promise), England, Vida social y costumbres, Juvenile fiction, Fantasmas, Bible stories, Texts, Cuentos de Navidad, Scrooge, Ebenezer (Personaje literario), Social conditions, Ghosts, Juvenile literature, Scrooge, Ebenezer (Fictitious character), High interest-low vocabulary books, Pictorial works, Short stories, Christmas, fiction, Children's fiction, Scrooge, ebenezer (fictitious character), fiction, England, fiction, Ghosts, fiction, British and irish fiction (fictional works by one author), Drama (dramatic works by one author), London (england), fiction, Coloring books, Child and youth fiction, Fiction, historical, Child and youth non-fiction, Carols, Children's songs, Holidays, fiction, Fiction, ghost, English literature, Parody, General, Zombies, Literature and fiction, juvenile, Literature and fiction, historical fiction, Large type books, Fantasy fiction, Songs, Christmas, juvenile literature, Conduct of life, Toy and movable books, Specimens, English Ghost stories, Illustrations, Classics, Christmas carol (Dickens, Charles), Fiction, historical, general, Great britain, fiction, Fiction, humorous, general, Fiction, general, Fiction, action & adventure, Fiction, suspense, Weihnachten, Nächstenliebe, Englisch, Gespenstergeschichte, Avarice, Novela juvenil, Fiction, christian, general, Greece, fiction, Literature and fiction, horror and ghost stories, Noël, Contes, Spanish language materials, Familles pauvres, Romans, nouvelles, Avares, Spanish language, Reading materials, Histoires de Noël, Fiction, religious, Christmas, poetry, Color, juvenile literature, English language, Study and teaching, Romans, Littérature, Enseignement des langues, Autoformation, Protected DAISY, In library, Comic books, strips, etc., Fiction, fantasy, general, Family, Publishers and publishing, Christmas trees, Redemption, Habsucht, Egoismus, Bekehrung, Nineteenth century,, Romans, nouvelles, etc. pour la jeunesse, Mœurs et coutumes, Readers for new literates, Animals, fiction, British and irish drama (dramatic works by one author), Art, Nowele angielskie, Tłumaczenia polskie, Boże Narodzenie, Nowele, Fiction, thrillers, suspense, Fiction, short stories (single author), Literature, collections, Classic Literature, Drama, Fiction, holidays, Fiction, classics, Reading, remedial teaching, Elementary education of adults, Family, fiction, Sick, fiction, Christmas music",1843,No page count available,"ukr, pol, ger, wel, chi, gle, fre, fin, epo, ita, und, kor, dut, spa, rus, eng, por, jpn, glg",No rating,https://openlibrary.org/works/OL8193497W,https://covers.openlibrary.org/b/id/13299222-M.jpg
