Title,Author,Description,Category,Published Date,Page Count,Language,Average Rating,Preview Link,Thumbnail
Mockingjay,Suzanne Collins,No description available,"Insurgency, Survival, Fiction, Science fiction, Interpersonal relations, Television programs, Large type books, Contests, Survival skills, Young adult fiction, Juvenile fiction, Revenge, Children's stories, Survival Stories, Dystopian, Self-Esteem & Self-Reliance, Action & Adventure, Social Themes, Television game shows, Dystopias, Girls, Courage, Children's fiction, Television, fiction, Contests, fiction, Survival, fiction, Interpersonal relations, fiction, Reading Level-Grade 7, Reading Level-Grade 9, Reading Level-Grade 8, Reading Level-Grade 11, Reading Level-Grade 10, Reading Level-Grade 12, Katniss Everdeen (Fictitious character), Reality television programs, nyt:series-books=2010-09-12, New York Times bestseller, New York Times reviewed, Telerealites, Romans, Dystopies, Science-fiction, Dictature, Television-verite, Concours et competitions, Habiletes de survie, Spanish language materials, Révoltes, Romans, nouvelles, etc. pour la jeunesse, Habiletés de survie, Supervivencia, Novela juvenil, Televisión, Programas, Relaciones humanas, Novela joven, Spanish language, Reading materials, Téléréalité, Insurgency -- Juvenile fiction, Survival -- Juvenile fiction, Television programs -- Juvenile fiction, Interpersonal relations -- Juvenile fiction, Contests -- Juvenile fiction, Insurgency -- Fiction, Survival skills -- Fiction, Television programs -- Fiction, Interpersonal relations -- Fiction, Contests -- Fiction",2010,No page count available,"fre, eng, spa, rus, ger, pol, chi",No rating,https://openlibrary.org/works/OL15413843W,https://covers.openlibrary.org/b/id/12646459-M.jpg
The  black arrow,Robert Louis Stevenson,"Sir Daniel and his men lay in and about Kettley that night, warmly quartered and well patrolled.","Knights and knighthood, War stories, Adventure stories, Adventure and adventurers, Guardian and ward, Juvenile fiction, Fiction, Outlaws, Open Library Staff Picks, Historical fiction, Young men, War, History, Wars of the Roses (Great Britain : 1455-1485) fast (OCoLC)fst01355312, Children's fiction, Great britain, fiction, Great britain, history, wars of the roses, 1455-1485, fiction, British and irish fiction (fictional works by one author), Fiction, historical, Fiction, coming of age, Fiction, war & military, Large type books, Classic Literature, Wars of the Roses, 1455-1485, Fiction, historical, general, Crime, fiction, Rosornas krig, Storbritannien, 1455-1485, Skönlitteratur, Fiction, action & adventure, England, fiction",1888,No page count available,"spa, eng, und, rus, geo",No rating,https://openlibrary.org/works/OL24161W,https://covers.openlibrary.org/b/id/8239493-M.jpg
The Price of Salt,Patricia Highsmith,The lunch hour in the co-workers' cafeteria at Frankenberg's had reached its peak.,"collectionID:Sleazy_pulp, Fiction, Lesbians, Lesbian romance novel, Lesbian love story, Divorce, Child custody, Road trip, Fiction, action & adventure, Social conditions, Family relationships, Mothers, Automobile travel, Nineteen fifties, Custody of children, Lesbians, fiction, Fiction, romance, general, Fiction, lesbian, Fiction, romance, fantasy, LGBTQ novels, Romance, Lesbian, Media Tie-In, Fiction, mystery & detective, general, Fiction, lgbtq+, lesbian, Fiction, lgbtq+, gay, LGBTQ novels before Stonewall, Classics, Literary, Psychological, English & college success -> english -> fiction",1952,No page count available,"chi, kor, ita, spa, ger, eng",No rating,https://openlibrary.org/works/OL59448W,https://covers.openlibrary.org/b/id/250778-M.jpg
Nostromo,Joseph Conrad,"IN the time of Spanish rule, and for many years afterwards, the town of Sulaco-the luxuriant beauty of the orange gardens bears witness to its antiquity - had never been commercially anything more important than a coasting port with a fairly large local trade in ox-hides and indigo.","Fiction, Revolutions, Revolutions in fiction, Sailors, Sailors in fiction, Latin America in fiction, English Sea stories, Classic Literature, Manners and customs, FICTION / Classics, British and irish fiction (fictional works by one author), Fiction, political, Fiction, sea stories, Latin america, fiction, Large type books, English literature, Literatura inglesa, Romance, Political fiction, Sea stories, English fiction, Literature, General, Fiction, general, Fiction, action & adventure, Sailors -- Fiction, Revolutions -- Fiction, Latin America -- Fiction",1900,No page count available,"eng, fre, ger, pol, und, ita, spa",No rating,https://openlibrary.org/works/OL38700W,https://covers.openlibrary.org/b/id/6545112-M.jpg
The Martian,"Andy Weir, R.C. Bray",I'm pretty much screwed.,"Science-Fiction, Science Fiction & Fantasy, Suspense & Thriller, Science fiction, Amerikanisches Englisch, Astronauts, Survival, Fiction, Survival skills, Supervivencia, Novela, Astronautas, Reading Level-Grade 7, Reading Level-Grade 9, Reading Level-Grade 8, Reading Level-Grade 11, Reading Level-Grade 10, Reading Level-Grade 12, Fiction, science fiction, action & adventure, Fiction, science fiction, general, Large type books, Arabic language materials, Romans, nouvelles, nyt:hardcover-fiction=2014-03-02, New York Times bestseller, Chang pian xiao shuo, Children's fiction, Adventure and adventurers, fiction, Fantasy fiction",2011,No page count available,"chi, rum, por, dan, kor, ara, ger, fre, hun, spa, ind, pol, dut, eng, ita",No rating,https://openlibrary.org/works/OL17091839W,https://covers.openlibrary.org/b/id/11447888-M.jpg
Island of the Blue Dolphins,Scott O'Dell,"Ich erinnere mich lebhaft an den Tag, an dem das Alëuterschiff kam.","Fiction, Indians of North America, Islands, Juvenile fiction, Newbery Medal, Survival, Survival skills, Brothers and sisters, Curricula, Survival Stories, Action & Adventure, Wilderness survival, Young women, People & Places, Native American, Girls & Women, Children's fiction, Indians of north america, fiction, Islands, fiction, Survival, fiction, Large type books, Indians of mexico, fiction, California, fiction, Chumash women, Dolphins, Human-animal relationships, Newbery Medal books, Islas, Indios de América del Norte, Novela juvenil, Jóvenes (Mujeres), Ficción juvenil, Shipwreck survival, Supervivencia, Novela, Marine animals, fiction, American fiction, Translations into Chinese, Language Arts - General, Juvenile Nonfiction, Children: Grades 4-6, San Nicolas Island (Calif.), Water security, Foreign relations, Bibliography, award:Newbery_award, lexile:1000, lexile_range:1001-1100, age:min:8, age:max:11, grade:min:3, grade:max:7",1960,No page count available,"chi, kor, alb, spa, und, ger, eng",No rating,https://openlibrary.org/works/OL4466828W,https://covers.openlibrary.org/b/id/5021868-M.jpg
The Girl Who Loved Tom Gordon,Stephen King,"Die Welt hatte Zähne, und sie konnte damit zubeißen, wann immer sie wollte.","Little House on the Prairie, psychological fiction, adventure stories, suspense, thrillers, Adventure fiction, audiobooks, Open Library Staff Picks, Boston Red Sox, Pitchers (Baseball), Fiction, Children of divorced parents, Mountain life, Large type books, Fiction, horror, New england, fiction, Fiction, suspense, Protected DAISY, Accessible book, Fiction, action & adventure, Fiction, psychological, Baseball players, fiction",1999,No page count available,"pol, ita, cze, por, fre, eng, spa, rus, ger",No rating,https://openlibrary.org/works/OL81612W,https://covers.openlibrary.org/b/id/14653580-M.jpg
The Sea-Wolf,Jack London,"I SCARCELY know where to begin, though I sometimes facetiously place the cause of it all to Charley Furuseth's credit.","Fiction, Ship captains, Sealing ships, Sealing ships in fiction, Ship captains in fiction, Arctic Regions in fiction, Sealers (Persons), Sealing in fiction, Sealing, Translations into Russian, Sea stories, American Sea stories, American Adventure stories, Sailors, Sealers (Persons in fiction, Sealers (Persons, Sailors in fiction, Allegories, Survival after airplane accidents, shipwrecks, Society of Friends, American fiction (fictional works by one author), Large type books, Museums, Sugarcane industry, Rum industry, Museo Castillo Serrallés, Fiction, sea stories, Translations into Spanish, Cuentos de mar estadounidenses, Traducciones al español, Arctic regions, fiction, Fiction, action & adventure, Fiction, general, Ship captains -- Fiction, Arctic regions -- Fiction, Sealers (Persons) -- Fiction, Sealing ships -- Fiction, Художественная литература -- США -- Американская литература -- нач. 20 в. -- Романы. Повести",1900,No page count available,"spa, yid, eng, fre, rus, lav, swe, vie, fin, por, chi, ger",No rating,https://openlibrary.org/works/OL144824W,https://covers.openlibrary.org/b/id/8236975-M.jpg
The Adventures of Captain Underpants,Dav Pilkey,Estos son Jorge Betanzos y Berto Henares.,"Humorous stories, School principals, Cartoons and comics, Heroes, Fiction, American Humorous stories, Children's stories, American, Extraterrestrial beings, Juvenile fiction, Captain Underpants (Fictitious character), Science fiction, Schools, Children's fiction, Adventure and adventurers, fiction, Héroes, Ficción juvenil, Superintendentes y directores, Escuelas, Metamorphosis, Cuentos humorísticos, Child authors, Caricatures and cartoons, Heroes and heroines, School superintendents and principals, Humorous fiction, Niños autores, Metamorfosis (Biología), Novela infantil, Spanish language materials, Captain underpants (fictitious character), fiction, Heroes, fiction, Schools, fiction, Còmics, Llibres per a infants, Escola, Narrativa per a infants, Teachers, Bobette, Capitaine (Personnage fictif), Romans, nouvelles, etc. pour la jeunesse, Écoles, Enseignants, Directeurs d'école, Héros, Récits humoristiques, Action & Adventure, Social Themes, Friendship, Spanish language, H?eroes, Captain Underpants (Fictional character), School stories, New York Times reviewed",1997,No page count available,"chi, fre, ita, cat, por, spa, eng",No rating,https://openlibrary.org/works/OL14871228W,https://covers.openlibrary.org/b/id/12625278-M.jpg
Captains Courageous,Rudyard Kipling,"THE weather door of the smoking-room had been left open to the North Atlantic fog, as the big liner rolled and lifted, whistling to warm the fishing-fleet.","Teenage boys, Fishers, Fiction, Interpersonal relations, Reading, Literature, Fisher (Mammal), Self-perception, Children of the rich, Open Library Staff Picks, Classic Literature, Reading (Secondary), Sea stories, Seafaring life, Reading interests, Rescues, Remedial teaching, Juvenile fiction, Fishing boats, Coming of age, Saltwater fishing, Adventure and adventurers, English, Irish, Scottish, Welsh, LITERARY CRITICISM, European, British and irish fiction (fictional works by one author), Fiction, action & adventure, Large type books, Fishing, fiction, Children's fiction, Self-perception, fiction, Interpersonal relations, fiction, Récits de mer, Comic books, strips, Roman, Récits et Légendes, Pêche, Mer, Protected DAISY, Accessible book, Captains courageous (Motion picture), Boys, Fiction, coming of age, Fiction, sea stories, Romans, nouvelles, Enfants de riches, Pêche en mer (Sport), Bateaux de pêche, Garçons adolescents, Sauvetages, Pêcheurs, Adventure and adventurers, fiction, New england, fiction, Schooners",1896,No page count available,"und, spa, ger, swe, fre, eng",No rating,https://openlibrary.org/works/OL19842W,https://covers.openlibrary.org/b/id/12819857-M.jpg
Sphere,"Michael Crichton, Jacques Polanis",FOR A LONG TIME THE HORIZON HAD BEEN A MONOTOnous flat blue line separating the Pacific Ocean from the sky.,"space ships, space vehicles, squid, psychology, giant squid, Twenty Thousand Leagues Under the Sea, explosives, diving chambers, claustrophobia, psychologists, mathematicians, zoologists, astrophysicists, marine biologists, United States Navy, deep sea habitats, time travel, Life on other planets, Open Library Staff Picks, Juvenile fiction, Scientists, Fiction, Science fiction, Fiction, action & adventure, Chang pian xiao shuo, Fiction, science fiction, general",1980,No page count available,"tur, jpn, eng, fre, chi, spa, pol, por, dut, gre, ger",No rating,https://openlibrary.org/works/OL46917W,https://covers.openlibrary.org/b/id/9254423-M.jpg
The World Set Free,"H. G. Wells, Ellen Marriage, Paula Benitez","The problem which was already being mooted by such scientific men as Ramsay, Rutherford, and Soddy, in the very beginning of the twentieth century, the problem of inducing radio-activity in the heavier elements and so tapping the internal energy of atoms, was solved by a wonderful combination of induction, intuition, and luck by Holsten so soon as the year 1933.","Nuclear warfare, Imaginary wars and battles, Fiction, British and irish fiction (fictional works by one author), Fiction, action & adventure, Fiction, science fiction, general",1914,No page count available,eng,No rating,https://openlibrary.org/works/OL52257W,https://covers.openlibrary.org/b/id/8246099-M.jpg
The Phantom Tollbooth,Norton Juster,"There was once a boy named Milo who didn't know what to do with himself-not just sometimes, but always.","letters, numbers, orchestras, children's literature, adventure, Creativity and Imagination, Boredom, Magic and Supernatural, Discovery and Learning, American Fantasy fiction, Children's stories, American, Fantasy, Ficción juvenil, Fiction, Imaginación, Imagination, Language and languages, Lenguaje y lenguas, Novela fantástica, children's fantasy, puns, tollbooths, Puns and punning, Fantasy fiction, Juvenile fiction, Imagination in children, Criticism and interpretation, Science Fiction, Fantasy, & Magic, Children's 9-12 - Literature - Classics / Contemporary, Spanish: Grades 4-7, Spanish language materials, Readers - Chapter Books, Action & Adventure, Classics, Non-Classifiable, Action & Adventure - General, Children's fiction, Imaginary Voyages, Children's stories, Large type books, New York Times reviewed, Magic, fiction, Boys, Learning and scholarship, Male authors, Illustrated children's books, Specimens, Garçons, Romans, nouvelles, etc. pour la jeunesse, Savoir et érudition, Livres illustrés pour enfants, Spécimens, Spanish language, Children's books, Ennui (Lassitude), Fantasmes, Fantasía, Novela juvenil, Relatos de aventura, Fantasy--juvenile fiction, Pz7.j9865 ph 1996, [fic], Alphabet, Arithmetic, Adventure stories, Arithmétique, Histoires pour enfants",1961,No page count available,"chi, fre, ita, rus, spa, und, heb, eng",No rating,https://openlibrary.org/works/OL1636262W,https://covers.openlibrary.org/b/id/8578174-M.jpg
La planète des singes,Pierre Boulle,"Jinn et Phyllis passaient des vacances merveilleuses, dans l'espace, le plus loin possible des astres habités.","French language edition, Fiction, Monkeys, Fiction, science fiction, action & adventure, Science fiction, Apes, Sci-Fi, Movies, Motion Pictures, Films, Revolution, Social role, Fiction, science fiction, general",1963,No page count available,"fre, rus, por, spa, eng",No rating,https://openlibrary.org/works/OL1319418W,https://covers.openlibrary.org/b/id/1009545-M.jpg
Eragon,Christopher Paolini,No description available,"Fantasy, Juvenile fiction, Dragons, Magic, Fiction, violence, dwarves, humans, fighting, adventure, war, elves, young adult fiction, Action & Adventure, Fantasy fiction, American Fantasy fiction, Mythical Creatures, Animals, Epic, Youths' writings, nyt:series-books=2008-10-05, New York Times bestseller, Heather's Pick, Magia, Adventure and adventurers, nyt:series_books=2011-06-11, Ficción juvenil, Novela fantástica, Science Fiction, Fantasy, & Magic, Fiction - Science Fiction, Fiction - Fantasy, Spanish: Grades 3-4, Fantasy - General, Fairy Tales & Folklore - General, Fairy Tales & Folklore - Single Title, Reading Level-Grade 7, Reading Level-Grade 6, Reading Level-Grade 9, Reading Level-Grade 8, Reading Level-Grade 11, Reading Level-Grade 10, Reading Level-Grade 12, Children's fiction, Dragons, fiction, Spanish language materials, Dragones, Novela juvenil, Adventure and adventurers, fiction, Magic, fiction, Romans, nouvelles, etc. pour la jeunesse, Fantasmes, Young men, Juvenile literature, Roman pour la jeunesse",1998,No page count available,"chi, fre, ita, por, spa, ger, pol, eng",No rating,https://openlibrary.org/works/OL5819895W,https://covers.openlibrary.org/b/id/13921600-M.jpg
The Chronicles of Narnia,C.S. Lewis,"ONCE THERE WERE FOUR CHILDREN whose names were Peter, Susan, Edmund, and Lucy, and it has been told in another book called The Lion, the Witch and the Wardrobe how they had a remarkable adventure.","Fantasy fiction, Fiction, Juvenile works, Juvenile fiction, Juvenile audience, good and evil, children, fantasy, Action and adventure fiction, Princes, Fairy tales, Friendship, Witches, the Blitz, fauns, Turkish Delight, lions, English Children's stories, Fantasy & Magic, Action & Adventure, Classics, English Fantasy fiction, Winter, Science Fiction & Fantasy, English Christian fiction, Leones, christianity, Brujas, Magic, Children's stories, English, Ficción juvenil, Novela fantástica, siblings, Bien y mal, Lion, Animals Action & Adventure, JUVENILE FICTION / Legends, Myths, Fables, JUVENILE FICTION / Fantasy & Magic, Narnia (Imaginary place), JUVENILE FICTION / Classics, Children's fiction, Narnia (imaginary place), fiction, Magic, fiction, Child and youth fiction, Fiction, fantasy, general, Lewis, c. s. (clive staples), 1898-1963, Fantasy fiction, history and criticism, Literary recreations, Questions and answers, Princesses, fiction",1970,No page count available,"spa, pol, eng, rus",No rating,https://openlibrary.org/works/OL70988W,https://covers.openlibrary.org/b/id/9321656-M.jpg
The Day of the Triffids,"John Wyndham, Marcel Battin, Cover by Andy Bridge, Catalina Martinez Munoz","When a day that you happen to know is Wednesday starts off by sounding like Sunday, there is something seriously wrong somewhere.","Blind, English Fantasy fiction, Translations into Russian, Science Fiction & Fantasy, Horror, Fiction in English, Fiction, Meteorites, Science fiction, Fantasy fiction, English, Classic Literature, Plant mutation, Fiction, science fiction, general, Large type books, Carnivorous plants, Plants, Blindness, Extraterrestrial beings, Human-alien encounters, 18.05 English literature, Fiction, science fiction, action & adventure",1951,No page count available,"ita, rus, dut, spa, eng",No rating,https://openlibrary.org/works/OL1911336W,https://covers.openlibrary.org/b/id/535027-M.jpg
Stardust,Neil Gaiman,There was once a young man who wished to gain his Heart's Desire.,"Young men, Fiction, Brujas, underworld, Magia, Quests (Expeditions), Jóvenes (Hombres), Fantasy, Novela fantástica, Witches, Magic, Ficción, Búsquedas (Expediciones), Young men -- Fiction, England -- Fiction, Comics & graphic novels, fantasy, Comics & graphic novels, historical fiction, England, fiction, Fiction, fantasy, historical, Fiction, romance, fantasy, Fiction, action & adventure, Movie novels, Alex award, Juvenile fiction, Social life and customs, Love stories, Fairy Story, Meteors, Meteoros, Ficción juvenil, Estrellas fugaces, Jóvenes (Varones), Spanish language materials, Literature, Stardust (Motion picture), Manners and customs, nyt:e-book-fiction=2013-12-22, New York Times bestseller, Man-woman relationship, Adventure fiction, Fairies, Voyages and travels, Comics & graphic novels, fantasy, general, Comics & graphic novels, historical fiction, general",1997,No page count available,"spa, eng, tur",No rating,https://openlibrary.org/works/OL15833328W,https://covers.openlibrary.org/b/id/8216379-M.jpg
The Celestine Prophecy - An Adventure,James Redfield,"I drove up to the restaurant and parked, then leaned back in my seat to think for a moment.","divinity, synchronicity, reality Maya civilization, Incas, Adventure stories, prophecy, parables, Action and adventure fiction, Aramaic manuscripts, Fiction, Spiritual life, Manuscripts, Collectors and collecting, Spiritual life in literature, Ficción, Vida espiritual, Coleccionistas y colecciones, Manuscritos, New Age, Literatura, Mysticism, Romans, Collectionneurs et collections, Roman, Vie spirituelle, Manuscrits, Millennialism, Travel, Divination, Manucritos, Chang pian xiao shuo, Fiction, religious, Environmental engineering, Large type books, Fiction, visionary & metaphysical, Literature and fiction (general), Parables, 18.06 Anglo-American literature, Celestine prophecy (Redfield, James), Fiction, general, Redfield, james, Manuscripts--collectors and collecting, Manuscripts--collectors and collecting--peru--fiction, Spiritual life--fiction, Manuscripts--collectors and collecting--fiction, Ps3568.e3448 c45 1993c, 813/.54",1993,No page count available,"tur, chi, ita, fre, jpn, spa, ger, eng",No rating,https://openlibrary.org/works/OL53168W,https://covers.openlibrary.org/b/id/8749217-M.jpg
Different Seasons,Stephen King,"There's a guy like me in every state and federal prison in America, I guess-I'm the guy who can get it for you.","first-person narrative, post-traumatic stress disorder, World War II, law school, Vietnam War, Germans, Nazis, war crime, Holocaust, Schutzstaffel, forgery, school counselors, blackmail, safe deposit boxes, bluffing, homelessness, Jews, serial killers, rifles, basements, heart attack, ambulances, gas chambers, Nazi hunters, suicide, prisoners, prisons, frame tale, lawyers, pool, chess, Christmas, decapitation, novellas, first-person, war criminals, SS, guidance counselors, homeless, heart attacks, third person, seasons, good and evil, fantasy fiction, horror fiction, horror tales, escapes, friendship, missing persons, assertiveness, autonomy, American fiction, Adventure fiction, Action and adventure fiction, suspense, horror, audiobooks, World War 1939-1945, Atrocities, Jewish Holocaust, Motion picture fiction, Spanish fiction, Short stories, Fiction, Large type books, Zhong pian xiao shuo, Zuo pin ji, World War, 1939-1945, Holocaust, Jewish (1939-1945), German language, Readers, American literature, Fiction, horror, Fiction, short stories (single author), Storytelling, Polish language materials, Men, Polish language, Materiał w Języku Polskiem, Accessible book, Protected DAISY, Guerre mondiale, 1939-1945, Romans, nouvelles, Atrocités, Holocauste, 1939-1945, Évasions",1982,No page count available,"eng, rus, fre, ger, spa, tur, pol, chi, ita, dut",No rating,https://openlibrary.org/works/OL81621W,https://covers.openlibrary.org/b/id/14655761-M.jpg
Moll Flanders,Daniel Defoe,"My true name is so well known in the records, or registers, at Newgate and in the Old Bailey, and there are some things of such consequence still depending there relating to my particular conduct, that it is not to be expected I should set my name or the account of my family to this work; perhaps after my death it may be better known; at present it would not be proper, no, not though a general pardon should be issued, even without exceptions of persons or crimes.","Fiction, Social life and customs, Criminals, English Picaresque literature, English Adventure stories, Women, Children of prisoners, Prostitutes, Repentance, British, Exile (Punishment), Prostitution, Fiction in Spanish, English fiction, Classic Literature, British and irish fiction (fictional works by one author), London (england), fiction, Virginia, fiction, Criminals, fiction, Fiction, action & adventure, The fortunes and misfortunes of the famous Moll Flanders, Manners and customs, Fiction, general, History, Female offenders, Texts, Criticism and interpretation, English literature, Criminelles, Romans, nouvelles, German, Dictionaries, English language, Korean, Drama, Fortune hunters, Brigands and robbers, General, French, Scottish Chapbooks, Women adventurers, Chapbooks, Specimens, English Chapbooks, Large type books, Fiction, classics, Fiction, coming of age, Enfants de prisonniers, Britanniques, Bannissement, Prostituées, Repentir, Criminels, Femmes, Roman anglais, Children of criminals, Mœurs et coutumes, Guidebooks, Children's fiction, Women, fiction, Adventure and adventurers, fiction, Chronology, Bibliography, Children of prisoners--fiction, British--virginia--fiction, Exile (punishment)--fiction, Prostitutes--fiction, Repentance--fiction, Criminals--fiction, Women--fiction, Pr3404 .m6 2005b, 823/.5",1722,No page count available,"rus, eng, kor, fre, ger, heb, dut, spa",No rating,https://openlibrary.org/works/OL45139W,https://covers.openlibrary.org/b/id/12997559-M.jpg
Herland,Charlotte Perkins Gilman,"This is written from memory, unfortunately.","Utopias, Fiction, Women, Matriarchat, Utopie, Classic Literature, open_syllabus_project, Matriarchy, Sex role, American fiction (fictional works by one author), Utopias in literature, American fiction, American literature, Women authors, Feminism, Literary collections, English fiction, Fiction, humorous, general, Horror, Literary, Fiction, fantasy, general, Fiction, action & adventure",1915,No page count available,"ger, eng",No rating,https://openlibrary.org/works/OL2771987W,https://covers.openlibrary.org/b/id/448130-M.jpg
