Title,Author,Description,Category,Published Date,Page Count,Language,Average Rating,Preview Link,Thumbnail
The Parsifal Mosaic,Robert Ludlum,"Michael Havelock's world died on a moonlit beach on the Costa Brava. He watched as his partner and lover, Jenna Karats, double agent, was efficiently gunned down by his own agency. There was nothing left for him but to quit the game, get out. Until, in one frantic moment on a crowded railroad platform in Rome, Havelock saw his Jenna alive. From then on, he was marked for death by both U.S. and Russian assassins, racing around the globe after his beautiful betrayer, trapped in a massive mosaic of treachery created by a top-level mole with the world in his fist--Parsifal.",Action,1983,708,en,No rating,http://books.google.co.in/books?id=8eBeSclQFTYC&dq=subject:action&hl=&cd=1&source=gbs_api,http://books.google.com/books/content?id=8eBeSclQFTYC&printsec=frontcover&img=1&zoom=1&source=gbs_api
The Bourne Identity,Robert Ludlum,"He was dragged from the sea, his body riddled with bullets. There are a few clues: a frame of microfilm surgically implanted beneath the skin of his hip; evidence that plastic surgery has altered his face; strange things he says in his delirium, which could be code words. And a number on the film negative that leads to a bank account in Zurich, four million dollars, and a name for the amnesiac: Jason Bourne. Now he is running for his life. A man with an unknown past and an uncertain future, the target of assassins and at the heart of a deadly puzzle. He's fighting for survival and no one can help him - except the one woman who once wanted to escape him... Read by Jeff Harding",Amnesia,2004,566,en,No rating,http://books.google.co.in/books?id=Jp1hPwAACAAJ&dq=subject:action&hl=&cd=2&source=gbs_api,http://books.google.com/books/content?id=Jp1hPwAACAAJ&printsec=frontcover&img=1&zoom=1&source=gbs_api
The Scarlatti Inheritance,Robert Ludlum,Een Amerikaanse geheime agent tracht een complot te verijdelen van grote financiers die voor de tweede wereldoorlog steun willen verlenen aan nazi-Duitsland.,Fiction,1972,338,en,No rating,http://books.google.co.in/books?id=iay07elMcT4C&dq=subject:action&hl=&cd=3&source=gbs_api,http://books.google.com/books/content?id=iay07elMcT4C&printsec=frontcover&img=1&zoom=1&source=gbs_api
"The Trials of Apollo, Book Two: The Dark Prophecy",Rick Riordan,"Leaving the relative safety of the demigod training ground with his companions, a disgraced Apollo embarks on a quest across North America to find a dangerous ancient-world Oracle while navigating the challenges of the evil Triumvirate.",Juvenile Fiction,2017-05-02,0,en,No rating,http://books.google.co.in/books?id=ZrSPEAAAQBAJ&dq=subject:action&hl=&cd=4&source=gbs_api,http://books.google.com/books/content?id=ZrSPEAAAQBAJ&printsec=frontcover&img=1&zoom=1&source=gbs_api
The Matlock Paper,Robert Ludlum,"James Barbout Matlock is a Vietnam veteran and college professor, but now the US government has an assignment for him. They want him to investigate what seems to be a large-scale drugs and prostitution business; and they'll go to any lengths to find the answers they need. Matlock is soon trapped in a maze of unrelenting terror, as the people he cares for most are under threat. Would he have accepted the job if he'd known just what it would mean?",Fiction,1974,292,en,No rating,http://books.google.co.in/books?id=A8fqYHpIo6sC&dq=subject:action&hl=&cd=5&source=gbs_api,http://books.google.com/books/content?id=A8fqYHpIo6sC&printsec=frontcover&img=1&zoom=1&source=gbs_api
"Magnus Chase and the Gods of Asgard, Book One: The Sword of Summer",Rick Riordan,"Magnus Chase, a homeless boy living in Boston, finds out he is the son of a Norse god.",Juvenile Fiction,2015-10-06,0,en,No rating,http://books.google.co.in/books?id=lmCPEAAAQBAJ&dq=subject:action&hl=&cd=6&source=gbs_api,http://books.google.com/books/content?id=lmCPEAAAQBAJ&printsec=frontcover&img=1&zoom=1&source=gbs_api
Robert Ludlum's the Bourne Dominion,"Robert Ludlum, Eric Van Lustbader","Bourne's enemies are gathering force. Severus Domna, a secret and ancient cabal, has called forth its members from around the globe, with one objective: to vanquish the last person capable of destroying their bid to de-stabilize the world economy - Jason Bourne.",Action,2012,0,en,No rating,http://books.google.co.in/books?id=9g6YQgAACAAJ&dq=subject:action&hl=&cd=7&source=gbs_api,http://books.google.com/books/content?id=9g6YQgAACAAJ&printsec=frontcover&img=1&zoom=1&source=gbs_api
The Bourne Ultimatum,Robert Ludlum,"It all starts with a cat-and-mouse chase to the death in a Baltimore funfair: the Jackal, Bourne's age-old antagonist, is back and Bourne is forced from his idyllic retirement with his wife and children to confront his enemy. In Europe and America there are men and women whose lust for power is disguised by their positions and respectability. Their aim: to gain control at the highest level, to avenge, to destroy. Jason Bourne has been the assassin before: now he longs for peace with his family, but the threat of the Jackal puts in jeopardy all possibility of peace...","Bourne, Jason (Fictitious character)",2004,725,en,4,http://books.google.co.in/books?id=t718PwAACAAJ&dq=subject:action&hl=&cd=8&source=gbs_api,http://books.google.com/books/content?id=t718PwAACAAJ&printsec=frontcover&img=1&zoom=1&source=gbs_api
Moonraker,Ian Fleming,"The club where James Bond is asked to settle a dispute over ungentlemanly behaviour is embarrassed. The accused is the unimpeachable Sir Hugo Drax, head of the multi-million-pound Moonraker missile programme on which Britain's future depends.",Fiction,2002,324,en,No rating,http://books.google.co.in/books?id=uHKmcQZ4lxAC&dq=subject:action&hl=&cd=9&source=gbs_api,http://books.google.com/books/content?id=uHKmcQZ4lxAC&printsec=frontcover&img=1&zoom=1&source=gbs_api
Contest,Matthew Reilly,"Second edition of a science-fiction thriller set in the New York State Library, in which a doctor and his daughter unwittingly become involved in a deadly competition. Originally self-published in 1996. This edition includes some revisions and an author interview. Author has also written the international bestsellers 'Ice Station' and 'Temple'.",Albany (N.Y.),2000,352,en,No rating,http://books.google.co.in/books?id=SaqTPwAACAAJ&dq=subject:action&hl=&cd=10&source=gbs_api,http://books.google.com/books/content?id=SaqTPwAACAAJ&printsec=frontcover&img=1&zoom=1&source=gbs_api
Prey,Michael Crichton,"""In the Nevada desert, a handful of scientists are battling to retrieve a swarm of rogue micro-robots that has escaped from the lab. The swarm is self-sustaining, self-reproducing and capable of learning from experience. It is, to all intents and purposes, alive. And very, very deadly. Because it has been programmed as a ruthless predator, a predator that becomes more dangerous with every passing hour ... And we are the prey."" - back cover.",Artificial life,2004,No page count available,en,No rating,http://books.google.co.in/books?id=Az1XPwAACAAJ&dq=subject:action&hl=&cd=11&source=gbs_api,No thumbnail available
Stormbreaker,Anthony Horowitz,"When his guardian dies in suspicious circumstances, Alex Rider goes from schoolboy to superspy within days as his world is turned upside down. Forcibly recruited into MI6, Alex has to take part in gruelling SAS training. Then, armed with his own special set of secret gadgets, he's off on his first mission.",Children's stories,2000,235,en,4,http://books.google.co.in/books?id=T4ubKgAACAAJ&dq=subject:action&hl=&cd=12&source=gbs_api,http://books.google.com/books/content?id=T4ubKgAACAAJ&printsec=frontcover&img=1&zoom=1&source=gbs_api
The Dark Side of Apokolips,Laurie Sutton,Superman travels to the dangerous Apokolips and comes head-to-head with the most fearson villian of the universe - Darkseid.,Juvenile Nonfiction,2015,89,en,No rating,http://books.google.co.in/books?id=-j4XCgAAQBAJ&printsec=frontcover&dq=subject:action&hl=&cd=13&source=gbs_api,http://books.google.com/books/content?id=-j4XCgAAQBAJ&printsec=frontcover&img=1&zoom=1&edge=curl&source=gbs_api
Stormbreaker,"Anthony Horowitz, Antony Johnston, Kanako Damerum, Yuzuru Takasaki","Forcibly recruited into MI6 after the mysterious death of his guardian, fourteen-year-old Alex is sent to infiltrate the organization of a sinister billionaire. Within days he's gone from schoolboy to superspy - and it looks like his first assignment may be his last... The official graphic novel adaptation of 2006's hottest movie blockbuster, Stormbreaker.",Children's stories,2006,144,en,5,http://books.google.co.in/books?id=SbjrAAAACAAJ&dq=subject:action&hl=&cd=14&source=gbs_api,http://books.google.com/books/content?id=SbjrAAAACAAJ&printsec=frontcover&img=1&zoom=1&source=gbs_api
Skeleton Key,Anthony Horowitz,"Sequel to Point Blanc - Alex Rider, reluctant teenage superspy is needed by MI6 once again.",Action,2005,0,en,4,http://books.google.co.in/books?id=w59BAAAACAAJ&dq=subject:action&hl=&cd=15&source=gbs_api,http://books.google.com/books/content?id=w59BAAAACAAJ&printsec=frontcover&img=1&zoom=1&source=gbs_api
The Man with the Golden Gun,Ian Fleming,"Bond Was A Good Agent Once', Said M. 'There'S No Reason Why He Shouldn'T Be A Good Agent Again. Get Me The File On Scaramanga. If We Can Get Him Fit, That'S The Right-Sized Target For 007.' 'But That'S Suicide, Sir!' Even 007 Could Never Take Him. A Brainwashed James Bond Has Tried-And Failed-To Assassinate M, His Boss. Now Bond Has To Prove He Is Back On Form And Can Be Trusted Again. All 007 Has To Do Is Kill One Of The Most Deadly Freelance Hit Men In The World: Paco 'Pistols' Scaramanga, The Man With The Golden Gun. But Despite His License To Kill, 007 Is No Assassin, And On Finding Scaramanga In The Sultry Heat Of Jamaica, He Decides To Infiltrate The Killer'S Criminal Cooperative-And Realizes That He Will Have To Take Him Out As Swiftly As Possible. Otherwise 007 Might Just Be The Next On A Long List Of British Secret Service Numbers Retired By The Man With The Golden Gun...",Action,2006,0,en,No rating,http://books.google.co.in/books?id=lCGhPwAACAAJ&dq=subject:action&hl=&cd=16&source=gbs_api,http://books.google.com/books/content?id=lCGhPwAACAAJ&printsec=frontcover&img=1&zoom=1&source=gbs_api
Robert Ludlum's The Bourne Ascendancy,"Robert Ludlum, Eric Van Lustbader","Jason Bourne is working as a 'blacksmith' - hired by high-level government ministers fearful of assassination attempts. He is paid to impersonate these men at meetings in places of uncertain security around the globe, but when armed gunmen storm one such meeting, they're target is not the minister he impersonates, but Bourne himself. Kidnapped and transported to an underground bunker, Bourne finds himself face-to-face with a well-known terrorist who demands that Bourne carry out a special mission for him - one, that if completed, will have dire consequences for the entire world.",Action,2015-05-21,0,en,No rating,http://books.google.co.in/books?id=vujFngEACAAJ&dq=subject:action&hl=&cd=17&source=gbs_api,http://books.google.com/books/content?id=vujFngEACAAJ&printsec=frontcover&img=1&zoom=1&source=gbs_api
Scorpia,Anthony Horowitz,"After being told that his father was an assassin for a criminal organization, fourteen-year-old Alex goes to Italy to find out more and becomes involved in a plan to kill thousands of English schoolchildren.",Adventure stories,2004,358,en,4.5,http://books.google.co.in/books?id=yJOwAAAACAAJ&dq=subject:action&hl=&cd=18&source=gbs_api,http://books.google.com/books/content?id=yJOwAAAACAAJ&printsec=frontcover&img=1&zoom=1&source=gbs_api
The Apocalypse Watch,Robert Ludlum,"Deep in the Hausruck Mountains of Austria there is a remote hideaway - the fortress-like nerve centre of an ominous movement, the Brotherhood of the Watch. American agent Harry Latham has penetrated the movement, but now, after three years in deep cover, he has disappeared.",Adventure stories,1996,789,en,No rating,http://books.google.co.in/books?id=QXppQgAACAAJ&dq=subject:action&hl=&cd=19&source=gbs_api,No thumbnail available
Heads You Die,Steve Cole,No description available,Murder,2016,No page count available,en,No rating,http://books.google.co.in/books?id=4RqGAQAACAAJ&dq=subject:action&hl=&cd=20&source=gbs_api,http://books.google.com/books/content?id=4RqGAQAACAAJ&printsec=frontcover&img=1&zoom=1&source=gbs_api
The Icarus Agenda,Robert Ludlum,Thriller set in the world of power politics. An unassuming Congressman from Colorado mediates in the release of 200 hostages from the Middle East.,American fiction,1988,812,en,No rating,http://books.google.co.in/books?id=fQi_QgAACAAJ&dq=subject:action&hl=&cd=21&source=gbs_api,No thumbnail available
Action TV,"Bill Osgerby, Anna Gough-Yates","From re-runs of 'TV classics' like The Avengers or Starsky and Hutch, to soundtracks, club nights and film remakes such as Mission Impossible II, the action series is enjoying a popular revival. Yet little attention has been paid to the history, nature and enduring appeal of the action series, and its place in popular culture, past and present. Action TV traces the development of the action series from its genesis in the 1950s. From The Saint to Knigh t Rider, contributors explore the key shows which defined the genre, addressing issues of audiences and consumption, gender and sexuality, fashion and popular culture. They examine the institutional and cultural factors influencing the action series, and relate shifts in the genre to other forms of popular culture including film, pop music, fashion and popular literature. Chapters include: * Of leather suits and kinky boots: The Avengers, style and popular culture * 'Who loves ya, baby?': Kojak, action and the great society *'A lone crusader in a dangerous world': heroics of science and technology in Knight Rider * Angels in chains? feminism, femininity and consumer culture in Charlie's Angels * 'Who's the cat that won't cop out?' Black masculinity in American action shows of the sixties and seventies",Social Science,2001,260,en,No rating,http://books.google.co.in/books?id=ruu_QgAACAAJ&dq=subject:action&hl=&cd=22&source=gbs_api,http://books.google.com/books/content?id=ruu_QgAACAAJ&printsec=frontcover&img=1&zoom=1&source=gbs_api
Off-Road Legends,Blake Hoena,Three short stories featuring the ThunderTrucks include B-Phon facing off against the Chimera broters in a free-wheeling showdown and Atalanta entering in a death-defying race to prove her legendary speed.,Juvenile Fiction,2018-10,145,en,No rating,http://books.google.co.in/books?id=dgtfDwAAQBAJ&printsec=frontcover&dq=subject:action&hl=&cd=23&source=gbs_api,http://books.google.com/books/content?id=dgtfDwAAQBAJ&printsec=frontcover&img=1&zoom=1&edge=curl&source=gbs_api
Double Or Die,Charles Higson,"James Bond is no ordinary boy. In North London cemetery, a professor is kidnapped at gunpoint. A suspicious letter crammed with cryptic clues arrives at Eton. To decipher the deadly mystery, James Bond must take a series of dangerous gambles. Once the code is cracked, he has just forty-eight hours to save the professor from the dark forces.",Adventure and adventurers,2007,352,en,4.5,http://books.google.co.in/books?id=ezsZAAAACAAJ&dq=subject:action&hl=&cd=24&source=gbs_api,http://books.google.com/books/content?id=ezsZAAAACAAJ&printsec=frontcover&img=1&zoom=1&source=gbs_api
Hell Island,Matthew Reilly,"Hell Island is a secret place where classified experiments have been carried out - When all contact is lost with the people on the island, four special forces units are dropped on the island to discover what has happened.",Experimental rangelands,2005,118,en,No rating,http://books.google.co.in/books?id=A1oYPwAACAAJ&dq=subject:action&hl=&cd=25&source=gbs_api,No thumbnail available
War Hawk,"James Rollins, Grant Blackwood",No description available,Fiction,2015-02-18,384,en,No rating,http://books.google.co.in/books?id=0ngIrgEACAAJ&dq=subject:action&hl=&cd=26&source=gbs_api,http://books.google.com/books/content?id=0ngIrgEACAAJ&printsec=frontcover&img=1&zoom=1&source=gbs_api
The Battle for Imperia (Dragon Games #3),Maddy Mara,"An adventure-packed series about three kids who travel into a magical, dragon-filled world! To return the final egg to its rightful place, the kids must travel to the ancient city of Sofia. At first, it seems like this quest will be a piece of cake-- until they come across the giant, shapeshifting insect hiding in walls of the city!",Juvenile Fiction,2023-08,0,en,No rating,http://books.google.co.in/books?id=nVdMzwEACAAJ&dq=subject:action&hl=&cd=27&source=gbs_api,http://books.google.com/books/content?id=nVdMzwEACAAJ&printsec=frontcover&img=1&zoom=1&source=gbs_api
Sphere,Michael Crichton,"In the middle of the South Pacific, a thousand feet below the surface of the water, a huge vessel is discovered resting on the ocean floor. It is a spaceship of phenomenal dimensions, apparently undamaged by its fall from the sky. And, most startling, it appears to be at least three hundred years old. But even more fantastic--and frightening--is what waits inside . . .",Life on other planets,1998,500,en,No rating,http://books.google.co.in/books?id=GSITQgAACAAJ&dq=subject:action&hl=&cd=28&source=gbs_api,No thumbnail available
Renegade,Don Pendleton,"Mack Bolan hits the streets of Tehran, looking for a renegade former Soviet weapons expert who sold out to the terror business. In a world held hostage by the madness of a few, Bolan stands determined to fight. Original.",Fiction,2006,356,en,No rating,http://books.google.co.in/books?id=sYE3XOtxxRUC&dq=subject:action&hl=&cd=29&source=gbs_api,http://books.google.com/books/content?id=sYE3XOtxxRUC&printsec=frontcover&img=1&zoom=1&source=gbs_api
Avenger,"Andy McNab, Robert Rigby","Despite the fierce objections of his grandfather, ex-SAS explosives expert Fergus Watts, Danny and his friend Elena are sucked into an undercover operation to find and destroy Black Star. As the trail leads them to New York, the master of trickery and deception draws the teenagers into spiralling danger as he seeks to take his revenge on the world. [from back cover].",Juvenile Fiction,2007,324,en,No rating,http://books.google.co.in/books?id=ZJ0atntd3c4C&dq=subject:action&hl=&cd=30&source=gbs_api,http://books.google.com/books/content?id=ZJ0atntd3c4C&printsec=frontcover&img=1&zoom=1&source=gbs_api
Blood Oil,James Phelan,"BLOOD OIL sees the return of Ex-Navy operative Lachlan Fox. Now working as an investigative journalist, Lachlan Fox has been visiting some of the world s trouble spots. But a trip to Africa brings him face to face with a horror that could change him forever. Set in Nigeria, Venezuela, the US and UK this book revolves around terrorism, oil supply and poverty, drawing upon world news and current affairs, making it a truly contemporary read, in keeping with Phelan's trademark thrillers. From New York to Nigeria, London to Libya, Fox and his best mate Alistair Gammaldi race to unravel a sinister plan before each step is put into action. Lachlan Fox is going to prove, again, that there is a hero in all of us.",Australian fiction,2009,520,en,No rating,http://books.google.co.in/books?id=erBHPwAACAAJ&dq=subject:action&hl=&cd=31&source=gbs_api,http://books.google.com/books/content?id=erBHPwAACAAJ&printsec=frontcover&img=1&zoom=1&source=gbs_api
Sure Fire,"Jack Higgins, Justin Richards","The mother of 15 year old twins Rich and Jade dies in a car crash and they are told they must go and live with their estranged father, John Chance, who they have never met before. A bachelor who lives on his own, he soon makes it clear that Rich and Jade are not welcome.",Uncategorized,2007,304,en,No rating,http://books.google.co.in/books?id=QWOIGAAACAAJ&dq=subject:action&hl=&cd=32&source=gbs_api,http://books.google.com/books/content?id=QWOIGAAACAAJ&printsec=frontcover&img=1&zoom=1&source=gbs_api
Point of Betrayal,Don Pendleton,"""We call you Saint."" The name ignited a light in Carl's mind. Saint. He'd been covertly recruited for Black Ops and given his life to the most brutal kind of training any man or woman could endure. He was here because he belonged here. To the X Group. An assasin. The most effective killer in the world. And yet . . . Carl Strople struggles to retain fleeting memories that betray an even more ominous reality. He's been told part of the truth--but what's the rest? Invasive techniques have stripped him of his identity and made him someone new--for this he is grateful. But there are some things they can't take from him. The love of a woman, unbroken loyalties to his past, the need for survival. From the deep woods of Hungary to the streets of New York, Saint takes you on a journey of betrayal in a world of government cover-ups, political intrigue, and one man's search for the truth. In the end, that truth will be his undoing.",Fiction,2005,356,en,No rating,http://books.google.co.in/books?id=I7ICc40cO9UC&dq=subject:action&hl=&cd=33&source=gbs_api,http://books.google.com/books/content?id=I7ICc40cO9UC&printsec=frontcover&img=1&zoom=1&source=gbs_api
Deep End,Sam Hutton,"Your life can change in a second. Maddie Cooper's did. She and her parents were gunned down in the street. Maddie's mother was killed, her father left in a wheelchair. Searching for a new role in life, Maddie signs up as a trainee in her father's notorious flying squad.",Juvenile Nonfiction,2003,228,en,No rating,http://books.google.co.in/books?id=qs9omwz0xakC&dq=subject:action&hl=&cd=34&source=gbs_api,http://books.google.com/books/content?id=qs9omwz0xakC&printsec=frontcover&img=1&zoom=1&source=gbs_api
Criminal Investigation Detachment,Don Bendell,"Major Bobby Samuels is part of the Army's specialized team of detectives known as the C.I.D. And when he's sent to Iraq to investigate a series of explosions, he learns that on this battlefield, the enemy isn't the only thing that can kill you.",Fiction,2006,244,en,No rating,http://books.google.co.in/books?id=L_ZbgtKt8sMC&dq=subject:action&hl=&cd=35&source=gbs_api,http://books.google.com/books/content?id=L_ZbgtKt8sMC&printsec=frontcover&img=1&zoom=1&source=gbs_api
Survival Reflex,Don Pendleton,"A desperate call for help from an old friend sends Mack Bolan to the heart of the blood-drenched Amazon, where his life-saving skills are severely tested amongst the Brazilian tribes embroiled in civil war. Original.",Fiction,2006,356,en,No rating,http://books.google.co.in/books?id=O2iAacvjn1MC&dq=subject:action&hl=&cd=36&source=gbs_api,http://books.google.com/books/content?id=O2iAacvjn1MC&printsec=frontcover&img=1&zoom=1&source=gbs_api
Target,Chris Bradford,"FAME MAKES FOR AN EASY TARGET. Ash Wild is the most successful teen rockstar in history. Millions of fans adore him. But one fanatic wants him dead. Surf champion and top bodyguard recruit Charley Hunter is assigned to protect the superstar on his sell-out US tour. But Ash isn't pleased to discover his new bodyguard is a girl. Faced with a growing number of death threats, several suspicious accidents and an unruly rockstar, Charley has her work cut out keeping Ash alive on the tour. How will she spot a killer in a crowd of 50,000 screaming fans?",Action,2016,0,en,No rating,http://books.google.co.in/books?id=dBSxjgEACAAJ&dq=subject:action&hl=&cd=37&source=gbs_api,http://books.google.com/books/content?id=dBSxjgEACAAJ&printsec=frontcover&img=1&zoom=1&source=gbs_api
Treason,Stuart Woods,A close friend requires Stone Barrington's expertise to eradicate a destructive presence in a classified agency. It soon becomes clear that this renegade was sent by a rival Stone has encountered before.,Action,2020-01-07,0,en,No rating,http://books.google.co.in/books?id=KRWOEAAAQBAJ&dq=subject:action&hl=&cd=38&source=gbs_api,http://books.google.com/books/content?id=KRWOEAAAQBAJ&printsec=frontcover&img=1&zoom=1&source=gbs_api
Season of Slaughter,Don Pendleton,"Washington's largest airport is attacked by an American militia group holding hands with Jihad terrorists, leaving more than 500 people dead. It's up to Mack Bolan and the warriors of Stony Man to stop these assassins from finding and destroying their target: the U.S. government. Original.",Fiction,2005,354,en,No rating,http://books.google.co.in/books?id=OwKcLqznGawC&dq=subject:action&hl=&cd=39&source=gbs_api,http://books.google.com/books/content?id=OwKcLqznGawC&printsec=frontcover&img=1&zoom=1&source=gbs_api
Drop Zone,Andy McNab,"Ethan Blake is seventeen and desperate to escape from his dead-end life. Soon, Ethan is caught up in the adrenaline-fuelled world of skydiving. He's a natural, so it's no surprise when he's invited to join an elite skydive team, but is he signing up for more than just jumping out of planes?",Action,2010,290,en,No rating,http://books.google.co.in/books?id=Ku_9GvyeSjAC&dq=subject:action&hl=&cd=40&source=gbs_api,http://books.google.com/books/content?id=Ku_9GvyeSjAC&printsec=frontcover&img=1&zoom=1&source=gbs_api
February,"Gabrielle Lord, Rebecca Young","Cal's old life ended as soon as the deadly 365-day countdown began. So far he's been attacked by sharks, blamed for a vicious assault on his family, kidnapped by two criminal gangs, and left to drown in a fast-filling oil tank . . . He's a hunted fugitive who'll do anything to survive. But is Cal desperate enough to befriend a traitor with killer connections? Or risk returning to the scene of his attempted murder? Should he meet with a mysterious informant, when it could be a set-up? Callum Ormond has been warned. He has 334 days. The countdown continues...",Australia,2010,183,en,No rating,http://books.google.co.in/books?id=7rfgNwAACAAJ&dq=subject:action&hl=&cd=41&source=gbs_api,http://books.google.com/books/content?id=7rfgNwAACAAJ&printsec=frontcover&img=1&zoom=1&source=gbs_api
