Title,Author,Description,Category,Published Date,Page Count,Language,Average Rating,Preview Link,Thumbnail
Treasure Island,Robert Louis Stevenson,"While going through the possessions of a deceased guest who owed them money, the mistress of the inn and her son find a treasure map that leads them to a pirate's fortune.",Adventure,2004,276,en,5,http://books.google.co.in/books?id=Oi9vfDvIuBUC&printsec=frontcover&dq=subject:adventure&hl=&cd=1&source=gbs_api,http://books.google.com/books/content?id=Oi9vfDvIuBUC&printsec=frontcover&img=1&zoom=1&edge=curl&source=gbs_api
The Adventures of Tom Sawyer,Mark Twain,"""It's a lazy Mississippi River town, a place where a boy can learn magical cures for warts, turn a fence-painting job into a leisurely con game, get lost in a cave, escape to an island, or attend his own funeral. It's a time when hooky is punished with a simple swatting and pockets bulge with firecrackers and dead rats; a time when graves are dug up, and boys are fearful of murderous Injuns, when treasures are found, and hearts are won; a time when a prank can lead to a hero's world. It's a fantasy world, this world of Tom Sawyer--a tribute to boyhood, a chance to dream of idle days or skip off on high adventure. It's a warm and scary and funny and unforgettable experience""--Page 4 of cover.",Adventure,1965,230,en,No rating,http://books.google.co.in/books?id=0S_uAAAAMAAJ&dq=subject:adventure&hl=&cd=2&source=gbs_api,http://books.google.com/books/content?id=0S_uAAAAMAAJ&printsec=frontcover&img=1&zoom=1&source=gbs_api
Robinson Crusoe,"Daniel Defoe, Anthony Masters","Following a terrible storm, Crusoe finds himself stranded alone on a desert island off the coast of South America, all of his companions from his ship dead. Over the next 27 years, he builds a life for himself on the island, but is terribly lonely until he saves a Native American, who Crusoe calls Friday, from certain death at the hands of cannibal captors. The two men become friends, and eventually work together to save an English ship whose crew has mutinied. When Crusoe and Friday thwart the mutineers, the captain of the ship takes Crusoe home to England, with Friday as a loyal companion. Text Type: Classic FictionTheme/Topic: Human History, Connections with Native People",Fiction,2014,100,en,No rating,http://books.google.co.in/books?id=tMbCQ7CM9wAC&dq=subject:adventure&hl=&cd=3&source=gbs_api,http://books.google.com/books/content?id=tMbCQ7CM9wAC&printsec=frontcover&img=1&zoom=1&source=gbs_api
White Fang,Jack London,"Follows the half dog, half wolf, White Fang, as he is forced to endure a series of harsh environments that turn him from youthful innocence to mad-dog cruelty.",Alaska,1906,326,en,No rating,http://books.google.co.in/books?id=OGgYAAAAYAAJ&printsec=frontcover&dq=subject:adventure&hl=&cd=4&source=gbs_api,http://books.google.com/books/content?id=OGgYAAAAYAAJ&printsec=frontcover&img=1&zoom=1&edge=curl&source=gbs_api
Fantastic Mr. Fox,Roald Dahl,The adventures of Mr. Fox and three mean farmers who want to destroy the fox and his family.,Juvenile Fiction,1998,98,en,4,http://books.google.co.in/books?id=inZhHuo89T8C&dq=subject:adventure&hl=&cd=5&source=gbs_api,http://books.google.com/books/content?id=inZhHuo89T8C&printsec=frontcover&img=1&zoom=1&source=gbs_api
Harry Potter and the Prisoner of Azkaban,J. K. Rowling,"When Harry and his best friends go back for their third year at Hogwarts, the atmosphere is tense. There's an escaped mass-murderer on the loose and the sinister prison guards of Azkaban have been called in to guard the school. Lessons, however, must go on and there are lots of new subjects in third year - Care of Magical Creatures and Divination among others - to take Harry's mind off things!",Adventure,1999,317,en,4.5,http://books.google.co.in/books?id=nfRhQgAACAAJ&dq=subject:adventure&hl=&cd=6&source=gbs_api,http://books.google.com/books/content?id=nfRhQgAACAAJ&printsec=frontcover&img=1&zoom=1&source=gbs_api
River Boy,Tim Bowler,"A new mass-market edition of this Carnegie Medal-winner. One of the classic teenage novels of the nineties, ""River Boy"" is an emotional, moving book which has had a profound influence on its readers. Following the story of Jess's dying grandfather, and the marathon river swim Jess becomes caught up in, it uses poetic and surreal images of water andswimming to deal with the difficult subjects of death and loss in an accessible and affecting way. * Winner of the Carnegie Medal and the Angus Book Prize * A moving poetic exploration of grief and loss. * Internationally successful - foreign rights have so far been sold to America, Denmark, Sweden, Germany, Belgium, Italy, Poland and Portugal. A film option has been agreed. * New cover treatment to match Tim Bowler's wonderful new novel, ""Storm Catchers"". * Author was born and brought up in Leigh-on-Sea, Essex, and now lives in Totnes, Devon.",Fiction,2001,150,en,4.5,http://books.google.co.in/books?id=w6lrc-9EapgC&printsec=frontcover&dq=subject:adventure&hl=&cd=7&source=gbs_api,http://books.google.com/books/content?id=w6lrc-9EapgC&printsec=frontcover&img=1&zoom=1&edge=curl&source=gbs_api
The Ironwood Tree,"Tony DiTerlizzi, Holly Black",OLS-N conf. May/04.,Juvenile Fiction,2004-04,140,en,4.5,http://books.google.co.in/books?id=dhtB6wh57roC&printsec=frontcover&dq=subject:adventure&hl=&cd=8&source=gbs_api,http://books.google.com/books/content?id=dhtB6wh57roC&printsec=frontcover&img=1&zoom=1&edge=curl&source=gbs_api
Harry Potter and the Chamber of Secrets,J. K. Rowling,"Sequel to Harry Potter and the sorcerer's stone. When the chamber of secrets is opened again at the Hogswart School for witchcraft and wizardry, second-year student Harry Potter finds himself in danger from a dark power that has once more been released on the school.",Adventure,1998,251,en,No rating,http://books.google.co.in/books?id=bUMUvgAACAAJ&dq=subject:adventure&hl=&cd=9&source=gbs_api,http://books.google.com/books/content?id=bUMUvgAACAAJ&printsec=frontcover&img=1&zoom=1&source=gbs_api
Emil and the Detectives,"Cyrus Harry Brooks, Erich Kästner","On his way to Berlin to visit his grandmother Emil fell asleep and had his money stolen by the man who shared his compartment. Although he came from the country Emil was not stupid, and he determined to get that money back. He followed the man, met the boy with the auto horn, who summoned his friends, and among them all they caught a very clever thief.",Adventure,1933,230,en,No rating,http://books.google.co.in/books?id=oLkNAQAAIAAJ&dq=subject:adventure&hl=&cd=10&source=gbs_api,http://books.google.com/books/content?id=oLkNAQAAIAAJ&printsec=frontcover&img=1&zoom=1&source=gbs_api
Robinson Crusoe,Daniel Defoe,No description available,Adventure,2004,256,en,No rating,http://books.google.co.in/books?id=Nj5fPgAACAAJ&dq=subject:adventure&hl=&cd=11&source=gbs_api,No thumbnail available
The Wizard of Oz,Lyman Frank Baum,"The Pearson Education Library Collection offers you over 1200 fiction, nonfiction, classic, adapted classic, illustrated classic, short stories, biographies, special anthologies, atlases, visual dictionaries, history trade, animal, sports titles and more",Juvenile Fiction,1956,252,en,No rating,http://books.google.co.in/books?id=kSTql-520p8C&dq=subject:adventure&hl=&cd=12&source=gbs_api,http://books.google.com/books/content?id=kSTql-520p8C&printsec=frontcover&img=1&zoom=1&source=gbs_api
White Fang and The Call of the Wild,Jack London,No description available,Fiction,1996-08,320,en,No rating,http://books.google.co.in/books?id=VILtWzdXT7YC&dq=subject:adventure&hl=&cd=13&source=gbs_api,http://books.google.com/books/content?id=VILtWzdXT7YC&printsec=frontcover&img=1&zoom=1&source=gbs_api
The Magician's Nephew,Clive Staples Lewis,"This edition of Lewis's classic fantasy fiction is packaged specifically for adults. Complementing the look of the author's non-fiction books, and anticipating the forthcoming Narnia feature films, this edition contains an exclusive P.S. section about the history of the book, plus a sample chapter from its sequel.",Fiction,2005,274,en,No rating,http://books.google.co.in/books?id=CYaox8YG3RQC&dq=subject:adventure&hl=&cd=14&source=gbs_api,http://books.google.com/books/content?id=CYaox8YG3RQC&printsec=frontcover&img=1&zoom=1&source=gbs_api
The Boy in the Striped Pyjamas,John Boyne,"Berlin 1942. When Bruno returns home from school one day, he discovers that his belongings are being packed in crates. His father has received a promotion and the family must move from their home to a new house far far away, where there is no one to play with and nothing to do. A tall fence running alongside stretches as far as the eye can see and cuts him off from the strange people he can see in the distance. But Bruno longs to be an explorer and decides that there must be more to this desolate new place than meets the eye. While exploring his new environment, he meets another boy whose life and circumstances are very different to his own, and their meeting results in a friendship that has devastating consequences.",Foreign Language Study,2007,0,en,4.5,http://books.google.co.in/books?id=6cakAAAACAAJ&dq=subject:adventure&hl=&cd=15&source=gbs_api,http://books.google.com/books/content?id=6cakAAAACAAJ&printsec=frontcover&img=1&zoom=1&source=gbs_api
Secret Seven Mystery,Enid Blyton,No description available,Children's stories,1992,102,en,No rating,http://books.google.co.in/books?id=VhHJPwAACAAJ&dq=subject:adventure&hl=&cd=16&source=gbs_api,http://books.google.com/books/content?id=VhHJPwAACAAJ&printsec=frontcover&img=1&zoom=1&source=gbs_api
Swiss Family Robinson,Johann David Wyss,No description available,Adventure,1994,192,en,No rating,http://books.google.co.in/books?id=2v8uAAAACAAJ&dq=subject:adventure&hl=&cd=17&source=gbs_api,http://books.google.com/books/content?id=2v8uAAAACAAJ&printsec=frontcover&img=1&zoom=1&source=gbs_api
The World of Pooh Collection,Alan Alexander Milne,"The story of Winnie-the-Pooh and his friends Piglet, Christopher Robin, Piglet, Rabbit and Owl, Kanga and Roo - not forgetting Eeyore - and their adventures in the Hundred Acre Wood.","Children's stories, English",2000,144,en,No rating,http://books.google.co.in/books?id=lkCOtwEACAAJ&dq=subject:adventure&hl=&cd=18&source=gbs_api,No thumbnail available
Jungle Book,Rudyard Kipling,No description available,Adventure,No date available,No page count available,en,No rating,http://books.google.co.in/books?id=JCIovQEACAAJ&dq=subject:adventure&hl=&cd=20&source=gbs_api,No thumbnail available
"Look Out, Secret Seven",Enid Blyton,"Solve the mystery with the Secret Seven - everyone's favourite detective club! These timeless stories are perfect for young fans of mystery, adventure or detective series. In book fourteen, Scamper the spaniel discovers an unwanted visitor, then he protects the Secret Seven as they spy on a thief late at night in Bramley Woods! What on earth would the Secret Seven do without their dog? Solve the mystery! Cover and inside illustrations are by the brilliant Tony Ross, illustrator of David Walliams's books. The story was first published in 1962. This edition features the classic text and comes with a Bonus Blyton section at the back with quizzes, puzzles and other bonus extras! Have you read all 15 books in the original Secret Seven series by Enid Blyton? And don't miss these other Secret Seven titles... Mystery of the Skull - a brand-new Secret Seven mystery by prizewinning author Pamela Butchart. Secret Seven Brain Games - a fun and tricky puzzle book *** The Secret Seven ®, Enid Blyton® and Enid Blyton's signature are registered trade marks of Hodder & Stoughton Limited. No trade mark or copyrighted material may be reproduced without the express written permission of the trade mark and copyright owner.",Adventure,2013,0,en,No rating,http://books.google.co.in/books?id=XzKZkwEACAAJ&dq=subject:adventure&hl=&cd=21&source=gbs_api,http://books.google.com/books/content?id=XzKZkwEACAAJ&printsec=frontcover&img=1&zoom=1&source=gbs_api
Five Have a Mystery to Solve,Enid Blyton,"Whispering Island - another mysterious place, with a million stories sorrounding it . . . Is it haunted? The Five are intrigued, but scared, too. Are they brave enough to go there and find out . . . These classic editions feature Enid Blyton's unchanged text and Eileen A. Soper's original illustrations.",Adventure stories,1997,170,en,No rating,http://books.google.co.in/books?id=pZsyHQAACAAJ&dq=subject:adventure&hl=&cd=22&source=gbs_api,http://books.google.com/books/content?id=pZsyHQAACAAJ&printsec=frontcover&img=1&zoom=1&source=gbs_api
The Count of Monte Cristo,Alexandre Damas,"Presenting a delightful series of classics that will fascinate young readers. Written in simple langauge, these books retell the best-loved stories in literature in a way that will capture the child's imagination. A fabulous way to introduce children to the wealth of classic literature!",False imprisonment,2004-02-01,192,en,No rating,http://books.google.co.in/books?id=fUDfrQEACAAJ&dq=subject:adventure&hl=&cd=23&source=gbs_api,No thumbnail available
Coram Boy,Jamila Gavin,"Set in the eighteenth century, Coram Boy is a tale of two cities and a tale of two boys: Toby, saved from an African slave ship, and Aaron, the illegitimate heir to a great estate. It's also a tale of fathers and sons: slave-trader, Otis, and his son Meshak; and landowner Sir William Ashbrook and the son he disinherits.",Juvenile Fiction,2000,340,en,4,http://books.google.co.in/books?id=XyRQAAAAYAAJ&dq=subject:adventure&hl=&cd=24&source=gbs_api,http://books.google.com/books/content?id=XyRQAAAAYAAJ&printsec=frontcover&img=1&zoom=1&source=gbs_api
Percy Jackson and the Greek Gods,Rick Riordan,"A publisher in New York asked me to write down what I know about the Greek gods, and I was like, Can we do this anonymously? Because I don't need the Olympians mad at me again. But if it helps you to know your Greek gods, and survive an encounter with them if they ever show up in your face, then I guess writing all this down will be my good deed for the week. So begins Percy Jackson's Greek Gods, in which the son of Poseidon adds his own magic--and sarcastic asides--to the classics. He explains how the world was created, then gives readers his personal take on a who's who of ancients, from Apollo to Zeus. Percy does not hold back. ""If you like horror shows, blood baths, lying, stealing, backstabbing, and cannibalism, then read on, because it definitely was a Golden Age for all that."" This novel-sized paperback, complete with an insert of full-color illustrations by Caldecott Honoree John Rocco, is portable and friendly, and the ideal way to introduce young readers to the classic stories. Praise for Percy Jackson's Greek Gods ""Percy's gift, which is no great secret, is to breathe new life into the gods. Closest attention is paid to the Olympians, but Riordan has a sure touch when it comes to fitting much into a small space-as does Rocco's artwork, which smokes and writhes on the page as if hit by lightning. . .The inevitable go-to for Percy's legions of fans who want the stories behind his stories."" -Kirkus Reviews ""The age-old stories are endlessly strong, resonant, and surprising, while the telling here is fresh, irreverent, and amusing. Percy's voice. . . John Rocco illustrates the myths with drama, verve, and clarity. A must-have addition to the Percy Jackson canon."" -Booklist Online ""Combining the sarcasm and wit of Percy Jackson with the original Greek myths is a great way to hook tweens and teens on the stories without boring them. The beautiful illustrations by John Rocco enhance each story. . ."" -VOYA",Children's stories,2015-05-07,0,en,No rating,http://books.google.co.in/books?id=eBTaoQEACAAJ&dq=subject:adventure&hl=&cd=26&source=gbs_api,http://books.google.com/books/content?id=eBTaoQEACAAJ&printsec=frontcover&img=1&zoom=1&source=gbs_api
Ark Angel,Anthony Horowitz,"After recovering from a near fatal gunshot wound, teenage spy Alex Rider embarks on a new mission to stop a group of eco-terrorists from sabotaging the launch of the first outer space hotel.",Juvenile Fiction,2006,342,en,No rating,http://books.google.co.in/books?id=IgNaAAAAYAAJ&dq=subject:adventure&hl=&cd=27&source=gbs_api,http://books.google.com/books/content?id=IgNaAAAAYAAJ&printsec=frontcover&img=1&zoom=1&source=gbs_api
Gulliver's Travels,Jonathan Swift,"Lemuel Gulliver always dreamed of sailing across the seas, but he never imagined the places his travels would take him. His adventures could be the greatest tales ever told, if he survives long enough to tell them. These reader-favorite tiles are now updated for enhanced Common Core State Standards support, including discussion and writing prompts developed by a Common Core expert, an expanded introduction, bolded glossary words and dynamic new covers.",England,1993,152,en,No rating,http://books.google.co.in/books?id=t0c-PgAACAAJ&dq=subject:adventure&hl=&cd=28&source=gbs_api,No thumbnail available
Around the World in 80 Days [eBook - NC Digital Library],Jules Verne,No description available,Uncategorized,2010,0,en,No rating,http://books.google.co.in/books?id=WC2pzwEACAAJ&dq=subject:adventure&hl=&cd=29&source=gbs_api,No thumbnail available
The Bourne Identity,Robert Ludlum,"The harrowing story of a man with no memory--Jason Bourne--an assassin hunted by unseen armies for reasons he doesn't remember. A shooting victim, suffering from amnesia, finds himself with a Swiss bank account in the name of Jason Bourne, a professional assassin being manipulated by a top-secret American government organization to kill his arch rival, the dreaded Carlos.",Adventure,2010,0,en,No rating,http://books.google.co.in/books?id=q9lfPwAACAAJ&dq=subject:adventure&hl=&cd=30&source=gbs_api,http://books.google.com/books/content?id=q9lfPwAACAAJ&printsec=frontcover&img=1&zoom=1&source=gbs_api
Adventures of Huckleberry Finn,Mark Twain,"Recounts the adventures of a young boy and an escaped slave, as they travel down the Mississippi River on a raft.",Adventure,2016,190,en,No rating,http://books.google.co.in/books?id=WnQzzwEACAAJ&dq=subject:adventure&hl=&cd=31&source=gbs_api,No thumbnail available
The Sum of All Fears,Tom Clancy,"CIA Deputy Director Jack Ryan returns to the screen in Paramount Pictures' film adaptation of this novel of intrigue, set for release in May and starring Ben Affleck as Ryan. The Gulf War is over and an Israeli nuclear weapon is missing. The balance of power in the Mideast--and the world--is about to change forever. Jack Ryan returns to face the challenge of his career when his proposal for a Middle Eastern peace plan erupts into chaos. Copyright © Libri GmbH. All rights reserved.",Fiction,1991,1290,en,No rating,http://books.google.co.in/books?id=nDi8NxY_oT8C&dq=subject:adventure&hl=&cd=32&source=gbs_api,http://books.google.com/books/content?id=nDi8NxY_oT8C&printsec=frontcover&img=1&zoom=1&source=gbs_api
Ghost Town at Sundown,Mary Pope Osborne,"In this title, the 10th in the series, the Tree House house whisks Jack and Annie back to a ghost town in the Wild West of the 1880s. There are wild horses, wandering ghosts and rattlesnakes. Ann tames a lost colt and they meet a friendly stranger, but will he help them solve the second riddle?",Juvenile Fiction,2001,84,en,No rating,http://books.google.co.in/books?id=VLs-iGcK8pQC&dq=subject:adventure&hl=&cd=33&source=gbs_api,http://books.google.com/books/content?id=VLs-iGcK8pQC&printsec=frontcover&img=1&zoom=1&source=gbs_api
The Amber Spyglass,Philip Pullman,"Together, Will and Lyra approach the most dangerous stage of their epic journey, as the worlds prepare for the greatest war that has ever been known.",Adventure,2005,0,en,4,http://books.google.co.in/books?id=o9GHAAAACAAJ&dq=subject:adventure&hl=&cd=34&source=gbs_api,http://books.google.com/books/content?id=o9GHAAAACAAJ&printsec=frontcover&img=1&zoom=1&source=gbs_api
The Railway Children,Edith Nesbit,"Roberta, Peter and Phyllis lead an ordinary suburban life with Mother and Father and trips to the zoo and the pantomime. But when Father is mysteriously taken away one night, everything changes. What has happened to Father, and will he come back?",Children of prisoners,1989,185,en,No rating,http://books.google.co.in/books?id=2GQ9PgAACAAJ&dq=subject:adventure&hl=&cd=35&source=gbs_api,No thumbnail available
The Lost World,Michael Crichton,"With the highest grossing film in cinema history, Jurassic Park invented the word dinomania which swept the country in 1993. Now, the events prefaced in the epilogue to that novel are explored in this sequel.",Adventure,1995,0,en,No rating,http://books.google.co.in/books?id=4ECGvgEACAAJ&dq=subject:adventure&hl=&cd=36&source=gbs_api,http://books.google.com/books/content?id=4ECGvgEACAAJ&printsec=frontcover&img=1&zoom=1&source=gbs_api
King Solomon's Mines,Henry Rider Haggard,No description available,Adventure stories,1985,238,en,No rating,http://books.google.co.in/books?id=PcpEPgAACAAJ&dq=subject:adventure&hl=&cd=37&source=gbs_api,No thumbnail available
The black arrow,Robert Louis Stevenson,No description available,Adventure,1959,186,en,No rating,http://books.google.co.in/books?id=Ih3IMgEACAAJ&dq=subject:adventure&hl=&cd=38&source=gbs_api,No thumbnail available
The Lost World,Arthur Conan Doyle,No description available,Uncategorized,1986-01-01,191,en,No rating,http://books.google.co.in/books?id=UOxLPgAACAAJ&dq=subject:adventure&hl=&cd=39&source=gbs_api,No thumbnail available
The Long Patrol,Brian Jacques,"Tenth Thrilling Redwall Adventure - New In Paperback! Damug Warfang, Head Of A Thousand Rapscallions - The Deadliest Horde Of Foebeasts Ever To Jump From Ship To Shore - Is Looking For Slaughter And Plunder. Can Any Beast Stand Against The Conqueror And His Savage Troops? Tammo'S Dream Comes True When He Is Given The Chance To Run With The Long Patrol, The Legendary Fighting Hares Of Salamandastron. . .",Juvenile Fiction,1998,372,en,No rating,http://books.google.co.in/books?id=dpKnkf5pILAC&dq=subject:adventure&hl=&cd=40&source=gbs_api,http://books.google.com/books/content?id=dpKnkf5pILAC&printsec=frontcover&img=1&zoom=1&source=gbs_api
The Jungle,Upton Sinclair,...Documents the brutal conditions in the Chicago stockyards at the turn of the century and brings into sharp moral focus the appalling odds against which immigrants and other working people struggled for their share in the American dream...,Adventure,1906,432,en,4,http://books.google.co.in/books?id=UOFEAQAAMAAJ&dq=subject:adventure&hl=&cd=42&source=gbs_api,http://books.google.com/books/content?id=UOFEAQAAMAAJ&printsec=frontcover&img=1&zoom=1&source=gbs_api
The Angel Experiment,James Patterson,"Max soars above the world . . . but in James Patterson's thrilling adventure, fantasy can come crashing down to reveal the nightmares of the Angel Experiment. Maximum Ride and her ""flock"" -- Fang, Iggy, Nudge, Gasman and Angel -- are just like ordinary kids, only they have wings and can fly. It may seem like a dream come true to some, but their lives can morph into a living nightmare at any time. Angel, the youngest member of the flock, is kidnapped and taken back to the ""School"" where she and the others were experimented on by a crew of whack jobs. Her friends brave a journey to blazing hot Death Valley, CA, to save Angel, but soon enough, they find themselves in yet another nightmare: fighting off the half-human, half-wolf ""Erasers"" in New York City. Whether in the treetops of Central Park or in the bowels of the Manhattan subway system, Max and her adopted family take the ride of their lives. Along the way, Max discovers that her purpose is save the world. But can she?",Juvenile Fiction,2007-04,472,en,5,http://books.google.co.in/books?id=435JAQAAIAAJ&dq=subject:adventure&hl=&cd=45&source=gbs_api,http://books.google.com/books/content?id=435JAQAAIAAJ&printsec=frontcover&img=1&zoom=1&source=gbs_api
South Sea Adventure,Willard Price,Hal and Roger Hunt are searching for exotic sea-life - and have a special mission to collect pearls from the oyster-beds of a secret lagoon. But do the crew and passengers of the LIVELY LADY know more than they should? Can anybody be trusted?,Adventure,1993-01,246,en,No rating,http://books.google.co.in/books?id=sSXsAQAACAAJ&dq=subject:adventure&hl=&cd=46&source=gbs_api,http://books.google.com/books/content?id=sSXsAQAACAAJ&printsec=frontcover&img=1&zoom=1&source=gbs_api
The Adventure Collection,Willard Price,"It's wild! It's dangerous! And it's out there! Exploration and adventure is the name of the game for the Hunt family. Join Hal, Roger and their zoologist dad on their action-packed animal-tracking expeditions... Children both young and old will thrill at this collection of Willard Price adventure stories: never again a dull moment!","Adventure stories, English",1998,422,en,No rating,http://books.google.co.in/books?id=i7c9AAAACAAJ&dq=subject:adventure&hl=&cd=47&source=gbs_api,http://books.google.com/books/content?id=i7c9AAAACAAJ&printsec=frontcover&img=1&zoom=1&source=gbs_api
Safari Adventure,Willard Price,"One of Willard Price's adventure stories featuring Hal and Roger Hunt. The boys have a new quarry - the big-game poachers who threaten to wipe out a huge African game reserve. They capture a band of poachers red-handed, but the leader, Blackbeard, continues to elude them.",Adventure,2012,242,en,No rating,http://books.google.co.in/books?id=XKFDWoh1EdwC&dq=subject:adventure&hl=&cd=48&source=gbs_api,http://books.google.com/books/content?id=XKFDWoh1EdwC&printsec=frontcover&img=1&zoom=1&source=gbs_api
