Title,Author,Description,Category,Published Date,Page Count,Language,Average Rating,Preview Link,Thumbnail
The World Set Free,"H. G. Wells, Ellen Marriage, Paula Benitez","The problem which was already being mooted by such scientific men as Ramsay, Rutherford, and Soddy, in the very beginning of the twentieth century, the problem of inducing radio-activity in the heavier elements and so tapping the internal energy of atoms, was solved by a wonderful combination of induction, intuition, and luck by Holsten so soon as the year 1933.","Nuclear warfare, Imaginary wars and battles, Fiction, British and irish fiction (fictional works by one author), Fiction, action & adventure, Fiction, science fiction, general",1914,No page count available,eng,No rating,https://openlibrary.org/works/OL52257W,https://covers.openlibrary.org/b/id/8246099-M.jpg
The Road,"Cormac McCarthy, Tom Stechschulte",No description available,"Fiction, Dystopia, Adventure, post-apocalyptic fiction, extinction event, Open Library Staff Picks, Fathers and sons, Survival skills, Regression (Civilization), Voyages and travels, literary fiction, Robinsonades, Apocalyptic fiction, Novels, Apocalypse, Long Now Manual for Civilization, Description and travel, Survival, Father-son relationship, Road fiction, Fathers and sons--Fiction, Voyages and travels--Fiction, Regression (Civilization)--Fiction, Reading Level-Grade 7, Reading Level-Grade 6, Reading Level-Grade 9, Reading Level-Grade 8, Reading Level-Grade 11, Reading Level-Grade 10, Reading Level-Grade 12, Hunger, Civilization, Ethics, Disasters, Travel, Fathers and sons, fiction, Fiction, dystopian, Fiction, science fiction, general, American fiction (fictional works by one author), Large type books, nyt:mass-market-paperback=2008-12-07, New York Times bestseller, New York Times reviewed, Fathers And Sons_Fiction; Fiction_Dystopian; Fiction_Science Fiction_General; American Fiction (Fict, Fiction, general, Fiction, horror",2006,No page count available,"chi, fre, ita, cat, spa, pol, heb, eng",No rating,https://openlibrary.org/works/OL40873W,https://covers.openlibrary.org/b/id/198120-M.jpg
The Voyages of Doctor Dolittle,Hugh Lofting,ALL that I have written so far about Doctor Dolittle I heard long after it happened from those who had known him- indeed a great deal of it took place before I was born.,"Animals, Classic Literature, Children's stories, Fiction, Juvenile fiction, Voyages and travels, Fantasy, Doctor Dolittle (Fictitious character), Imaginary Voyages, Fairy tales, Fantasy fiction, Newbery Medal, Animals, fiction, Children's fiction, Dolittle, doctor (fictitious character), fiction, Voyages and travels, fiction, Literature and fiction, juvenile, Adventure and adventurers, Veterinarians, Adventure and adventurers, fiction, Veterinarians, fiction",1922,No page count available,"spa, dan, eng, und",No rating,https://openlibrary.org/works/OL1449063W,https://covers.openlibrary.org/b/id/281218-M.jpg
The Cat of Bubastes,G. A. Henty,THE sun was blazing down upon a city on the western shore of the Caspian.,"Adventure and adventurers, Juvenile fiction, Adventure and adventurers in fiction, Fiction, Egypt in fiction, History, Children's fiction, Adventure and adventurers, fiction, Egypt, history, fiction, Fiction, historical, general, Egypt, fiction, Fiction, general, Histoire, Romans, nouvelles",1888,No page count available,"und, eng",No rating,https://openlibrary.org/works/OL1794662W,https://covers.openlibrary.org/b/id/4840391-M.jpg
The Phantom Tollbooth,Norton Juster,"There was once a boy named Milo who didn't know what to do with himself-not just sometimes, but always.","letters, numbers, orchestras, children's literature, adventure, Creativity and Imagination, Boredom, Magic and Supernatural, Discovery and Learning, American Fantasy fiction, Children's stories, American, Fantasy, Ficción juvenil, Fiction, Imaginación, Imagination, Language and languages, Lenguaje y lenguas, Novela fantástica, children's fantasy, puns, tollbooths, Puns and punning, Fantasy fiction, Juvenile fiction, Imagination in children, Criticism and interpretation, Science Fiction, Fantasy, & Magic, Children's 9-12 - Literature - Classics / Contemporary, Spanish: Grades 4-7, Spanish language materials, Readers - Chapter Books, Action & Adventure, Classics, Non-Classifiable, Action & Adventure - General, Children's fiction, Imaginary Voyages, Children's stories, Large type books, New York Times reviewed, Magic, fiction, Boys, Learning and scholarship, Male authors, Illustrated children's books, Specimens, Garçons, Romans, nouvelles, etc. pour la jeunesse, Savoir et érudition, Livres illustrés pour enfants, Spécimens, Spanish language, Children's books, Ennui (Lassitude), Fantasmes, Fantasía, Novela juvenil, Relatos de aventura, Fantasy--juvenile fiction, Pz7.j9865 ph 1996, [fic], Alphabet, Arithmetic, Adventure stories, Arithmétique, Histoires pour enfants",1961,No page count available,"chi, fre, ita, rus, spa, und, heb, eng",No rating,https://openlibrary.org/works/OL1636262W,https://covers.openlibrary.org/b/id/8578174-M.jpg
Artemis Fowl and the Eternity Code,Eoin Colfer,Artemis Fowl was almost content.,"New York Times bestseller, nyt:series_books=2008-06-22, Reading Level-Grade 5, Reading Level-Grade 4, Reading Level-Grade 7, Reading Level-Grade 6, Reading Level-Grade 8, Adventure and adventurers, Fiction, Fairies, Magic, Computers, Large type books, Magie, Romans, nouvelles, etc. pour la jeunesse, Ordinateurs, Artemis Fowl (Fictitious character), Criminals, Juvenile fiction, Adventure and adventurers -- Fiction., Fairies -- Fiction., Magic -- Fiction., Computers -- Fiction., Fowl, Artemis (Fictitious character) -- Juvenile fiction., Fairies -- Juvenile fiction., Magic -- Juvenile fiction., Computers -- Juvenile fiction., Criminals -- Juvenile fiction., England -- Fiction., Father-son relationships, Fantasy fiction, Father-son relationship, Accelerated Reader, Fantasy, Humorous stories, Gifted children, science fiction, England, fiction, Magic, fiction, Children's fiction, Fairies, fiction, Kidnapping, fiction, Mothers and sons, fiction, Fowl, artemis (fictitious character), fiction, Adventure and adventurers, fiction, Computers, fiction, Adventure stories",2003,No page count available,"chi, ita, fre, rus, dut, spa, wel, ger, pol, heb, eng",No rating,https://openlibrary.org/works/OL5725961W,https://covers.openlibrary.org/b/id/12636263-M.jpg
Timeline,Michael Crichton,"II y a cent ans, quand le XLV si&cle touchait å sa fin, les scientifiques du monde entier étaient convaincus d'étre arrivés å une représentation exacte du monde physique.","Fiction, Hundertja hriger Krieg, Wissenschaftler, Historians, Quantum theory, Zeitreise, Time travel, History, Historiadores, Teoría cuántica, Science Fiction, Teleportation, HistoriaViajes a través del tiempo, Thriller, Suspense fiction, Adventure stories, Social life and customs, Ficción, Technology, Twenty-first century, Hundertjähriger Krieg, Reading Level-Grade 7, Reading Level-Grade 9, Reading Level-Grade 8, Reading Level-Grade 11, Reading Level-Grade 10, Reading Level-Grade 12, Fiction, technological, Fiction, science fiction, hard science fiction, Large type books, New York Times reviewed, Fiction, thrillers, technological",1999,No page count available,"ger, spa, chi, ita, eng, rus, fre",No rating,https://openlibrary.org/works/OL46884W,https://covers.openlibrary.org/b/id/12451613-M.jpg
A Tramp Abroad,Mark Twain,One day it occurred to me that it had been many years since the world had been afforded the spectacle of a man adventurous enough to undertake a journey through Europe on foot.,"American Authors, Americans, Americans in fiction, Biography, Description and travel, Europe in fiction, Fiction, History, Journeys, Mountaineering, Specimens, Travel, Walking, Walking in fiction, Yellowback books, Descriptions et voyages, Chronology, Voyages and travels, Voyages around the world, Antiquities, Indians of North America, Geology, American fiction (fictional works by one author), Europe, fiction, Fiction, humorous, Twain, mark, 1835-1910, Fiction, general, Fiction, humorous, general, Large type books, Fiction, historical, general, Wit and humor, Adventure stories, National characteristics, Telescopes, Mountains, Rivers, Glaciers, Astronomy",1878,No page count available,"chi, ger, eng, und",No rating,https://openlibrary.org/works/OL53918W,https://covers.openlibrary.org/b/id/9168741-M.jpg
Eragon,Christopher Paolini,No description available,"Fantasy, Juvenile fiction, Dragons, Magic, Fiction, violence, dwarves, humans, fighting, adventure, war, elves, young adult fiction, Action & Adventure, Fantasy fiction, American Fantasy fiction, Mythical Creatures, Animals, Epic, Youths' writings, nyt:series-books=2008-10-05, New York Times bestseller, Heather's Pick, Magia, Adventure and adventurers, nyt:series_books=2011-06-11, Ficción juvenil, Novela fantástica, Science Fiction, Fantasy, & Magic, Fiction - Science Fiction, Fiction - Fantasy, Spanish: Grades 3-4, Fantasy - General, Fairy Tales & Folklore - General, Fairy Tales & Folklore - Single Title, Reading Level-Grade 7, Reading Level-Grade 6, Reading Level-Grade 9, Reading Level-Grade 8, Reading Level-Grade 11, Reading Level-Grade 10, Reading Level-Grade 12, Children's fiction, Dragons, fiction, Spanish language materials, Dragones, Novela juvenil, Adventure and adventurers, fiction, Magic, fiction, Romans, nouvelles, etc. pour la jeunesse, Fantasmes, Young men, Juvenile literature, Roman pour la jeunesse",1998,No page count available,"chi, fre, ita, por, spa, ger, pol, eng",No rating,https://openlibrary.org/works/OL5819895W,https://covers.openlibrary.org/b/id/13921600-M.jpg
Stuart Little,E. B. White,"WHEN Mrs. Frederick C. Little's see son arrived, everybody noticed that he was not much bigger than a mouse.","Voyages and travels, Mice, Juvenile fiction, JUVENILE FICTION / Social Themes / Friendship, JUVENILE FICTION / Animals / Mice, Hamsters, Guinea Pigs, Fiction, JUVENILE FICTION / Classics, Determination (Personality trait), Size perception, Friendship, Birds, family, Juvenile audience, classics, social themes, animals, Mice in fiction, Voyages and travels in fiction, Children's stories, Mice -- Fiction, Stuart Little (Fictitious character), Mice, fiction, Children's fiction, Little, stuart (fictitious character), fiction, Voyages and travels, fiction, Souris, Adoption, Romans, nouvelles, etc. pour la jeunesse, Large type books, Accelerated Reader, 5.5., Horror tales, Vampires, Mummies, Werewolves, Witches, Books and reading, Horror fiction, Adventure and adventurers, fiction",1945,No page count available,"chi, eng, fre, spa, ger, ita, rus",No rating,https://openlibrary.org/works/OL483385W,https://covers.openlibrary.org/b/id/10522876-M.jpg
La planète des singes,Pierre Boulle,"Jinn et Phyllis passaient des vacances merveilleuses, dans l'espace, le plus loin possible des astres habités.","French language edition, Fiction, Monkeys, Fiction, science fiction, action & adventure, Science fiction, Apes, Sci-Fi, Movies, Motion Pictures, Films, Revolution, Social role, Fiction, science fiction, general",1963,No page count available,"fre, rus, por, spa, eng",No rating,https://openlibrary.org/works/OL1319418W,https://covers.openlibrary.org/b/id/1009545-M.jpg
The Chronicles of Narnia,C.S. Lewis,"ONCE THERE WERE FOUR CHILDREN whose names were Peter, Susan, Edmund, and Lucy, and it has been told in another book called The Lion, the Witch and the Wardrobe how they had a remarkable adventure.","Fantasy fiction, Fiction, Juvenile works, Juvenile fiction, Juvenile audience, good and evil, children, fantasy, Action and adventure fiction, Princes, Fairy tales, Friendship, Witches, the Blitz, fauns, Turkish Delight, lions, English Children's stories, Fantasy & Magic, Action & Adventure, Classics, English Fantasy fiction, Winter, Science Fiction & Fantasy, English Christian fiction, Leones, christianity, Brujas, Magic, Children's stories, English, Ficción juvenil, Novela fantástica, siblings, Bien y mal, Lion, Animals Action & Adventure, JUVENILE FICTION / Legends, Myths, Fables, JUVENILE FICTION / Fantasy & Magic, Narnia (Imaginary place), JUVENILE FICTION / Classics, Children's fiction, Narnia (imaginary place), fiction, Magic, fiction, Child and youth fiction, Fiction, fantasy, general, Lewis, c. s. (clive staples), 1898-1963, Fantasy fiction, history and criticism, Literary recreations, Questions and answers, Princesses, fiction",1970,No page count available,"spa, pol, eng, rus",No rating,https://openlibrary.org/works/OL70988W,https://covers.openlibrary.org/b/id/9321656-M.jpg
The Day of the Triffids,"John Wyndham, Marcel Battin, Cover by Andy Bridge, Catalina Martinez Munoz","When a day that you happen to know is Wednesday starts off by sounding like Sunday, there is something seriously wrong somewhere.","Blind, English Fantasy fiction, Translations into Russian, Science Fiction & Fantasy, Horror, Fiction in English, Fiction, Meteorites, Science fiction, Fantasy fiction, English, Classic Literature, Plant mutation, Fiction, science fiction, general, Large type books, Carnivorous plants, Plants, Blindness, Extraterrestrial beings, Human-alien encounters, 18.05 English literature, Fiction, science fiction, action & adventure",1951,No page count available,"ita, rus, dut, spa, eng",No rating,https://openlibrary.org/works/OL1911336W,https://covers.openlibrary.org/b/id/535027-M.jpg
Stardust,Neil Gaiman,There was once a young man who wished to gain his Heart's Desire.,"Young men, Fiction, Brujas, underworld, Magia, Quests (Expeditions), Jóvenes (Hombres), Fantasy, Novela fantástica, Witches, Magic, Ficción, Búsquedas (Expediciones), Young men -- Fiction, England -- Fiction, Comics & graphic novels, fantasy, Comics & graphic novels, historical fiction, England, fiction, Fiction, fantasy, historical, Fiction, romance, fantasy, Fiction, action & adventure, Movie novels, Alex award, Juvenile fiction, Social life and customs, Love stories, Fairy Story, Meteors, Meteoros, Ficción juvenil, Estrellas fugaces, Jóvenes (Varones), Spanish language materials, Literature, Stardust (Motion picture), Manners and customs, nyt:e-book-fiction=2013-12-22, New York Times bestseller, Man-woman relationship, Adventure fiction, Fairies, Voyages and travels, Comics & graphic novels, fantasy, general, Comics & graphic novels, historical fiction, general",1997,No page count available,"spa, eng, tur",No rating,https://openlibrary.org/works/OL15833328W,https://covers.openlibrary.org/b/id/8216379-M.jpg
Moll Flanders,Daniel Defoe,"My true name is so well known in the records, or registers, at Newgate and in the Old Bailey, and there are some things of such consequence still depending there relating to my particular conduct, that it is not to be expected I should set my name or the account of my family to this work; perhaps after my death it may be better known; at present it would not be proper, no, not though a general pardon should be issued, even without exceptions of persons or crimes.","Fiction, Social life and customs, Criminals, English Picaresque literature, English Adventure stories, Women, Children of prisoners, Prostitutes, Repentance, British, Exile (Punishment), Prostitution, Fiction in Spanish, English fiction, Classic Literature, British and irish fiction (fictional works by one author), London (england), fiction, Virginia, fiction, Criminals, fiction, Fiction, action & adventure, The fortunes and misfortunes of the famous Moll Flanders, Manners and customs, Fiction, general, History, Female offenders, Texts, Criticism and interpretation, English literature, Criminelles, Romans, nouvelles, German, Dictionaries, English language, Korean, Drama, Fortune hunters, Brigands and robbers, General, French, Scottish Chapbooks, Women adventurers, Chapbooks, Specimens, English Chapbooks, Large type books, Fiction, classics, Fiction, coming of age, Enfants de prisonniers, Britanniques, Bannissement, Prostituées, Repentir, Criminels, Femmes, Roman anglais, Children of criminals, Mœurs et coutumes, Guidebooks, Children's fiction, Women, fiction, Adventure and adventurers, fiction, Chronology, Bibliography, Children of prisoners--fiction, British--virginia--fiction, Exile (punishment)--fiction, Prostitutes--fiction, Repentance--fiction, Criminals--fiction, Women--fiction, Pr3404 .m6 2005b, 823/.5",1722,No page count available,"rus, eng, kor, fre, ger, heb, dut, spa",No rating,https://openlibrary.org/works/OL45139W,https://covers.openlibrary.org/b/id/12997559-M.jpg
The Celestine Prophecy - An Adventure,James Redfield,"I drove up to the restaurant and parked, then leaned back in my seat to think for a moment.","divinity, synchronicity, reality Maya civilization, Incas, Adventure stories, prophecy, parables, Action and adventure fiction, Aramaic manuscripts, Fiction, Spiritual life, Manuscripts, Collectors and collecting, Spiritual life in literature, Ficción, Vida espiritual, Coleccionistas y colecciones, Manuscritos, New Age, Literatura, Mysticism, Romans, Collectionneurs et collections, Roman, Vie spirituelle, Manuscrits, Millennialism, Travel, Divination, Manucritos, Chang pian xiao shuo, Fiction, religious, Environmental engineering, Large type books, Fiction, visionary & metaphysical, Literature and fiction (general), Parables, 18.06 Anglo-American literature, Celestine prophecy (Redfield, James), Fiction, general, Redfield, james, Manuscripts--collectors and collecting, Manuscripts--collectors and collecting--peru--fiction, Spiritual life--fiction, Manuscripts--collectors and collecting--fiction, Ps3568.e3448 c45 1993c, 813/.54",1993,No page count available,"tur, chi, ita, fre, jpn, spa, ger, eng",No rating,https://openlibrary.org/works/OL53168W,https://covers.openlibrary.org/b/id/8749217-M.jpg
Novels (Adventures of Huckleberry Finn / Adventures of Tom Sawyer),Mark Twain,"""TOM!"" No answer.","Juvenile works, juvenile audience, literature, child witnesses, young men, Male friendship, Runaway children, voyages and travels, juvenile literature, rafting, adventure and adventurers, orphans, slavery, friendship, history, runaway teenagers, boys in literature, Slaves, Race relations, Boys, Fugitive slaves, Fiction, Travel, Juvenile fiction, Social life and customs, Adventure stories, Bildungsromans, Humorous fiction, Humorous stories, Coming of age fiction, Adventure fiction, Children's fiction, Mississippi river, fiction, Missouri, fiction, Adventure and adventurers, fiction, Sawyer, tom (fictitious character), fiction, American literature, Huckleberry Finn (Fictitious character), Tom Sawyer (Fictitious character), Huckleberry Fin (Fictitious character), Mississippi River, Missouri, Treasure troves, Manners and customs, American fiction (fictional works by one author), Finn, huckleberry (fictitious character), fiction, Fiction, humorous, general, Fiction, action & adventure, Slaves, fiction, Friendship, fiction, Fiction, coming of age, Young adult fiction, Garçons, Romans, nouvelles, Voyages",1922,No page count available,"ger, rus, lit, chi, eng",No rating,https://openlibrary.org/works/OL16025215W,https://covers.openlibrary.org/b/id/12374727-M.jpg
Different Seasons,Stephen King,"There's a guy like me in every state and federal prison in America, I guess-I'm the guy who can get it for you.","first-person narrative, post-traumatic stress disorder, World War II, law school, Vietnam War, Germans, Nazis, war crime, Holocaust, Schutzstaffel, forgery, school counselors, blackmail, safe deposit boxes, bluffing, homelessness, Jews, serial killers, rifles, basements, heart attack, ambulances, gas chambers, Nazi hunters, suicide, prisoners, prisons, frame tale, lawyers, pool, chess, Christmas, decapitation, novellas, first-person, war criminals, SS, guidance counselors, homeless, heart attacks, third person, seasons, good and evil, fantasy fiction, horror fiction, horror tales, escapes, friendship, missing persons, assertiveness, autonomy, American fiction, Adventure fiction, Action and adventure fiction, suspense, horror, audiobooks, World War 1939-1945, Atrocities, Jewish Holocaust, Motion picture fiction, Spanish fiction, Short stories, Fiction, Large type books, Zhong pian xiao shuo, Zuo pin ji, World War, 1939-1945, Holocaust, Jewish (1939-1945), German language, Readers, American literature, Fiction, horror, Fiction, short stories (single author), Storytelling, Polish language materials, Men, Polish language, Materiał w Języku Polskiem, Accessible book, Protected DAISY, Guerre mondiale, 1939-1945, Romans, nouvelles, Atrocités, Holocauste, 1939-1945, Évasions",1982,No page count available,"eng, rus, fre, ger, spa, tur, pol, chi, ita, dut",No rating,https://openlibrary.org/works/OL81621W,https://covers.openlibrary.org/b/id/14655761-M.jpg
Herland,Charlotte Perkins Gilman,"This is written from memory, unfortunately.","Utopias, Fiction, Women, Matriarchat, Utopie, Classic Literature, open_syllabus_project, Matriarchy, Sex role, American fiction (fictional works by one author), Utopias in literature, American fiction, American literature, Women authors, Feminism, Literary collections, English fiction, Fiction, humorous, general, Horror, Literary, Fiction, fantasy, general, Fiction, action & adventure",1915,No page count available,"ger, eng",No rating,https://openlibrary.org/works/OL2771987W,https://covers.openlibrary.org/b/id/448130-M.jpg
Julie of the Wolves,Jean Craighead George,MIYAX PUSHED BACK THE HOOD OF HER sealskin parka and looked at the Arctic sun.,"Juvenile fiction, Eskimos, Wolves, Newbery Medal, Survival skills, Fiction, Translations into Spanish, Lobos, Children's stories, English, Ficción juvenil, Wilderness survival, Survival, Spanish language materials, Novela juvenil, Esquimales, Supervivencia fuera de la civilización, Supervivencia, Survival after airplane accidents, shipwrecks, Survival in literature, Inuit, Juvenile literature, Eskimo children, Runaway children, Reading comprehension, English language, Readers (Secondary), Textbooks for foreign speakers, Teenage girls, Loup, Newbery Award Winner, Habiletés de survie, Romans, nouvelles, etc. pour la jeunesse, Accelerated Reader, Inuits, Newbery Medal books, Eskimos, fiction, Children's fiction, Wolves, fiction, Indians of north america, fiction, Survival, fiction, Large type books, Roman pour la jeunesse, Adventure and adventurers, fiction, award:Newbery_award, lexile:700, lexile_range:701-800, age:min:8, age:max:12, grade:min:3, grade:max:7",1972,No page count available,"chi, fre, ara, spa, ger, eng",No rating,https://openlibrary.org/works/OL111833W,https://covers.openlibrary.org/b/id/12903627-M.jpg
A Clash of Kings,"George R. R. Martin, George RR Martin",No description available,"Fantasy fiction, Fiction, Fantasy, New York Times bestseller, nyt:trade_fiction_paperback=2011-12-31, Fiction - Fantasy, Fantasy - Epic, Fantasy - Series, Fiction / Fantasy / Epic, Fiction, fantasy, epic, Seven kingdoms (imaginary place), fiction, Civil war, Imaginary places, Magic, Action & Adventure, Dragons, Science Fiction, Epic, Refugees, Good and evil, American Fantasy fiction, Kings and rulers, Imaginary wars and battles, Alchemy, Seven Kingdoms (Imaginary place), Guerras imaginarias, Betrayal, Revenge, Voyages and travels, Traición, Viajes, Alquimia, Ficción, Reyes y soberanos, American literature, Brothers, Novela, Dystopian, Romans, nouvelles",1998,No page count available,"chi, fre, cat, por, spa, pol, eng",No rating,https://openlibrary.org/works/OL257939W,https://covers.openlibrary.org/b/id/4853-M.jpg
Dinosaurs Before Dark,"Mary Pope Osborne, Sal Murdocca, Macarena Salas, Jenny Laird, Kelly Matthews, Nichole Matthews","""Help! A monster!"" said Annie.","Fiction, Juvenile fiction, Magic, Dinosaurs, Tree houses, Time travel, Spanish language materials, Brothers and sisters, Dinosaurios, Magia, Casas en árboles, Ficción juvenil, Viajes a través del tiempo, Children's fiction, Dinosaurs, fiction, Time travel, fiction, Magic, fiction, Fantasy fiction, Tree houses, fiction, Adventure and adventurers, fiction, Literature and fiction, juvenile, Brothers and sisters, fiction",1992,No page count available,"chi, fre, ara, spa, pol, eng",No rating,https://openlibrary.org/works/OL81773W,https://covers.openlibrary.org/b/id/14390457-M.jpg
The Mouse and the Motorcycle,Beverly Cleary,"Keith, el muchacho que llevaba unos pantalones cortos y una camisa arrugada, no sabia que estaba siendo observado cuando entr en la habitaci n 215 del Hotel Bellavista.","transportation, juvenile fiction, readers, chapter books, animals, mice, humorous stories, hotels, People & Places, social themes, friendship, Juvenile works, juvenile audience, juvenile literature, Motion Pictures, Adapted for Television, ABC Weekend Specials, Motorcycling, Fiction, Hotels, motels, TV Movies, Humor (Fiction), Spanish language materials, Bars (Drinking establishments), Motels, Children's fiction, Mice, fiction, Large type books, Literature and fiction, juvenile, Motorcycles, Cycling, Adventure and adventurers, fiction, Motorcycles, fiction, Hotels, motels, etc., fiction",1965,No page count available,"dan, spa, eng",No rating,https://openlibrary.org/works/OL151938W,https://covers.openlibrary.org/b/id/12996603-M.jpg
