Title,Author,Description,Category,Published Date,Page Count,Language,Average Rating,Preview Link,Thumbnail
The Hitch Hiker's Guide to the Galaxy,Douglas Adams,The house stood on a slight rise just on the edge of the village.,"comic science fiction, Vogons, Humorous fiction, Imaginary voyages, wit and humour, Science Fiction, Interstellar travel, Fiction, Interplanetary voyages, Open Library Staff Picks, Life on other planets, Ford Prefect (Fictitious character), Arthur Dent (Fictitious character), Humorous stories, Viajes interplanetarios, Ficción, Language readers, Reading Level-Grade 11, Reading Level-Grade 12, Radio plays, English literature, Fiction, science fiction, general, Fiction, humorous, Dent, arthur (fictitious character), fiction, Prefect, ford (fictitious character), fiction, Fiction, science fiction, action & adventure, Christian life, Indians of North America, Science-fiction, Fiction, humorous, general, New age movement, Fiction, action & adventure, English language, Adventure, Humorous, Action & adventure, General, Space opera, English & college success -> english -> fiction, English & college success -> english -> humor",1979,No page count available,"ita, cze, fre, eng, spa, tur, chi, rus, ger",No rating,https://openlibrary.org/works/OL2163649W,https://covers.openlibrary.org/b/id/12986869-M.jpg
Le Tour du Monde en Quatre-Vingts Jours,Jules Verne,"MR. PHILEAS FOGG LIVED, IN 1872, AT NO. 7, SAVILLE Row, Burlington Gardens, the house in which Sheridan died in 1814.","Viajes alrededor del mundo, Translations into Gujarati, Fiction, Translations from French, Children's stories, French, Historical fiction, Korean language materials, Adventure and adventurers, Open Library Staff Picks, Children's stories, English, Adventure stories, Wagers, French fiction, Juvenile fiction, Translations into English, Voyages around the world, Ficción, Adventure fiction, French Science fiction, Submarines (Ships), Sea stories, Science, Continental european fiction (fictional works by one author), Fiction, action & adventure, Children's fiction, Voyages and travels, fiction, Adventure and adventurers, fiction, Balloons, fiction, Large type books, Travel, Flights around the world, English fiction, Translations into French, Readers, French language, Classic Literature, British and irish fiction (fictional works by one author), Roman d'aventures, Roman pour la jeunesse, Spanish language books, Spanish language, English language, Textbooks for foreign speakers, Readers for new literates, Travelers, Criticism and interpretation, Critique et interprétation, Tour du monde en quatre-vingts jours (Verne, Jules), Aventures, Romans, Romans, nouvelles, etc. pour la jeunesse, Littérature pour la jeunesse, Ouvrages pour la jeunesse, Voyages autour du monde, Paris, Employés de maison, Policiers, Erreur sur la personne, Lectures et morceaux choisis, Lecture (Enseignement Primaire), Problèmes et exercices, Voyages, Thriller, Literatura, Action & Adventure - General, Weltreise, Fantasy, Romance literature, Detectives, fiction, March family (fictitious characters), fiction, American fiction (fictional works by one author), Sisters, fiction, Vols autour du monde, Fiction, fantasy, general, Illustraties, Frans, Comics & graphic novels, general, Aeronautics, Ke xue huan xiang xiao shuo, Chang pian xiao shuo, Romans, nouvelles, General, Suo xie ben, Littérature française, Histoire et critique, Fiction, general",1872,No page count available,"eng, gle, kor, fre, nor, ger, wel, yid, jpn, por, chi, guj, ita, spa",No rating,https://openlibrary.org/works/OL1100007W,https://covers.openlibrary.org/b/id/6976035-M.jpg
"The Lion, the Witch and the Wardrobe",C.S. Lewis,"HABIA UNA VEZ CUATRO NINOS CUYOS nombres eran Pedro, Susana, Edmundo y Lucia.","the Blitz, fauns, Turkish Delight, lions, English Children's stories, Fantasy & Magic, Action & Adventure, Classics, juvenile works, English Fantasy fiction, Witches, Winter, Science Fiction & Fantasy, English Christian fiction, Spanish language materials, Fiction, Good and evil, Leones, christianity, Open Library Staff Picks, Brujas, Magic, Translations from English, Children's stories, English, Ficción juvenil, Novela fantástica, open_syllabus_project, siblings, Fantasy fiction, Juvenile fiction, Bien y mal, Fantasy, Fairy tales, Lion, JUVENILE FICTION / Fantasy & Magic, Narnia (Imaginary place), JUVENILE FICTION / Classics, Children, Animals, Aslan the Lion (Fictitious character), JUVENILE FICTION / Action & Adventure, Friendship, Narnia (Lugar imaginario), Narnia (imaginary place), fiction, Children's fiction, Large type books, Children's literature, study and teaching, British and irish fiction (fictional works by one author), Adventure and adventurers, fiction, Child and youth fiction, Lion, fiction, Witches, fiction, Short stories, Literature and fiction, fantasy, Fiction, fantasy, general, Fiction, action & adventure, Pictorial works, Fiction, thrillers, general",1950,No page count available,"tib, swe, chi, kor, ita, fre, jpn, rus, vie, spa, wel, dan, ger, pol, eng",No rating,https://openlibrary.org/works/OL71037W,https://covers.openlibrary.org/b/id/8441376-M.jpg
Alice's Adventures in Wonderland / Through the Looking Glass,Lewis Carroll,"Alice was beginning to get very tired of sitting by her sister on the bank, and of having nothing to do: once or twice she had peeped into the book her sister was reading, but it had no pictures or conversations in it, ""and what is the use of a book,"" thought Alice, ""without pictures or conversations?""","adventure and adventurers, adventure and adventurers, fiction, adventure stories, adventure travel, animals, anthropomorphism, artists' illustrated books, books and reading, british and irish fiction (fictional works by one author), child and youth fiction, children, children's fiction, children's literature, children's literature, english, children's stories, children's stories, english, classic literature, classics, croquet, curiosity, curiosity in children, english, english adventure stories, english fantastic fiction, english fantasy fiction, english fantasy literature, english language, english literature, english nonsense verses, fairy tales, fantasy, fantasy & magic, fantasy fiction, fantasy in fiction, fantasy  magic, fiction, friendship, girls, girls, fiction, hookahs, humor, humorous stories, illustrations, imaginary places, imagination & play, juvenile fiction, juvenile literature, legends, literary nonsense, logic, mythical animals, nonsense verses, playing cards, rabbits, readers, reading materials, short novel, tea, texts, Specimens, Textual Criticism, Criticism and interpretation, Open Library Staff Picks, Ficción juvenil, Novela fantástica, Portuguese language materials, Fantasía, History, History and criticism, CHR 1960, PRO Tehon, Susan (donor), Alice (Fictitious character : Carroll), PRO Tehon, Atha (former owner) (Tehon Collection copy), Littérature anglaise, 18.05 English literature, Alice (fictitious character : carroll), fiction, Fiction, fantasy, general, Carroll, lewis, 1832-1898, Large type books, Translations into French, JUVENILE FICTION / Action & Adventure / General, JUVENILE FICTION / Classics, JUVENILE FICTION / Fairy Tales & Folklore / Adaptations, English fiction (collections), 20th century, Rabbits, fiction, English fiction, Picture books, Alice (Fictitious character), Accessible book, Condensed books, Through the looking glass, Alice's adventures in Wonderland (Carroll, Lewis), Through the looking-glass (Carroll, Lewis), Literature, Translations into Polish, Imaginary Voyages, Literatură engleză, Roman, Literatură pentru copii, Novela fantástica inglesa, Traducciones al español, Literatura inglesa, Flickor, Barn- och ungdomslitteratur, Drömmar, Fantasiresor, Parallella världar, Fiction, general, Philosophy, Literature, collections, Tong hua, Zuo pin ji, Philosophy in literature",1889,No page count available,"chi, fre, pol, ger, spa, ita, por, rum, und, rus, eng",No rating,https://openlibrary.org/works/OL151411W,https://covers.openlibrary.org/b/id/8595966-M.jpg
The Horse and His Boy,C.S. Lewis,"THIS IS THE STORY OF AN ADVENTURE that happened in Narnia and Calormen and the lands between, in the Golden Age when Peter was High King in Narnia and his brother and his two sisters were King and Queens under him.","Fantasy, Children's fiction, Allegory, Aventures, Magie, Frères et soeurs, Roman pour la jeunesse, Chevaux, Narnia (Lieu imaginaire), Romans, nouvelles, etc. pour la jeunesse, Roman fantastique, Fantasy fiction, Adventure and adventurers, fiction, Narnia (imaginary place), fiction, Horses, fiction, Child and youth fiction, Horses, Juvenile fiction, Narnia (Imaginary place), Good and evil, Fairy tales, Fiction, Fantastic fiction, English literature, English Fantasy fiction, Translations into Spanish, Juvenile literature, Spanish language materials, Fantasía, Magic, Polish language materials, Adventure stories, Fiction, fantasy, general, Boys, fiction, Narnia (Lugar imaginario), Ficción juvenil, Bien y mal, Novela fantástica, Fiction, general",1954,No page count available,"ger, pol, spa, chi, ita, arm, vie, swe, tur, eng, und, jpn, fre",No rating,https://openlibrary.org/works/OL71058W,https://covers.openlibrary.org/b/id/9184792-M.jpg
The Voyage of the Dawn Treader,C.S. Lewis,"THERE WAS A BOY CALLED EUSTACE Clarence Scrubb, and he almost deserved it.","Narnia, The Voyage of the Dawn Treader, The Chronicles of Narnia, Narnia (imaginary place), fiction, Children's fiction, Fantasy fiction, Fantasy, Narnia (Imaginary place), Allegory, Large type books, Fiction, Juvenile fiction, Child and youth fiction, Good and evil, Voyages and travels, Narnia (Lugar imaginario), Ficción juvenil, Bien y mal, Viajes, Novela fantástica, English Fantasy fiction, Children's stories, Merveilleux, Romans, Selfishness, Narnia (Imaginary place) (Fictitious character), Narnia (Imaginary place)(Fictitious character), Selfishness in children, Ships, Adventure stories, Magic, Witches, Good an evil, Adventure and adventurers, fiction, Fiction, fantasy, general, Fairy tales",1952,No page count available,"ger, pol, spa, chi, ita, vie, swe, eng, und, jpn, fre",No rating,https://openlibrary.org/works/OL71132W,https://covers.openlibrary.org/b/id/9184719-M.jpg
The Last Battle,C.S. Lewis,"IN THE LAST DAYS OF NARNIA, FAR UP to the west beyond Lantern Waste and close beside the great waterfall, there lived an Ape.","Juvenile Fiction, Science Fiction & Fantasy, Fiction, Fantasy, Children's fiction, Narnia (imaginary place), fiction, Fantasy fiction, Juvenile, Narnia (Imaginary place), Magic, Child and youth fiction, Good and evil, English Fantasy fiction, English literature, 20th century, Adventure and adventurers, fiction, Fiction, fantasy, general, Voyages and travels, Narnia (Lugar imaginario), Ficción juvenil, Bien y mal, Viajes, Novela fantástica, Good and evil, fiction",1956,No page count available,"ger, pol, spa, chi, ita, vie, swe, eng, jpn",No rating,https://openlibrary.org/works/OL71124W,https://covers.openlibrary.org/b/id/6529226-M.jpg
The Call of the Wild,Jack London,"Buck did not read the newspapers, or he would have known that trouble was brewing, not alone for himself, but for every tide-water dog, strong of muscle and with warm, lone hair, from Puget Sound to San Diego.","Gold discoveries, Bienestar, Lobos, Descubrimiento de oro, Crítica e interpretación, American Nature stories, Cartoons and comics, Feral dogs, Robo de mascotas, Pet theft, Dogs in literature, American Adventure stories, Criticism and interpretation, Dogs, Literatura norte americana, High interest-low vocabulary books, Sea stories, Gold mines and mining, In literature, Relatos de aventuras, Readers for new literates, Animales, Perros, Children's stories, American, Adventure and adventurers, Open Library Staff Picks, Animal welfare, Ficción juvenil, open_syllabus_project, Adventure stories, Perros de trineo, Wolves, Fiction, History, Wolfdogs, Perros salvajes, Juvenile fiction, History and criticism, Sled dogs, Ficción, Human-animal relationships, Social life and customs, Reading Level-Grade 5, Reading Level-Grade 7, Reading Level-Grade 6, Reading Level-Grade 8, Children: Grades 4-6, Children: Grades 3-4, Large type books, Children's fiction, Alaska, fiction, Dogs, fiction, American fiction (fictional works by one author), Fiction, action & adventure, Readers, American literature, Wolves, fiction, Yukon, fiction, Adventure and adventurers, fiction, Fiction, fantasy, general, Fiction, general, Italijanščina, Vaje, Jezikovni pouk, British and irish fiction (fictional works by one author), Animals, fiction, Theft, fiction, Canada, fiction, Juvenile literature, American fiction, Translations into Chinese, Fiction, historical, general, English language, juvenile literature, Natural disasters, fiction, Chiens, Romans, nouvelles, Loups, Chiens-loups, Livres en gros caractères, Large print books, Romans, nouvelles, etc. pour la jeunesse, Canada, history, fiction, Gold mines and mining, fiction, Human-animal relationships in literature, Découvertes d'or, Action & Adventure, General, Literature, Call of the wild (London, Jack), Dogs -- Fiction, Nature stories, Klondike River Valley (Yukon) -- Fiction, Sled dogs -- Fiction, Pet theft -- Fiction, Feral dogs -- Fiction, Animal welfare -- Fiction, Dogs--klondike river valley (yukon)--fiction, Adventure stories, american, Wolfdogs--fiction, Ps3523.o46 a6 1998b, 813/.52, London, jack , 1876-1916, Adventure stories, american--history and criticism, Nature stories, american--history and criticism, Animal welfare--fiction, Feral dogs--fiction, Pet theft--fiction, Sled dogs--fiction, Dogs--fiction, Ps3523.o46 c3 1980, Chiens errants, Vol d'animaux familiers, Chiens de traîneaux",1903,No page count available,"chi, ara, dut, gle, fre, ger, alb, fin, yid, spa, ita, por, swe, kor, eng, heb",No rating,https://openlibrary.org/works/OL14942956W,https://covers.openlibrary.org/b/id/12393037-M.jpg
The Twits,Roald Dahl,No description available,"Humorous stories, Animals, Open Library Staff Picks, Animal welfare, Practical jokes, Fiction, Treatment, Children's stories, Juvenile fiction, Monkeys, Drama, English drama, Children's plays, English, Conduct of life, Revenge, Tricksters, Human behavior, Juvenile Wit and humor, Children, Humorous fiction, Accelerated Reader - 4.8., Children's fiction, Birds, fiction, Monkeys, fiction, Plays, Children's plays, British and irish drama (dramatic works by one author), Récits humoristiques, Adventure and adventurers, fiction",1967,No page count available,"wel, fre, ger, pol, eng, kor, spa",No rating,https://openlibrary.org/works/OL45884W,https://covers.openlibrary.org/b/id/8231793-M.jpg
The Devil's Dictionary,Ambrose Bierce,"ABASEMENT, n. A decent and customary mental attitude in the presence of wealth of power.","Humor, English language, Semantics, Vocabulary, Dictionaries, American wit and humor, Humor (Nonfiction), Nonfiction, Reference, Grammar & Language Usage, Language Arts, Religion & Spirituality, English language, dictionaries, Adventure and adventurers, Buried treasure, Fiction, American literature, Play on words, English language, glossaries, vocabularies, etc., OverDrive, Modern Translations into Greek, humour, American Satire, Satire, american, English language -- Dictionaries -- Humor, English language -- Semantics -- Humor, Vocabulary -- Humor, Humor (grappigheden), Amerikaans, Anglais (Langue), Dictionnaires",1840,No page count available,"chi, fre, ger, spa, ita, por, gre, eng",No rating,https://openlibrary.org/works/OL7973273W,https://covers.openlibrary.org/b/id/12671319-M.jpg
The Last of the Mohicans,James Fenimore Cooper,"IT was a feature peculiar to the colonial wars of North America, that the toils and dangers of the wilderness were to be encountered before the adverse hosts could meet.","Adventure stories, Ficción, Fiction, Frontier and pioneer life, Historia, Historical fiction, History, Indians of North America, Indios de América del Norte, Juvenile fiction, Mohegan Indians, Natty Bumppo (Fictitious character), Novela histórica, Relatos de aventura, United States French and Indian War, 1755-1763, open_syllabus_project, Adventure fiction, French and Indian War (United States : 1754-1763) fast (OCoLC)fst01800886, Roman, Mohegan (Indiens), French and Indian War, 1755-1763, Dictionaries, English language, French, Spanish, Classic Literature, Chinese, United states, history, french and indian war, 1755-1763, fiction, Bumppo, natty (fictitious character), fiction, American fiction (fictional works by one author), Fiction, historical, Large type books, Native Americans, Frontier and pioneer life, fiction, Fiction, historical, general, Fiction, war & military, Indians of north america, fiction, Textbooks for foreign speakers, Readers for new literates, Comic books, strips, Graphic novels, Bandes dessinées, Histoire, Romans graphiques, Adaptations, Natty Bumppo (Fictional character), Adventure graphic novels, Children's fiction, Romans, nouvelles, Drama, Comics & graphic novels, general, American literature, Adventure and adventurers, fiction, Fiction, general, Indians, Mohikaner, Untergang, Fiction, action & adventure, Readers (Primary), Bumppo, Natty (Fictitious character), Bumppo, Natty (Fictitious character) -- Fiction, Mohegan Indians -- Fiction, Frontier and pioneer life -- Fiction, United States -- History -- French and Indian War, 1754-1763 -- Fiction, United States, Land tenure, Economic conditions, Commerce",1826,No page count available,"ger, por, pol, spa, ita, eng, dan, rus, fre",No rating,https://openlibrary.org/works/OL77958W,https://covers.openlibrary.org/b/id/8236937-M.jpg
El Libro de la selva / The Jungle Book,"Rudyard Kipling, Carl Bowen, Gerardo Sandoval, Benny Fuentes, John Lockwood Kipling, Stéphane Mourgues, Geneviève Debeuré-De Jongh, Jean-Claude Henryot, Brigitte Zaugg, Maurice Wilson, Rafael Mayani, Virginie Clauzel, Nicola Butler, Clapton Commons Clapton Commons Publishing, Alex Fabrizio, Aberdeen Press, Karl Simrock, Jessica Swale, Joe Stilgoe, Janice Greene, Brigitte Juanals, Gwen Keraval, Michael Page, Norman Nodel, Classic Reads, Francisca Marquez, Stéphane Mourgues, Geneviève Debeuré-De Jongh, Jean-Claude Henryot, Liz Miles, Giovanni Pota, Dave Gibbons, Nik Marcel, Louis Fabulet, Robert d'Humieres","It was seven o'clock of a very warm evening in the Seeonee hills when Father Wolf woke up from his day's rest, scratched himself, yawned, and spread out his paws one after the other to get rid of the sleepy feeling in their tips.","Novela inglesa, Traducciones al español, Jungles, Fiction, Juvenile fiction, Animals, Romans, nouvelles, etc. pour la jeunesse, Novela juvenil, Selvas, Animales, Jungle animals, Mowgli (Fictitious character), Boys, Short stories, Feral children, English Adventure stories, Children's stories, English, Folklore, Legends and stories of Animals, Legends, Children's stories, American, India, Long Now Manual for Civilization, Wild children, Mowgli (Fictitious character) -- Fiction, Adventure stories, English, Jungle animals -- Fiction, Feral children -- Fiction, Boys -- Fiction, India -- Fiction, Children: Grades 1-2, Mongooses, Children's fiction, Jungles, fiction, Jungle animals, fiction, Mowgli (fictitious character), fiction, India, fiction, Stories, Boys, fiction, Adventure and adventurers, fiction, British and irish fiction (fictional works by one author), Drama (dramatic works by one author), Animals, fiction, Faune de la jungle, Romans, nouvelles, Enfants sauvages, Garçons, Histoires pour enfants anglaises, Adventure stories, English literature, History, Classic Literature, Mowgli (Personnage fictif), Animaux, Romans, Human-animal relationships, Juvenile literature, Animals -- Fiction, Jungles -- Fiction, nyt:hardcover-graphic-books=2009-04-05, New York Times bestseller, Readers, Reporters and reporting, Picture books, Children, fiction, Graphic novels, Comic books, strips, Children's stories, Spanish language materials, Ficción juvenil, Animales de jungla, English fiction, English Short stories",1914,No page count available,"eng, fre, ger, chi, spa",No rating,https://openlibrary.org/works/OL19870W,https://covers.openlibrary.org/b/id/3344204-M.jpg
The Riddle of the Sands,Erskine Childers,"I HAVE read of men who, when forced by their calling to live for long periods in utter solitude-save for a few black faces-have made it a rule to dress regularly for dinner in order to maintain their self-respect and prevent a relapse into barbarism.","Great britain, fiction, Fiction, action & adventure, Fiction, thrillers, espionage, Fiction, alternative history, Fiction, sea stories, Large type books, Fiction, Invasions, History, Secret service, Sailing, British, Classic Literature, Thriller, Mystery, Fiction, espionage, General, Invasions of Great Britain, English Spy stories, Secret service -- Fiction, Sailing -- Fiction, Spy fiction, Alternative histories (Fiction), Adventure fiction, Sea stories, Great Britain -- History -- Invasions -- Fiction, Frisian Islands -- Fiction, Great Britain -- History, Europe -- Frisian Islands, Great Britain, Readers, English language, juvenile literature",1903,No page count available,"ger, chi, spa, eng, und",No rating,https://openlibrary.org/works/OL23797W,https://covers.openlibrary.org/b/id/2293974-M.jpg
Where the Wild Things Are,Maurice Sendak,"The night Max wore his wolf suit and made mischief of one kind and another his mother called him ""WILD THING!""","Caldecott Medal, Dreams, Fantasy, Fantasy fiction, Fiction, Imagination, Juvenile fiction, Miniature books, Monsters, Specimens, Fantasty, Monstruos, Fantasía, Spanish language materials, Novela, open_syllabus_project, Kings and rulers, Conduct of life, Fairy tales, Children, Animals, Temper tantrums, Ficción juvenil, Accelerated Reader 2.9., Caldecott Medal books, Children's fiction, Monsters, fiction, Picture books, Novela juvenil, Action & Adventure, Classics, People & Places, Hispanic & Latino, Spanish language, Reading materials, French Juvenile fiction, Juvenile fiction, French, Children's stories, German language materials, collectionID:caldecott60, Behavior, Latin language materials, Dreams, fiction, Monstres, Ouvrages illustrés, Littérature de jeunesse anglaise, award:Caldecott_award, lexile:740, lexile_range:701-800, lexile_code:AD, age:min:1, age:max:5, Adventure and adventurers, fiction, Islands, fiction, Animals, fiction, Behavior, fiction",1600,No page count available,"chi, nor, dut, afr, fre, ger, wel, spa, ita, baq, jpn, rus, kor, eng, heb",No rating,https://openlibrary.org/works/OL2568879W,https://covers.openlibrary.org/b/id/50842-M.jpg
The War of the Worlds,H. G. Wells,"When H. G. Wells wrote The War of the Word, science and technology had already changed much about the world, and promised to change even more.","Imaginary wars and battles, Juvenile fiction, Space warfare, Science Fiction & Fantasy, Fiction, Diseases, Martians, Invasions, Classic Literature, Open Library Staff Picks, open_syllabus_project, English Science fiction, Imaginary wars and battles in literature, Mars (Planet), Science fiction, Space vehicles, Earth, Romance Ingles, Fiction, science fiction, general, British and irish fiction (fictional works by one author), Fiction, fantasy, general, Children's fiction, Examinations, Vocabulary, SAT (Educational test), English language, Study guides, Fiction, action & adventure, Large type books, Life on other planets, War stories, Extraterrestrial beings, fiction, Outer space, fiction, Literature, English literature, Seres extraterrestres, Extraterrestrial beings, Ficcion, Guerra espacial, Fiction, science fiction, action & adventure, Human-alien encounters, Comic books, strips, Wells, h. g. (herbert george), 1866-1946, Adaptations, Graphic novels, Aladdin (legendary character), fiction, War, fiction, Adventure and adventurers, fiction, Guerras imaginarias, Novela, Guerra, Life on other planets, fiction, Fiction, war & military, Imaginary wars and battles -- Fiction, Space warfare -- Fiction, Mars (Planet) -- Fiction, Imaginary wars and battles--fiction, Space warfare--fiction, Pr5774 .w3 2005dx, 823.912",1898,No page count available,"chi, dut, ukr, fre, ger, mon, dan, spa, ita, por, und, eng",No rating,https://openlibrary.org/works/OL52114W,https://covers.openlibrary.org/b/id/36314-M.jpg
Les Contes de ma mère l'Oye,Charles Perrault,"ONCE UPON A TIME there lived a king and queen who were grieved, more grieved than words can tell, because they had no children.","Nursery rhymes, France, Children's stories, French, Fairy tales, Folklore, Translations into English, French language, Readers, New York Times reviewed, Children's stories, Danish, Contes, Problèmes et exercices, Contes des fées (Perrault, Charles), Folklore, france, Short stories, french, translations into english, Children's stories, Children's fiction, Adventure and adventurers, fiction, Fiction, general, World politics, Periodicals, Politique mondiale, Périodiques, Politique internationale, Publications périodiques, Relations internationales, INTERNATIONAL RELATIONS, Denmark, fiction, Miniature books, Specimens, French Manuscripts, Facsimiles, Children's stories, English, Juvenile literature, 843.4 j",1675,No page count available,"fre, ita, rus, vie, dut, por, spa, arm, ger, eng",No rating,https://openlibrary.org/works/OL23869W,https://covers.openlibrary.org/b/id/308893-M.jpg
