Title,Author,Description,Category,Published Date,Page Count,Language,Average Rating,Preview Link,Thumbnail
On Writing,Stephen King,No description available,"writing, Salem’s Lot, science fiction, Happy Stamps, The Elements of Style, drinking, adverbs, Horror tales--Authorship, Locus Award winner, Bram Stoker Award winner, biography, Arte de escribir, Novelistas estadounidenses, Biografía, Autores estadounidenses, American Novelists, Technique, Literary Memoir, American Authors, Authorship, Memoir, authors, Horror tales, Cuentos de terror, Reading Level-Grade 11, Reading Level-Grade 12, Authors, biography, Horror tales, authorship, King, stephen, 1947-, Performing arts, biography, nyt:education=2014-12-07, New York Times bestseller, Personal memoirs, [document], Style, Écrivains américains, Biographies, Récits d'horreur, Art d'écrire, Récits personnels, Création littéraire, Document, King, stephen , 1947-, Authorshipking, stephen , 1947-, Authors, american, Authors, american--20th century--biography, American authors--biography, Horror fiction--technique, Ps3561.i483 z475 2010, 813/.54, Protected DAISY, Accessible book, Biography: general, Creative writing guides, Literature: History & Criticism, Biography/Autobiography, Biography & Autobiography, Biography / Autobiography, Literary, Composition & Creative Writing - General, Language Arts & Disciplines / Composition & Creative Writing, 20th century, Horror fiction",1999,No page count available,"ukr, swe, chi, ita, fre, cze, rus, por, spa, dan, ger, pol, eng",No rating,https://openlibrary.org/works/OL81601W,https://covers.openlibrary.org/b/id/9255939-M.jpg
The Haunted Bookshop,Christopher Morley,"IF YOU are ever in Brooklyn, that borough of superb sunsets and magnificent vistas of husband-propelled baby-carriages, it is to be hoped you may chance upon a quiet by-street where there is a very remarkable bookshop.","Detective and mystery stories, Booksellers and bookselling, Fiction, Mystery and detective stories, Classic Literature, New york (n.y.), fiction, Fiction, mystery & detective, general, Booksellers and bookselling, fiction, Fiction, general, Bookstores, Fiction, horror",1919,No page count available,"eng, spa",No rating,https://openlibrary.org/works/OL619317W,https://covers.openlibrary.org/b/id/935927-M.jpg
The Haunting of Hill House,Shirley Jackson,"NO LIVE organism can continue for long to exist sanely under conditions of absolute reality; even larks and katydids are supposed, by some, to dream.","Haunted houses, Fiction, Large type books, Casas embrujadas, Cuentos de terror, Ficción, Gothic revival (Literature), Horror tales, Novela gótica, Novela psicológica, Psychological fiction, Fiction, psychological, Fiction, horror, Fiction, gothic, American fiction (fictional works by one author), Empire chese roman, Literature, haunted, ghost, Ghost stories, End of the world, FICTION / Gothic, FICTION / Horror, FICTION / Psychological, Haunted houses--fiction, Ps3519.a392 h3 2006, 813/.54",1959,No page count available,"jpn, ger, por, eng, spa, ita",No rating,https://openlibrary.org/works/OL3171069W,https://covers.openlibrary.org/b/id/4289014-M.jpg
The Eyes of the Dragon,Stephen King,"Once, in a kingdom called Delain, there was a King with two sons.","suspense, horror, epic fantasy, Fantasy, Fiction, Thriller, Princes, Dragons, Wizards, Horror fiction, Fantasy fiction, Fantasy genre, good and evil, Inheritance and succession, Horror tales, American literature, Tales, Legends, Large type books, Fiction, horror, Fiction, fantasy, general, Fantastic fiction, nyt:mass-market-monthly=2022-07-10, New York Times bestseller, Children's fiction, Fiction, science fiction, general, Accessible book, Protected DAISY, In library, Fiction, ghost",1959,No page count available,"chi, fre, rus, spa, ger, pol, eng",No rating,https://openlibrary.org/works/OL81602W,https://covers.openlibrary.org/b/id/8524085-M.jpg
The Road,"Cormac McCarthy, Tom Stechschulte",No description available,"Fiction, Dystopia, Adventure, post-apocalyptic fiction, extinction event, Open Library Staff Picks, Fathers and sons, Survival skills, Regression (Civilization), Voyages and travels, literary fiction, Robinsonades, Apocalyptic fiction, Novels, Apocalypse, Long Now Manual for Civilization, Description and travel, Survival, Father-son relationship, Road fiction, Fathers and sons--Fiction, Voyages and travels--Fiction, Regression (Civilization)--Fiction, Reading Level-Grade 7, Reading Level-Grade 6, Reading Level-Grade 9, Reading Level-Grade 8, Reading Level-Grade 11, Reading Level-Grade 10, Reading Level-Grade 12, Hunger, Civilization, Ethics, Disasters, Travel, Fathers and sons, fiction, Fiction, dystopian, Fiction, science fiction, general, American fiction (fictional works by one author), Large type books, nyt:mass-market-paperback=2008-12-07, New York Times bestseller, New York Times reviewed, Fathers And Sons_Fiction; Fiction_Dystopian; Fiction_Science Fiction_General; American Fiction (Fict, Fiction, general, Fiction, horror",2006,No page count available,"chi, fre, ita, cat, spa, pol, heb, eng",No rating,https://openlibrary.org/works/OL40873W,https://covers.openlibrary.org/b/id/198120-M.jpg
The Haunted Hotel,Wilkie Collins,"In the year 1860, the reputation of Doctor Wybrow as a London physician reached its highest point.","Fiction, English fiction, Hotels, Horror fiction, Haunted houses, Large type books, Classic Literature, Fiction, mystery & detective, traditional, Italy, fiction, Fiction, fantasy, paranormal, Venice (italy), fiction, Revenge, British and irish fiction (fictional works by one author), Fiction, mystery & detective, general",1878,No page count available,"spa, eng, fre",No rating,https://openlibrary.org/works/OL176025W,https://covers.openlibrary.org/b/id/2890291-M.jpg
Witch Wood,John Buchan,No description available,"Fiction, historical, Clergy, fiction, Fiction, historical, general, Fiction, fantasy, general, Fiction, horror, Witchcraft, History, Fiction",1927,No page count available,eng,No rating,https://openlibrary.org/works/OL76578W,https://covers.openlibrary.org/b/id/4781924-M.jpg
The Magician,William Somerset Maugham,ARTHUR BURDON and Dr Porhoet walked in silence.,"Fiction, Magicians, Magic, English Authors, Biography, Good and evil, Europe, fiction, Fiction, psychological, British and irish fiction (fictional works by one author), Fiction, horror, Paris (france), fiction, Fiction, general, Magier, English literature, Fiction in English, Fiction in English 1900- Texts",1908,No page count available,"rus, eng, chi, ger",No rating,https://openlibrary.org/works/OL505730W,https://covers.openlibrary.org/b/id/2789948-M.jpg
The Empty House and Other Ghost Stories,Algernon Blackwood,No description available,"Fiction, horror, Horror tales, Short stories, English literature",1906,No page count available,"eng, spa",No rating,https://openlibrary.org/works/OL2700647W,https://covers.openlibrary.org/b/id/2808629-M.jpg
Stuart Little,E. B. White,"WHEN Mrs. Frederick C. Little's see son arrived, everybody noticed that he was not much bigger than a mouse.","Voyages and travels, Mice, Juvenile fiction, JUVENILE FICTION / Social Themes / Friendship, JUVENILE FICTION / Animals / Mice, Hamsters, Guinea Pigs, Fiction, JUVENILE FICTION / Classics, Determination (Personality trait), Size perception, Friendship, Birds, family, Juvenile audience, classics, social themes, animals, Mice in fiction, Voyages and travels in fiction, Children's stories, Mice -- Fiction, Stuart Little (Fictitious character), Mice, fiction, Children's fiction, Little, stuart (fictitious character), fiction, Voyages and travels, fiction, Souris, Adoption, Romans, nouvelles, etc. pour la jeunesse, Large type books, Accelerated Reader, 5.5., Horror tales, Vampires, Mummies, Werewolves, Witches, Books and reading, Horror fiction, Adventure and adventurers, fiction",1945,No page count available,"chi, eng, fre, spa, ger, ita, rus",No rating,https://openlibrary.org/works/OL483385W,https://covers.openlibrary.org/b/id/10522876-M.jpg
The Dark Half,Stephen King,"People's lives-their real lives, as opposed to their simple physical existences-begin at different times.","alcohol abuse, parasitic twins, alcoholism, authors, Conjoined twins, suspense, Anonyms and pseudonyms, American novelists, Audiobooks, Horror tales, Fiction, Horror, Murder, Violence, Supernatural, Extortion, Castle Rock, Maine (Imaginary place), Castle Rock (Me. : Imaginary place), Novelists, Investigation, Horror fiction, Murderers, Castle Rock (Maine : Imaginary place), Large type books, French language, American literature, Translations into German, Fiction, horror, Authors, fiction, Latin america, fiction, Écrivains, Romans, nouvelles, Jumeaux siamois, Romanciers américains, Beaumont, thad (fictitious character), fiction, Protected DAISY",1989,No page count available,"tur, chi, fre, ita, rus, spa, ger, pol, eng",No rating,https://openlibrary.org/works/OL81620W,https://covers.openlibrary.org/b/id/8530409-M.jpg
Thinner,Stephen King,"""Thinner,"" the old Gypsy man with the rotting nose whispers to William Halleck as Halleck and his wife, Heidi, come out of the court-house.","gluttony, magic, Romani, Allegories, Horror, Juvenile fiction, Littérature d'épouvante, Romanies, Occult fiction, Horror stories, Horror fiction, Horror tales, Jeunesse, Livres et lecture, FICTION / Media Tie-In, FICTION / Thrillers, FICTION / Horror, Blessing and cursing, Weight loss, Fiction, Fiction, science fiction, general, Fiction, horror, Large type books, Billy Halleck (Fictitious character), Paranormal fiction, American literature, Halleck, billy (fictitious character), fiction, Fiction, media tie-in, Lawyers, fiction",1984,No page count available,"fre, dut, spa, eng, rus, por, ita, ger, pol",No rating,https://openlibrary.org/works/OL149210W,https://covers.openlibrary.org/b/id/8274288-M.jpg
The Day of the Triffids,"John Wyndham, Marcel Battin, Cover by Andy Bridge, Catalina Martinez Munoz","When a day that you happen to know is Wednesday starts off by sounding like Sunday, there is something seriously wrong somewhere.","Blind, English Fantasy fiction, Translations into Russian, Science Fiction & Fantasy, Horror, Fiction in English, Fiction, Meteorites, Science fiction, Fantasy fiction, English, Classic Literature, Plant mutation, Fiction, science fiction, general, Large type books, Carnivorous plants, Plants, Blindness, Extraterrestrial beings, Human-alien encounters, 18.05 English literature, Fiction, science fiction, action & adventure",1951,No page count available,"ita, rus, dut, spa, eng",No rating,https://openlibrary.org/works/OL1911336W,https://covers.openlibrary.org/b/id/535027-M.jpg
Everything's Eventual. 14 Dark Tales,"Stephen King, Esther Roig Giménez",No description available,"Apple computers, dementia, fantasy, garbage disposal units, convenience stores, gangrene, fishing, short stories, yard sales, suicide, rest areas, horror, stroke, hitchhiking, headstones, amusement rides, occult, depression, nicotine, chef's knives, frying pans, fiction, Suspense fiction, American horror tales, journalists, hostages, The New York Times, interrogation, communism, insurgency, seizures, autopsy, doctors, paralysis, shrapnel, snakes, impotence, traveling sales personnel, loneliness, paranormal, supernatural, ghosts, horror fiction, Open Library Staff Picks, Horror tales, American, Fiction, horror, Fiction, short stories (single author), American literature, Fiction, thrillers, general, New York Times reviewed, American fiction (fictional works by one author), Accessible book, Protected DAISY, King, Stephen - Prose & Criticism, Fiction - General, Literary, Short Stories (single author), Fiction / General",2002,No page count available,"fre, eng, dut, pol, rus, per, spa, ger, gre, por",No rating,https://openlibrary.org/works/OL81584W,https://covers.openlibrary.org/b/id/8585782-M.jpg
Petals on the Wind,V. C. Andrews,How young we were the day we escaped.,"series:dollanganger, Fiction, dysfunctional families, Domestic fiction, Horror fiction, Dilation and curettage, Mystery fiction, mothers and daughters, revenge, suspense, persistent vegetative state, incest, doughnuts, arsenic, blackmail, psychiatric hospitals, Inheritance and succession, Problem families, Horror, Fiction - General, General, Fiction / General, Horror - General, Child abuse, Fiction, horror, Dollanger family (fictitious characters), fiction, Fiction, general, Children's stories, Large type books, American literature, Fiction, family life, general, Mothers and daughters, fiction, Fiction, gothic, Fiction, sagas, Abused children, Brothers and sisters, Ninos maltratados, Ficcion, Hermanos, Ficción, Patrimonio, collectionid:vcadg",1980,No page count available,"fre, spa, ger, pol, eng",No rating,https://openlibrary.org/works/OL134890W,https://covers.openlibrary.org/b/id/9358432-M.jpg
Tales of Terror and Mystery,Arthur Conan Doyle,"The idea that the extraordinary narrative which has been called the Joyce-Armstrong Fragment is an elaborate practical joke evolved by some unknown person, cursed by a perverted and sinister sense of humour, has now been abandoned by all who have examined the matter.","Classic Literature, English Detective and mystery stories, English Horror tales, English Short stories, Fiction, Horror, Mystery, English literature, Fiction, general, Fiction, thrillers, general, Fiction, mystery & detective, general, British and irish fiction (fictional works by one author), Fiction, short stories (single author), Fiction, horror, Large type books",1963,No page count available,eng,No rating,https://openlibrary.org/works/OL262586W,https://covers.openlibrary.org/b/id/8311421-M.jpg
Different Seasons,Stephen King,"There's a guy like me in every state and federal prison in America, I guess-I'm the guy who can get it for you.","first-person narrative, post-traumatic stress disorder, World War II, law school, Vietnam War, Germans, Nazis, war crime, Holocaust, Schutzstaffel, forgery, school counselors, blackmail, safe deposit boxes, bluffing, homelessness, Jews, serial killers, rifles, basements, heart attack, ambulances, gas chambers, Nazi hunters, suicide, prisoners, prisons, frame tale, lawyers, pool, chess, Christmas, decapitation, novellas, first-person, war criminals, SS, guidance counselors, homeless, heart attacks, third person, seasons, good and evil, fantasy fiction, horror fiction, horror tales, escapes, friendship, missing persons, assertiveness, autonomy, American fiction, Adventure fiction, Action and adventure fiction, suspense, horror, audiobooks, World War 1939-1945, Atrocities, Jewish Holocaust, Motion picture fiction, Spanish fiction, Short stories, Fiction, Large type books, Zhong pian xiao shuo, Zuo pin ji, World War, 1939-1945, Holocaust, Jewish (1939-1945), German language, Readers, American literature, Fiction, horror, Fiction, short stories (single author), Storytelling, Polish language materials, Men, Polish language, Materiał w Języku Polskiem, Accessible book, Protected DAISY, Guerre mondiale, 1939-1945, Romans, nouvelles, Atrocités, Holocauste, 1939-1945, Évasions",1982,No page count available,"eng, rus, fre, ger, spa, tur, pol, chi, ita, dut",No rating,https://openlibrary.org/works/OL81621W,https://covers.openlibrary.org/b/id/14655761-M.jpg
Herland,Charlotte Perkins Gilman,"This is written from memory, unfortunately.","Utopias, Fiction, Women, Matriarchat, Utopie, Classic Literature, open_syllabus_project, Matriarchy, Sex role, American fiction (fictional works by one author), Utopias in literature, American fiction, American literature, Women authors, Feminism, Literary collections, English fiction, Fiction, humorous, general, Horror, Literary, Fiction, fantasy, general, Fiction, action & adventure",1915,No page count available,"ger, eng",No rating,https://openlibrary.org/works/OL2771987W,https://covers.openlibrary.org/b/id/448130-M.jpg
Red Dragon,Thomas Harris,"Will Graham installa Crawford ä une table de pique-nique entre la maison et l'océan, puis lui servit un verre de thé glacé.","Novel, psychiatrists, cannibalism, serial killers, offender profiling, FBI, stalking, photographic processing, The Great Red Dragon and the Woman Clothed in Sun, dissociative identity disorder, child abuse, sadistic personality disorder, tabloids, erectile dysfunction, homosexuality, Battle of Shiloh, American Civil War, Criminal profilers, Government investigators, Serial murder investigation, Detective and mystery fiction, Thrillers, Suspense fiction, Mystery fiction, Fiction, Mystery and detective stories, American Detective and mystery stories, American Horror tales, Asesinatos seriales, Detective and mystery stories, American, Ficción, Horror tales, American, Investigadores gubernamentales, Novela de misterio, Serial murders, Thriller, United States. Federal Bureau of Investigation, psychopaths, homicide investigation, Serial murderers, Fiction, horror, Fiction, mystery & detective, general, Large type books, Graham, will (fictitious character), fiction, Fiction, thrillers, general, Lecter, hannibal (fictitious character), fiction, Science-fiction, Fiction, romance, general, Hannibal Lecter (Fictitious character), Serial murders, fiction, Fiction, thrillers, Enquêteurs de la fonction publique, Romans, nouvelles, Meurtres en série, NOVELAS ESTADOUNIDENSES",1981,No page count available,"chi, fre, ita, gre, vie, por, spa, ger, eng",No rating,https://openlibrary.org/works/OL23480W,https://covers.openlibrary.org/b/id/6997898-M.jpg
Insomnia,Stephen King,"No one-least of all Dr. Litchfield-came right out and told Ralph Roberts that his wife was going to die, but there came a time when Ralph understood without needing to be told.","Bram Stoker Award for Best Novel, suspense, Suspense Thriller, Open Library Staff Picks, Horror, Insomnia, Fiction, Horror fiction, Fiction, horror, Maine, fiction, Roberts, ralph (fictitious character), fiction, People with disabilities, fiction, Large type books, Horror tales, Suspense fiction, FICTION / Media Tie-In, FICTION / Thrillers / Supernatural, FICTION / Thrillers / Suspense, Parapsychologie, Romans, nouvelles, Fantasy fiction, Roman fantastique, Accessible book, Protected DAISY",1994,No page count available,"fre, eng, spa, rus, ger, pol, chi",No rating,https://openlibrary.org/works/OL81603W,https://covers.openlibrary.org/b/id/7886954-M.jpg
Jaws,Peter Benchley,No description available,"blue sharks, dolphins, shark cage diving, bang sticks, harpoons, Mafia, selectmen, connivance, great white sharks, thrillers, horror fiction, Fiction, Marine biologists, Police chiefs, Seaside resorts, Shark attacks, Sharks, Sea stories, Fiction, horror, Fiction, thrillers, general, Fiction, action & adventure, Jaws (Motion picture), Fiction, sea stories, Scientists, fiction, white shark, shark fishing, United states, fiction, Fiction, suspense, Fiction, thrillers, Fiction, thrillers, suspense, American fiction, Translations into Spanish, Spanish fiction, Literatura estadounidense, Roman espagnol, Fishes",1973,No page count available,"chi, fre, rus, spa, ger, eng",No rating,https://openlibrary.org/works/OL3454854W,https://covers.openlibrary.org/b/id/8440296-M.jpg
The Silence of the Lambs,Thomas Harris,"Behavioral Science, the FBI section that deals with serial murder, is on the bottom floor of the Academy building at Quantico, half-buried in the earth.","lambs, black witch moth, autopsy, pupa, offender profiling, forensic psychiatry, Federal Bureau of Investigation, Fiction, Government investigators, Psychology, Serial murderers, Serial murders, Detective and mystery stories, Hannibal Lecter (Fictitious character), Large type books, Fiction, suspense, Fiction, horror, Fiction, psychological, Fiction, mystery & detective, women sleuths, Lecter, hannibal (fictitious character), fiction, Hannibal, nick (fictitious character), fiction, Fiction, mystery & detective, general, Serial murders, fiction, Regény, Amerikai irodalom, Fiction, thrillers, suspense",1988,No page count available,"chi, ger, eng, dut, spa, jpn, vie, rus, por, fre, pol, hun",No rating,https://openlibrary.org/works/OL23481W,https://covers.openlibrary.org/b/id/8580475-M.jpg
Gerald's Game,Stephen King,"Jessie could hear the back door banging lightly, randomly, in the October breeze blowing around the house.","Horror tales, Fiction, Horror, Horror fiction, American fiction, married people, sexual behavior, women, fear, Adult child sexual abuse victims, incest, Sadomasochism, terror, Translations into German, Large type books, Fiction, horror, New York Times reviewed, Mental illness, FICTION / Horror, FICTION / Literary, Castle Rock (Me. : Imaginary place), Sexualité dans le mariage, Romans, nouvelles, Peur, Castle Rock (Maine : Imaginary place), Burlingame, jessie (fictitious character), fiction, Maine, fiction, Mystery & Detective - General, Fiction - Mystery/ Detective",1992,No page count available,"tur, fre, rus, spa, ger, pol, eng",No rating,https://openlibrary.org/works/OL81617W,https://covers.openlibrary.org/b/id/10705875-M.jpg
Rose Madder,Stephen King,"It was fourteen years of hell, all told, but she hardly knew it.","rose madder, audiobooks, miscarriage, internal affairs, women's shelters, domestic violence, Greek mythology, fantasy, thriller, horror, Fiction, Revenge, Domestic Abuse, Runaway wives, Art in fiction, Horror tales, Art, Psychological fiction, love stories, Fiction, suspense, Fiction, thrillers, general, Psychological aspects, American literature, Horror fiction, Wife abuse, Large type books, Fiction, horror, New York Times reviewed, Terror, Mcclendon, rose (fictitious character), fiction, Fiction, psychological, Marriage, fiction, Accessible book, Protected DAISY, Married people, fiction",1995,No page count available,"fre, eng, spa, rus, por, ger",No rating,https://openlibrary.org/works/OL81614W,https://covers.openlibrary.org/b/id/8578049-M.jpg
Desperation,Stephen King,Oh !,"Fiction, Travelers, Traffic police, American fiction, Horror tales, Horror, Suspense, Psychological fiction, Spanish: Adult Fiction, Horror fiction, Police, American Horror tales, American literature, Large type books, Fiction, horror, Nevada, fiction, Spanish language, Novela estadounidense, Novela fantástica, Novela psicológica, Cuentos de terror, Viajeros, Novela, Carver, david (fictitious character), fiction, Fiction, psychological",1996,No page count available,"fre, ita, rus, por, spa, ger, pol, eng",No rating,https://openlibrary.org/works/OL81611W,https://covers.openlibrary.org/b/id/8757374-M.jpg
From a Buick 8,Stephen King,No description available,"Pennsylvania State Police, ghost story, drunk driving, angel dust, horror fiction, Teenage boys, Police, Open Library Staff Picks, Fiction, Abandonment of automobiles, Buick automobile, Abandonment of automobiles -- Fiction, Police -- Pennsylvania -- Fiction, Buick automobile -- Fiction, Teenage boys -- Fiction, Pennsylvania -- Fiction, Fiction, horror, Pennsylvania, fiction, Fiction, suspense, Fiction, thrillers, general, Horror stories, Large print books, Spanish language, conversation and phrase books, FICTION / Horror, FICTION / Science Fiction / Alien Contact, FICTION / Small Town & Rural, Pennsylvania, Accessible book, Protected DAISY, Horror - General, Fiction - Horror, Fiction / General, General, Spanish: Adult Fiction, Fiction - Espionage / Thriller, Suspense, Thrillers, Fiction / Thrillers",1925,No page count available,"tur, fre, rus, dut, por, spa, ger, pol, eng",No rating,https://openlibrary.org/works/OL81586W,https://covers.openlibrary.org/b/id/6502777-M.jpg
Dreamcatcher,Stephen King,No description available,"male friendship, life on other planets, telepathy, Down Syndrome, psychological fiction, extraterrestrial beings, hunting, friendship, Fiction, Human-alien encounters, Fear, Fantasy Fiction, Roman fantastique, Audiobooks, hunting stories, camping, Fiction, horror, Maine, fiction, American literature, LITERATURE, NOVEL, Horror fiction, Science/Fantasy Fiction, Fiction, suspense, Spanish fiction, Literatura estadounidense, Novela, Rencontres avec les extraterrestres, Romans, nouvelles, Seres extraterrestres, Protected DAISY, Accessible book, General & Literary Fiction, Horror & ghost stories, Literary, Fiction - Horror, Movie/Tv Tie-Ins, Horror - General, Fiction / Literary, Movie-TV Tie-In - General, Suspense, Large print books, Fiction / General, Large type books",2001,No page count available,"fre, rus, spa, ger, eng",No rating,https://openlibrary.org/works/OL81598W,https://covers.openlibrary.org/b/id/14651654-M.jpg
Hearts in Atlantis,Stephen King,Bobby Garfield's father had been one of those fellows who start losing their hair in their twenties and are completely bald by the age of forty-five or so.,"Lord of the Flies, somatoform disorders, penance, dormitories, Hearts, The Dark Tower, psychics, Baby Boomer generation, thrillers, Bildungsromans, Manners and customs, suspense, horror, literary fiction, Social life and customs, Vietnam War, 1961-1975, Vietnamese Conflict, 1961-1975, Fiction, Vietnam War, 1961-1975 -- Fiction, United States -- Social life and customs -- 20th century -- Fiction, Fiction, horror, Maine, fiction, Fiction, short stories (single author), United states, social life and customs, fiction, Vietnam war, 1961-1975, fiction, Fiction, thrillers, general, Influence, Influence (Literary, artistic, etc.), Large type books, Fiction, war & military, Horror tales",1998,No page count available,"chi, fre, gre, rus, spa, ger, pol, eng",No rating,https://openlibrary.org/works/OL81624W,https://covers.openlibrary.org/b/id/8536326-M.jpg
