Title,Author,Description,Category,Published Date,Page Count,Language,Average Rating,Preview Link,Thumbnail
Pride and Prejudice,Jane Austen,The text of Pride and Prejudice is the 1813 first edition text.,Fiction,1980,388,en,No rating,http://books.google.co.in/books?id=EvqJCGeqKhsC&dq=subject:romance&hl=&cd=1&source=gbs_api,http://books.google.com/books/content?id=EvqJCGeqKhsC&printsec=frontcover&img=1&zoom=1&source=gbs_api
Dare to Love,Carly Phillips,"She arouses his dominant and protective instincts And he will do anything to possess her … And does. When billionaire Ian Dare gets one glimpse of the sensual and irresistible Riley Taylor, he knows that he must have her. But any future he might have with Riley means he’ll have to confront his past—a past he’d rather forget. And that’s something this NFL team owner won’t dare to do—not even for love.",Fiction,2013-11-18,256,en,4.5,http://books.google.co.in/books?id=ugbmAgAAQBAJ&printsec=frontcover&dq=subject:romance&hl=&cd=2&source=gbs_api,http://books.google.com/books/content?id=ugbmAgAAQBAJ&printsec=frontcover&img=1&zoom=1&edge=curl&source=gbs_api
Sons and Lovers,David Herbert Lawrence,A provocative portrait of an artist torn between love for his possessive mother and desire for two young beautiful women. It is also the story of Paul Morel's growing into manhood torn by both inner and outer conflict.,Fiction,1913,534,en,No rating,http://books.google.co.in/books?id=t34OAAAAIAAJ&dq=subject:romance&hl=&cd=3&source=gbs_api,http://books.google.com/books/content?id=t34OAAAAIAAJ&printsec=frontcover&img=1&zoom=1&source=gbs_api
Love Only Once,Johanna Lindsey,"Kidnapped and seduced by the handsome Nicholas Eden, lovely Regina Ashton falls for her captor, but scandal, danger, and tragic misunderstandings threaten their relationship, in a tale of Regency England.",England,1985,452,en,5,http://books.google.co.in/books?id=w4b-I_NSgXYC&dq=subject:romance&hl=&cd=4&source=gbs_api,http://books.google.com/books/content?id=w4b-I_NSgXYC&printsec=frontcover&img=1&zoom=1&source=gbs_api
Spirit Bound,Richelle Mead,"The international number 1 bestselling Vampire Academy series by Richelle Mead is now a major motion picture. Read it before it hits cinemas in 2014! SALVATION HAS ITS PRICE . . . Fall in love with Rose and Dimitri all over again in Spirit Bound, the anticipated fifth novel in Richelle Mead's enthralling Vampire Academy series. After a long and heartbreaking journey to Siberia, Dimitri's birthplace, Rose Hathaway has finally returned to St. Vladimir's - and to her best friend, Lissa Dragomir. It's graduation, and the girls can't wait for their real lives outside the Academy's cold iron gates to finally begin. But even with the intrigue and excitement of court life looming, Rose's heart still aches for Dimitri. He's out there, somewhere. She failed to kill him when she had the chance, and now her worst fears are about to come true. Dimitri has tasted her blood, and she knows in her heart that he is hunting her. And if Rose won't join him, he won't rest until he has silenced her . . . forever. But Rose can't forget what she learned on her journey - whispers of a magic too impossible and terrifying to comprehend. A magic inextricably tied to Lissa that could hold the answer to all of Rose's prayers, but not without devastating consequences. Now Rose will have to decide what - and who - matters most to her. And in the end, is true love really worth the price? penguinteenaustralia.com",Boarding school students,2010,489,en,4.5,http://books.google.co.in/books?id=-a-YQwAACAAJ&dq=subject:romance&hl=&cd=6&source=gbs_api,http://books.google.com/books/content?id=-a-YQwAACAAJ&printsec=frontcover&img=1&zoom=1&source=gbs_api
Simple Gifts,"Judith McNaught, Jude Deveraux",4 Heartwarming Christmas Stories.,Fiction,2001-12,404,en,No rating,http://books.google.co.in/books?id=_y8kwT-j3sUC&printsec=frontcover&dq=subject:romance&hl=&cd=7&source=gbs_api,http://books.google.com/books/content?id=_y8kwT-j3sUC&printsec=frontcover&img=1&zoom=1&edge=curl&source=gbs_api
Last Sacrifice,Richelle Mead,The final heart wrenching episode at St Vladimir's Academy. Rose is on trial for high treason and the death of Queen Tatiana. Someone is trying to frame her and it looks like even Dimitri might not be able to save her now.,Juvenile Fiction,2010,556,en,No rating,http://books.google.co.in/books?id=Rwcpd5zqrrkC&dq=subject:romance&hl=&cd=8&source=gbs_api,http://books.google.com/books/content?id=Rwcpd5zqrrkC&printsec=frontcover&img=1&zoom=1&source=gbs_api
The Viscount Who Loved Me,Julia Quinn,"# 1 New York Times Bestseller The inspiration for season two of BRIDGERTON, a series created by Shondaland for Netflix, from #1 New York Times bestselling author Julia Quinn: the story of Anthony Bridgerton in the second of her beloved Regency-set novels featuring the charming, powerful Bridgerton family. ANTHONY'S STORY This time the gossip columnists have it wrong. London's most elusive bachelor Anthony Bridgerton hasn't just decided to marry--he's even chosen a wife! The only obstacle is his intended's older sister, Kate Sheffield--the most meddlesome woman ever to grace a London ballroom. The spirited schemer is driving Anthony mad with her determination to stop the betrothal, but when he closes his eyes at night, Kate's the woman haunting his increasingly erotic dreams... Contrary to popular belief, Kate is quite sure that reformed rakes do not make the best husbands--and Anthony Bridgerton is the most wicked rogue of them all. Kate's determined to protect her sister--but she fears her own heart is vulnerable. And when Anthony's lips touch hers, she's suddenly afraid she might not be able to resist the reprehensible rake herself...",Fiction,2022-05-24,512,en,No rating,http://books.google.co.in/books?id=AiH4zgEACAAJ&dq=subject:romance&hl=&cd=9&source=gbs_api,http://books.google.com/books/content?id=AiH4zgEACAAJ&printsec=frontcover&img=1&zoom=1&source=gbs_api
Sense and Sensibility,Jane Austen,Classics with legible texts you can actually read at a fantastic price.,Books and reading,2012-01-31,0,en,No rating,http://books.google.co.in/books?id=Aso0uAAACAAJ&dq=subject:romance&hl=&cd=10&source=gbs_api,http://books.google.com/books/content?id=Aso0uAAACAAJ&printsec=frontcover&img=1&zoom=1&source=gbs_api
The Missing Sister,Lucinda Riley,"From Sunday Times No.1 bestselling author Lucinda Riley comes the latest installment in the epic multimillion-selling series, The Seven Sisters. The story of Merope, the missing sister, is waiting to be told . . . Following Georg Hoffman's revelation that he may have found The Missing Sister, Maia and Ally discover that all they have to go on is an address of a vineyard in New Zealand, plus a drawing of an unusual star-shaped emerald ring. Deciding that CeCe, who lives in Australia, is the closest, they send her to investigate with her partner, Chrissie. So begins a race against time to identify the Missing Sister, so she can join her sisters on The Titan to lay a wreath at a spot on the Aegean Sea where Ally last saw Pa Salt's boat. It's a race that takes them across the globe, as Mary McDougal, the woman who has the emerald ring that can confirm for certain if her daughter, Mary-Kate, is the Missing Sister, has embarked on a world tour after the death of her husband. As each sister takes their turn to trace her in New Zealand, Canada, England, France and Ireland, the elusive Mary manages to slip through their fingers, and it seems that she does not want to be found...",Uncategorized,2021-04-29,576,en,No rating,http://books.google.co.in/books?id=7cULzgEACAAJ&dq=subject:romance&hl=&cd=11&source=gbs_api,http://books.google.com/books/content?id=7cULzgEACAAJ&printsec=frontcover&img=1&zoom=1&source=gbs_api
Heartstopper: Volume 4: A Graphic Novel: Volume 4,Alice Oseman,Heartstopper: Volume 4 was originally published in England by Hachette Children's Group in 2021.,Boys,2022,0,en,No rating,http://books.google.co.in/books?id=yFPQzwEACAAJ&dq=subject:romance&hl=&cd=12&source=gbs_api,No thumbnail available
Fine Things,Danielle Steel,The story of a man who learns that one's capacity to love is not reached until it is tested.,Fiction,1988,415,en,No rating,http://books.google.co.in/books?id=aDYbgk-OCR4C&dq=subject:romance&hl=&cd=13&source=gbs_api,http://books.google.com/books/content?id=aDYbgk-OCR4C&printsec=frontcover&img=1&zoom=1&source=gbs_api
White Hot,Sandra Brown,"When her younger brother commits suicide, Sayre Lynch returns to her hometown for the funeral and finds herself drawn into a web cast by her controlling and tyrranical father.",Fiction,2005,696,en,No rating,http://books.google.co.in/books?id=d2b39aiWVmcC&dq=subject:romance&hl=&cd=14&source=gbs_api,http://books.google.com/books/content?id=d2b39aiWVmcC&printsec=frontcover&img=1&zoom=1&source=gbs_api
Before the Season Ends,Linore Rose Burkard,"Prepare to fall in love with Ariana and her cohorts in this Christian Regency. From her home in the village of Chesterton to the very ballroom of Carlton House, readers will follow her journey of faith--and adventure--to its heartwarming conclusion.",Fiction,2005-05,322,en,3.5,http://books.google.co.in/books?id=7fWxNvWUyWsC&printsec=frontcover&dq=subject:romance&hl=&cd=15&source=gbs_api,http://books.google.com/books/content?id=7fWxNvWUyWsC&printsec=frontcover&img=1&zoom=1&edge=curl&source=gbs_api
An Offer from a Gentleman LP,Julia Quinn,"A New York Times Bestseller From #1 New York Times bestselling author Julia Quinn comes the story of Benedict Bridgerton, in the third of her beloved Regency-set novels featuring the charming, powerful Bridgerton family, now a series created by Shondaland for Netflix. BENEDICT'S STORY Sophie Beckett never dreamed she'd be able to sneak into Lady Bridgerton's famed masquerade ball--or that ""Prince Charming"" would be waiting there for her! Though the daughter of an earl, Sophie has been relegated to the role of servant by her disdainful stepmother. But now, spinning in the strong arms of the debonair and devastatingly handsome Benedict Bridgerton, she feels like royalty. Alas, she knows all enchantments must end when the clock strikes midnight. Ever since that magical night, a radiant vision in silver has blinded Benedict to the attractions of any other--except, perhaps, this alluring and oddly familiar beauty dressed in housemaid's garb whom he feels compelled to rescue from a most disagreeable situation. He has sworn to find and wed his mystery miss, but this breathtaking maid makes him weak with wanting her. Yet, if he offers her his heart, will Benedict sacrifice his only chance for a fairy-tale love?",Fiction,2022-05-24,512,en,No rating,http://books.google.co.in/books?id=Sfv4zgEACAAJ&dq=subject:romance&hl=&cd=16&source=gbs_api,http://books.google.com/books/content?id=Sfv4zgEACAAJ&printsec=frontcover&img=1&zoom=1&source=gbs_api
The Italian Girl,Lucinda Riley,"Rosanna Menici is just a girl when she meets Roberto Rossini, the man who will change her life. In the years to come, their destinies are bound together by their extraordinary talents as opera singers and by their enduring but obsessive love for each other--a love that will ultimately affect the lives of those closest to them. For, as Rosanna slowly discovers, their unison is haunted by irreversible events from the past...",Man-woman relationships,2015,No page count available,en,No rating,http://books.google.co.in/books?id=ZlbsjwEACAAJ&dq=subject:romance&hl=&cd=17&source=gbs_api,http://books.google.com/books/content?id=ZlbsjwEACAAJ&printsec=frontcover&img=1&zoom=1&source=gbs_api
North and South,Elizabeth Cleghorn Gaskell,"Milton is a sooty, noisy northern town centred around the cotton mills that employ most of its inhavitants. Arriving from a rural idyll in the South, Margaret Hale is initially shocked by the social unrest and povery she finds in her new home town -- back cover.","England, Northern",1927,456,en,No rating,http://books.google.co.in/books?id=A1Dtmi0VdMwC&dq=subject:romance&hl=&cd=18&source=gbs_api,http://books.google.com/books/content?id=A1Dtmi0VdMwC&printsec=frontcover&img=1&zoom=1&source=gbs_api
Heir of Fire,Sarah J. Maas,"Celaena Sardothien rises from the ashes to burn even brighter than before. Celaena has survived deadly contests and shattering heartbreak-but at an unspeakable cost. Now, she must travel to a new land to confront her darkest truth.a truth about her h",Uncategorized,2015-09,0,en,No rating,http://books.google.co.in/books?id=FLoNkAEACAAJ&dq=subject:romance&hl=&cd=19&source=gbs_api,http://books.google.com/books/content?id=FLoNkAEACAAJ&printsec=frontcover&img=1&zoom=1&source=gbs_api
The Storm Sister,Lucinda Riley,"Ally D'Apliese is about to compete in one of the world's most perilous yacht races, when she hears the news of her adoptive father's sudden, mysterious death. Rushing back to meet her five sisters at their family home, she discovers that her father - an elusive billionaire affectionately known to his daughters as Pa Salt - has left each of them a tantalising clue to their true heritage. Ally has also recently embarked on a deeply passionate love affair that will change her destiny forever. But with her life now turned upside down, Ally decides to leave the open seas and follow the trail that her father left her, which leads her to the icy beauty of Norway ... There, Ally begins to discover her roots - and how her story is inextricably bound to that of a young unknown singer, Anna Landvik, who lived there over a hundred years before, and sang in the first performance of Grieg's iconic music set to Ibsen's play 'Peer Gynt'. As Ally learns more about Anna, she also begins to question who her father, Pa Salt, really was. And why is the seventh sister missing?",Adopted children,2015-11-05,0,en,No rating,http://books.google.co.in/books?id=yhNNrgEACAAJ&dq=subject:romance&hl=&cd=20&source=gbs_api,http://books.google.com/books/content?id=yhNNrgEACAAJ&printsec=frontcover&img=1&zoom=1&source=gbs_api
Emma,Jane Austen,Emma tries to impose her match making ideas on everyone and finds that sometimes she should desist.,England,1996,422,en,No rating,http://books.google.co.in/books?id=ig1NfvdjQgIC&dq=subject:romance&hl=&cd=21&source=gbs_api,http://books.google.com/books/content?id=ig1NfvdjQgIC&printsec=frontcover&img=1&zoom=1&source=gbs_api
Tara Road,Maeve Binchy,"Thanks to a chance phone call, Ria from Dublin and Marilyn from New England switch houses for the summer with extraordinary results when they are drawn into lifestyles vastly different than their own.",Detective and mystery stories,1999,502,en,No rating,http://books.google.co.in/books?id=dh6-QgAACAAJ&dq=subject:romance&hl=&cd=22&source=gbs_api,http://books.google.com/books/content?id=dh6-QgAACAAJ&printsec=frontcover&img=1&zoom=1&source=gbs_api
Anne of Avonlea,"Montgomery, Ian, Lucy Maud Montgomery","In this sequel to ""Anne of Green Gables,"" teenage Anne Shirley becomes a schoolteacher in a small village on Prince Edward Island.",Islands,1984-05-01,277,en,No rating,http://books.google.co.in/books?id=yllMPgAACAAJ&dq=subject:romance&hl=&cd=23&source=gbs_api,No thumbnail available
Northanger Abbey,Jane Austen,Classics with legible texts you can actually read at a fantastic price.,Books and reading,2012-01-01,256,en,No rating,http://books.google.co.in/books?id=NLc7MAEACAAJ&dq=subject:romance&hl=&cd=24&source=gbs_api,http://books.google.com/books/content?id=NLc7MAEACAAJ&printsec=frontcover&img=1&zoom=1&source=gbs_api
A Loving Scoundrel,Johanna Lindsey,"Danny grew up on the streets of London as a pickpocket, but Jeremy Malory rescues her and hires her as his upstairs maid.",Fiction,2004,528,en,No rating,http://books.google.co.in/books?id=OShhkoZC_9wC&dq=subject:romance&hl=&cd=26&source=gbs_api,http://books.google.com/books/content?id=OShhkoZC_9wC&printsec=frontcover&img=1&zoom=1&source=gbs_api
Mansfield Park,Jane Austen,"A New York Times Bestselling Author -- In Jane Austen's third published novel after Sense and Sensibility and Pride and Prejudice, young Fanny Price is sent to live with her wealthy uncle and aunt, Sir Thomas and Lady Bertram, at Mansfield Park. Raised among her four cousins, Fanny -- the poor relation -- often goes unobserved in the household, making her a unique observer of the ethics, morals, attitudes and behavior of English society.",Fiction,2010,661,en,No rating,http://books.google.co.in/books?id=22veSAAACAAJ&dq=subject:romance&hl=&cd=27&source=gbs_api,http://books.google.com/books/content?id=22veSAAACAAJ&printsec=frontcover&img=1&zoom=1&source=gbs_api
The Thirteen,Honore de Balzac,"This series of three novellas is unified by an overarching motif: in all three tales, a mysterious secret society known as The Thirteen is at work behind the scenes. The men in the group have pledged eternal loyalty to each other, and if any member ever finds himself in peril, it is the sworn duty of the others to come to his aid. Honore de Balzac uses this premise as a device to explore a wide range of topics, including clashes between different classes of society, doomed romances, and intrigue driven by greed.",Classic literature,2014,0,en,No rating,http://books.google.co.in/books?id=2ntOtAEACAAJ&dq=subject:romance&hl=&cd=28&source=gbs_api,http://books.google.com/books/content?id=2ntOtAEACAAJ&printsec=frontcover&img=1&zoom=1&source=gbs_api
Seduce Me at Sunrise,Lisa Kleypas,Can she remember the man he once was?,Great Britain,2008,0,en,5,http://books.google.co.in/books?id=HRDmNwAACAAJ&dq=subject:romance&hl=&cd=29&source=gbs_api,http://books.google.com/books/content?id=HRDmNwAACAAJ&printsec=frontcover&img=1&zoom=1&source=gbs_api
The Perfect Wife,Lynsay Sands,"""It was to be hoped that her groom was partial to cherries. For Avelyn feared she would very much resemble one at their wedding feast. Too round, too red in the scarlet gown that was all she could fit into ... and perhaps too tart for his taste? No doubt he longed for a sweet, biddable bride, one who was as tiny and trim as she was trying to appear. Paen Gerville longed for a lively, well-rounded woman, one whose plump breast would cushion his head after the lonely, harsh life of a solitary fighting knight. At first his wife-to-be promised no such delights - her form was unbending, her health apparently fragile as she fainted into his arms after their first kiss. But one split bridal gown later, her assets were eye-poppingly apparent and Paen could only grin as he anticipated the surprises yet to come on his wedding night with ...""--Publisher's description.",Great Britain,2005,374,en,No rating,http://books.google.co.in/books?id=NqsRzXYI61gC&dq=subject:romance&hl=&cd=30&source=gbs_api,http://books.google.com/books/content?id=NqsRzXYI61gC&printsec=frontcover&img=1&zoom=1&source=gbs_api
Persuasion,Jane Austen,Classics with legible texts you can actually read at a fantastic price.,Books and reading,2012-01-31,0,en,No rating,http://books.google.co.in/books?id=O93ctgAACAAJ&dq=subject:romance&hl=&cd=31&source=gbs_api,http://books.google.com/books/content?id=O93ctgAACAAJ&printsec=frontcover&img=1&zoom=1&source=gbs_api
Somersault,Kenzaburō Ōe,"Ten years after recanting their teachings and abandoning their zealous and violent congregation, two men known only as the Patron and Guide of Humankind seek to overcome a radical faction while leading peaceful followers toward a new future.",Fiction,2003,584,en,No rating,http://books.google.co.in/books?id=xOhkAAAAMAAJ&dq=subject:romance&hl=&cd=32&source=gbs_api,http://books.google.com/books/content?id=xOhkAAAAMAAJ&printsec=frontcover&img=1&zoom=1&source=gbs_api
Above and Beyond,Sandra Brown,Trevor's love for Kyla--the widow of his best friend--is complicated by a secret that threatens to destroy their fragile relationship,Fiction,1986,297,en,No rating,http://books.google.co.in/books?id=QES7mCcS4EwC&dq=subject:romance&hl=&cd=33&source=gbs_api,http://books.google.com/books/content?id=QES7mCcS4EwC&printsec=frontcover&img=1&zoom=1&source=gbs_api
Rising Tides,Nora Roberts,"""New York Times"" bestselling author Nora Roberts presents the second novel in a dramatic trilogy of three men who return home to honor their father's last wish--to care for Seth, a troubled boy in need of a family. The first novel, ""Sea Swept"" brings the character of Cameron Quinn, a racing boat driver, to life. Here, the quiet brother, a fisherman, Ethan Quinn's character is explored.",Fiction,1998-08,0,en,No rating,http://books.google.co.in/books?id=fzdMPgAACAAJ&dq=subject:romance&hl=&cd=34&source=gbs_api,http://books.google.com/books/content?id=fzdMPgAACAAJ&printsec=frontcover&img=1&zoom=1&source=gbs_api
Too Strong to Deny,Emma Darcy,No description available,Fiction,1990,294,en,No rating,http://books.google.co.in/books?id=2LEG-1l0GasC&dq=subject:romance&hl=&cd=35&source=gbs_api,http://books.google.com/books/content?id=2LEG-1l0GasC&printsec=frontcover&img=1&zoom=1&source=gbs_api
Five Days in Paris,Danielle Steel,"Follows the five-day affair between a man and a woman in Paris, a relationship that decides the course of the rest of their lives. Reprint.",Fiction,1997-01-01,291,en,No rating,http://books.google.co.in/books?id=OVAqeqKah5AC&dq=subject:romance&hl=&cd=36&source=gbs_api,http://books.google.com/books/content?id=OVAqeqKah5AC&printsec=frontcover&img=1&zoom=1&source=gbs_api
The Glass Menagerie,Tennessee Williams,The only single edition now available of this American classic about a mother obsessed with her disabled daughter.,Drama,1999,132,en,4,http://books.google.co.in/books?id=tWbVwZjv43kC&dq=subject:romance&hl=&cd=37&source=gbs_api,http://books.google.com/books/content?id=tWbVwZjv43kC&printsec=frontcover&img=1&zoom=1&source=gbs_api
Captivated,Nora Roberts,His interest in her was purely professional ... or so he told himself.,Fiction,2004-01-25,312,en,4,http://books.google.co.in/books?id=4TtmtWzIIpsC&dq=subject:romance&hl=&cd=38&source=gbs_api,http://books.google.com/books/content?id=4TtmtWzIIpsC&printsec=frontcover&img=1&zoom=1&source=gbs_api
The Legacy,Linda Lael Miller,An Australian sheep rancher's dying wish is that his daughter marry the man who was both her first love and unfaithful to her a decade earlier.,Fiction,1994,2,en,No rating,http://books.google.co.in/books?id=wAp-p3golOkC&dq=subject:romance&hl=&cd=39&source=gbs_api,http://books.google.com/books/content?id=wAp-p3golOkC&printsec=frontcover&img=1&zoom=1&source=gbs_api
The Rachel Papers,Martin Amis,"On the eve of his twentieth birthday, Charles Highway reviews his campaign to win over a self-assured girl named Rachel.",Black humor,1992,0,en,No rating,http://books.google.co.in/books?id=11FVPgAACAAJ&dq=subject:romance&hl=&cd=40&source=gbs_api,http://books.google.com/books/content?id=11FVPgAACAAJ&printsec=frontcover&img=1&zoom=1&source=gbs_api
Daughter of the Forest,Juliet Marillier,"This novel is the beginning of a trilogy filled with history and fantasy, myth and magic, and legend and love. Sorcha, the seventh child of Lord Column of Sevenwaters, is destined to defend her family and protect her land from the Britons Northwoods clan.",Kidnapping,2001-03,0,en,No rating,http://books.google.co.in/books?id=_PROPgAACAAJ&dq=subject:romance&hl=&cd=43&source=gbs_api,http://books.google.com/books/content?id=_PROPgAACAAJ&printsec=frontcover&img=1&zoom=1&source=gbs_api
Layla,Colleen Hoover,"""When Leeds meets Layla, he's convinced he'll spend the rest of his life with her--until an unexpected attack leaves Layla fighting for her life. After weeks in the hospital, Layla recovers physically, but the emotional and mental scarring has altered the woman Leeds fell in love with. In order to put their relationship back on track, Leeds whisks Layla away to the bed-and-breakfast where they first met. Once they arrive, Layla's behavior takes a bizarre turn. And that's just one of many inexplicable occurrences.""--",Fiction,2020-12-08,304,en,5,http://books.google.co.in/books?id=jPJzzQEACAAJ&dq=subject:romance&hl=&cd=46&source=gbs_api,http://books.google.com/books/content?id=jPJzzQEACAAJ&printsec=frontcover&img=1&zoom=1&source=gbs_api
Chain of Gold,Cassandra Clare,No description available,Brothers and sisters,2019,No page count available,en,No rating,http://books.google.co.in/books?id=OKp2zQEACAAJ&dq=subject:romance&hl=&cd=47&source=gbs_api,http://books.google.com/books/content?id=OKp2zQEACAAJ&printsec=frontcover&img=1&zoom=1&source=gbs_api
Mastering the Marquess,Vanessa Kelly,"""Since the loss of her parents, Meredith Burnley has contented herself with a solitary life looking after her half-sister, Annabel. But Meredith's peace is shattered when her uncle schemes to marry her off to his son in order to gain her inheritance. Desperate, Meredith has only one choice: to flee with Annabel to their estranged grandparents' home. But their arrival soon reignites a family scandal--and kindles unexpected romance ... Happily reunited with the girls, Annabel's grandmother resolves to convince her nephew, Stephen Mallory, the Marquess of Silverton, to abandon his rakish lifestyle and wed Annabel. Stephen is clearly captivated--but with the wrong sister. Determined to make Meredith his own, Stephen embarks on a seduction that will leave her with no choice but to surrender to his touch ...""--Page 4 of cover.",Fiction,2009-04,499,en,No rating,http://books.google.co.in/books?id=-k2LFLSdY0IC&dq=subject:romance&hl=&cd=48&source=gbs_api,http://books.google.com/books/content?id=-k2LFLSdY0IC&printsec=frontcover&img=1&zoom=1&source=gbs_api
