Title,Author,Description,Category,Published Date,Page Count,Language,Average Rating,Preview Link,Thumbnail
The Return of the Native,Thomas Hardy,No description available,"People with visual disabilities, fiction, Return of the native (Hardy, Thomas), Mothers and sons, fiction, Social conditions, Married people, fiction, Mate selection, fiction, Heathlands, fiction, Adultery, fiction, Wessex (England) -- Fiction, Social life and customs, Man-woman relationships, fiction, Country life, Manners and customs, Villages, British and irish fiction (fictional works by one author), Wessex (england), fiction)"", Fiction, romance, general"", England, fiction, Children's fiction, Open Library Staff Picks, Facsimiles, English Manuscripts, open_syllabus_project, Classic Literature, Manuscripts, Romance Ingles, Great britain, fiction, History, Juvenile literature, Hardy, thomas, Pr4747.a2 m35 2006, 823/.8, People with visual disabilities, Fiction, Mothers and sons, Mate selection, Heathlands, Adultery, Description and travel, Descriptions et voyages, Travel",1878,No page count available,"und, tur, pan, chi, eng",No rating,https://openlibrary.org/works/OL44994W,https://covers.openlibrary.org/b/id/8162989-M.jpg
This Side of Paradise,F. Scott Fitzgerald,"Amory Blaine inherited from his mother every trait, except the stray inexpressible few, that made him worth while.","Fiction, Romance, Historical"", Young men, fiction, World War, 1914-1918, Advertising, Veterans, College students, Children of the rich, Facsimiles, American Manuscripts, Manuscripts, College stories, Love stories, Classic Literature, Young Adult Fiction, School stories, World War (1914-1918) fast (OCoLC)fst01180746, American fiction, American fiction (fictional works by one author), World war, 1914-1918, fiction, Large type books, Bildungsromans, 1920, Fiction, coming of age, Social conditions, Young men -- Fiction, Children of the rich -- Fiction, Advertising -- Fiction, College students -- Fiction, World War, 1914-1918 -- Veterans -- Fiction, Hell, Jeunes hommes, Romans, nouvelles, American literature, College students' writings, American, Literature, Fiction, war & military, German, Dictionaries, English language, French, Spanish, Young men, Manners and customs, Fiction, romance, general",1920,No page count available,"por, eng, spa",No rating,https://openlibrary.org/works/OL468488W,https://covers.openlibrary.org/b/id/8243609-M.jpg
The Great Gatsby,F. Scott Fitzgerald,In my younger and more vulnerable years my father gave me some advice that I've been turning over in my mind ever since.,"Married people, fiction, American fiction (fictional works by one author), Fiction, psychological, Long island (n.y.), fiction, Fiction, Rich people, Mistresses, Married women, Traffic accidents, First loves, Revenge, American Manuscripts, Facsimiles, Manuscripts, Antiheroes, l fiction, Man-woman relationships, fiction, Upper class, American literature, Young adult fiction, comics & graphic novels, classic adaptation, Young adult fiction, social themes, class differences, Young adult fiction, classics, Fiction, historical,  New york (n.y.), fiction"", Comic books, strips, Love, YOUNG ADULT FICTION, Comics & Graphic Novels, Classic Adaptation, Social Themes, Class Differences, Historical, Literary, Man-woman relationship, Rich, Criticism and interpretation, Drama, Modern fiction, Classics, Literature, Open Library Staff Picks, Wealth, Readers, Economic conditions, American fiction, Social life and customs, Long Now Manual for Civilization, Fictional Works Publication Type, Rich people -- Fiction, Romance fiction, Long Island (N.Y.) -- Fiction, Psychological fiction, Love stories, Novela, Relaciones hombre-mujer, Spanish language materials, Nouveau riche, Reading Level-Grade 11, Reading Level-Grade 12, FICTION / General, Moral conditions, Manners and customs, Fitzgerald, f. scott (francis scott), 1896-1940, Large type books, Nineteen twenties, English fiction, New york (state), fiction, Wives, Relations entre hommes et femmes, Romans, nouvelles, Classes supérieures, Nouveaux riches, Premier amour, Riches, Maîtresses, Vengeance, Roman américain, Textual Criticism, Great Gatsby (Fitzgerald, F. Scott), Romance Norte Americano, Fiction, friendship, Fiction, classics, Adultery, Accidents de la route, Millionaires, American Dream, Millionnaires, Rêve américain, Années vingt (Vingtième siècle), Tránsito, Accidentes, Mujeres casadas, Primer amor, Cuentos de amor, Fiction, city life, Fiction, romance, historical, american, Fiction, romance, historical, 20th century, Fiction, historical, world war i, Traffic accidents--Fiction, First loves--Fiction, Rich people--Fiction, Mistresses--Fiction, Revenge--Fiction, Long Island (N.Y.)--Fiction, Novel, American fiction (collections), 20th century, Fiction, fantasy, romance, Fiction, action & adventure, Translations into Chinese, American literature, history and criticism, 19th century, Chang pian xiao shuo, New York (State), First loves -- Fiction, Rich people -- New York (State) -- New York -- Fiction, New York (State) -- Long Island, New York (State) -- New York, Fictional works [publication type], Man-woman relationships--new york (state)--long island--fiction, Upper class--new york (state)--long island--fiction, Ps3511.i9 g7 1995b, 813/.52, Fiction, general, Fiction, romance, general, Man-woman relationships",1920,No page count available,"eng, kor, swe, fre, ger, dan, ind, heb, jpn, rum, por, pol, chi, dut, ita, spa",No rating,https://openlibrary.org/works/OL468431W,https://covers.openlibrary.org/b/id/10590366-M.jpg
Le petit prince,Antoine de Saint-Exupéry,"ALS ICH SECHS Jahre alt war, sah ich einmal in einem Buch uber den Urwald, das ,,Erlebte Geschichten"" hei , ein prachtiges Bild.","adventure, fantasy, friendship, love, childhood, loss, loneliness, Italian language, Children's fiction, Friendship, fiction, Fantasy fiction, Princes, fiction, Fairy tales, Adventure and adventurers, fiction, Princes, Fiction, Toy and movable books, Continental european fiction (fictional works by one author), French language, readers, Romans, nouvelles, Travel, fiction, Juvenile fiction, Children's stories, French, Translations into Turkish, Children's stories, Turkish, Pride and vanity, In library, Asteroids, Conduct of life, Translations into Spanish, Fantasmes, Romans, nouvelles, etc. pour la jeunesse, Príncipes, Novela juvenil, Fiction, general, Philosophy, Princes -- Juvenile fiction, Air pilots -- Juvenile fiction, Friendship -- Juvenile fiction, Princes -- Romans, nouvelles, etc. pour la jeunesse, Pilotes d'aéronef -- Romans, nouvelles, etc. pour la jeunesse, Pilotos aéreos -- Novela juvenil, Príncipes -- Novela juvenil, Amistad -- Novela juvenil, Cuentos de hadas, Air pilots, Novela fantástica, Deaf children, Juvenile, Pied Piper of Hamelin (Legendary character), Legends, Foxes, Deserts, Children's literature, french, Translations into english, Short novel, Translations into serbo-croatian, Allegories, Extraterrestrial beings, Juvenile films, Drama, Planets, Rhaeto-romance/romansh literature, Rhaeto-romance/romansh prose, Texts translated into rhaeto-romance/romansh, Fantastic fiction, General, Fiction - general, Nyt:picture-books=2009-12-27, New york times bestseller, Literary collections",1943,No page count available,"por, wel, heb, tgl, per, und, zul, rus, epo, ger, cze, hrv, roh, spa, fao, mwl, lat, grc, fre, arm, yue, eng, ina, amh, kor, kok, pol, chi, gle, ita, vie, gsw, cat, jpn",No rating,https://openlibrary.org/works/OL10263W,https://covers.openlibrary.org/b/id/10708272-M.jpg
Доктор Живаго,Boris Leonidovich Pasternak,"On they went, singing ""Rest Eternal,"" and whenever they stopped, their feet, the horses, and the gusts of wind seemed to carry on their singing.","Fiction, History, Continental european fiction (fictional works by one author), Fiction, historical, general, Soviet union, history, revolution, 1917-1921, fiction, 958, Prohibited book, Politics, Soviet Union, Revolution, 1917-1921, Historical, Classic, Literature, Books, Novels, Hardcovers, Paperbacks, e-books, audio-books, Movie tie-in, Russian propoganda, Love stories, Russian poetry, Translations into English, Physicians, War stories, Russian Poets, Political fiction, Historical fiction, Epic literature, Didactic fiction, World war, 1914-1918, Revolution (Russia : 1905-1907) fast (OCoLC)fst01354573, Romance fiction, Russian fiction, Fiction, political, Soviet union, fiction, Children's fiction, Readers, Soviet union, history, fiction, English language, Study and teaching, Foreign speakers, Readers for new literates, freedom, Moscow, Romance, Czar Nicholas II, WWI, Russian Revolution, Russian Psychological fiction, Fiction, historical, Long Now Manual for Civilization, Translations into Chinese, Romans, nouvelles, Histoire, Roman russe, Littérature, Russian literature, Littérature russe",1957,No page count available,"chi, est, ita, fre, yid, rus, vie, dut, spa, slo, dan, ger, pol, eng",No rating,https://openlibrary.org/works/OL258301W,https://covers.openlibrary.org/b/id/1045432-M.jpg
The Age of Innocence,Edith Wharton,"ON A January evening of the early seventies, Christine Nilsson was singing in Faust at the Academy of Music in New York.","Fiction, Triangles (Interpersonal relations), Upper class, Married people, Separated people, Social life and customs, Marriage, Separated women, Upper classes, Social norms, New York (N.Y.), Nobility, Love stories, Classic Literature, Literature, Drama, Romance, Pulitzer Prize Winner, award:pulitzer_prize=1921, award:pulitzer_prize=fiction, Manners and customs, open_syllabus_project, Historical fiction, Movie novels, Film novelizations, American fiction, American fiction (fictional works by one author), Married people, fiction, New york (n.y.), fiction, Fiction, family life, Man-woman relationships, fiction, American literature, Large type books, Romance fiction, Chang pian xiao shuo, Fiction, family life, general, Fiction, general, Triangle (Relations humaines), Romans, nouvelles, Couples mariés, Classes supérieures, Civilization, Women, Socialites, archer, innocence, age, madame, olenska, der, newland, beaufort, welland, van, van der, madame olenska, der luyden, young man, countess olenska, newland archer, ellen olenska, archer felt, lovell mingott, der luydens",1920,No page count available,"eng, rus, fre, chi, ita, spa",No rating,https://openlibrary.org/works/OL98491W,https://covers.openlibrary.org/b/id/11196262-M.jpg
Lolita,Vladimir Nabokov,"Lolita, light of my life, fire of my loins.","erotic fiction, romance fiction, fiction, love stories, novela, literary fiction, classic fiction, coming-of-age, Girls in fiction, Girls, Drama, Middle-aged men, Russian fiction, Middle-aged men in fiction, Long Now Manual for Civilization, Stepfathers, Stepdaughters, Man-woman relationships, fiction, Hombres, Relaciones hombre-mujer, Muchachas, Edad madura, Ficción, Pedophilia, Love, Teenage girls, Translations into English, Teenagers, Sexual behavior, Child molesters, Large type books, American fiction (fictional works by one author), Fiction, romance, general, Fiction, erotica, general, Young women, fiction, collectionID:EanesChallenge, Murderers, Hommes d'âge moyen, Romans, nouvelles, Filles, Kommentar, Sex addiction, Abhängigkeit, Sexuelle Attraktion, Stieftochter, Stiefvater, collectionID:bannedbooks, Continental european fiction (fictional works by one author), Художественная литература -- США -- Американская литература -- 2-ая пол. 20 в. -- Романы, Fiction in english, Erotica, Literary collections, Middle-aged men--fiction, Girls--fiction, Ps3527.a15 l6 1992, 813/.54",1955,No page count available,"spa, hin, eng, fre, rus, cze, dut, por, und, ita, chi, pol, ger, jpn",No rating,https://openlibrary.org/works/OL627084W,https://covers.openlibrary.org/b/id/12984540-M.jpg
Wuthering Heights,Emily Brontë,1801-I have just returned from a visit to my landlord-the solitary neighbour that I shall be troubled with.,"British and irish fiction (fictional works by one author), Children's fiction, Classic fiction, Classic Literature, Country homes, Country life, Cousins, Death, Drama, English language, English language readers, English literature, Examinations, Families, family life, Fiction, Foundlings, Historical Fiction, Inheritance and succession, Interpersonal relations, Juvenile fiction, Landscape in literature, love, Manners and customs, orphans, Psychological fiction, Reading Level-Grade 7, Reading Level-Grade 8, Reading Level-Grade 9, Reading Level-Grade 10, Reading Level-Grade 11, Reading Level-Grade 12, Rejection (Psychology), revenge, romance, Romance fiction, romantic fiction, Rural families, slavery, Social life and customs, tragedy, Triangles (Interpersonal relations), Young women, Fiction, general, Revenge -- Fiction, Rejection (Psychology) -- Fiction, Love stories, Domestic fiction, Yorkshire (England) -- Fiction, Foundlings -- Fiction, Rural families -- Fiction, Heathcliff (Fictitious character : Brontë) -- Fiction, Triangles (Interpersonal relations) -- Fiction, Heathcliff (fictitious character), fiction, Fiction, family life, general, Fiction, psychological, Fiction, romance, general, Man-woman relationships, fiction, England, fiction, Triangle (Relations humaines), Romans, nouvelles, Rejet (Psychologie), Familles rurales, Enfants trouvés, Wuthering Heights (Brontë, Emily), Vengeance, English fiction, Triangles (Interpersonal relationships), Yorkshire (England), Roman anglais, Relations entre hommes et femmes, Mœurs et coutumes, Women, Femmes, Heathcliff (Fictitious character), Catherine Earnshawm (Fictitious character), English Gothic fiction, Adaptations, Social conditions, Interpersonal relations, fiction, Roman, Englisch, Wuthering heights (Emily Brontë), Comics & graphic novels, romance, Love, fiction, Comic books, strips, etc., Comics & graphic novels, literary, Literature, collections, American fiction, Foundlings in fiction, Rural families in fiction, England in fiction, Revenge in fiction, Landscape in literature in fiction, Slavery in fiction, Reading books, Country life in fiction, Readers, Orphans in fiction, Study and teaching, Love in fiction, Readers (Adult), Study guides, Accessible book, Zhang pian xiao shuo, Heathcliff (Fictitious character : Brontë), Social conflict, Triangles (interpersonal relations)--fiction, Revenge--fiction, Pr4172 .w7 2009c, 823/.8, Hl 2083, Bronte, emily, 1818-1848",1847,No page count available,"ara, arm, pol, ger, vie, hin, chi, gle, fre, ita, mul, kor, dut, spa, gre, rus, eng, nor, amh, por, jpn",No rating,https://openlibrary.org/works/OL21177W,https://covers.openlibrary.org/b/id/12818862-M.jpg
Murder in Three Acts,Agatha Christie,"MR. Satterthwaite sat on the terrace of Crow's Nest and watched his host, Sir Charles Cartwright, climbing up the path from the sea.","Fiction, Hercule Poirot (Fictitious character), Murder in fiction, Murder, Private investigators, Private investigators in fiction, Detective and mystery stories, Mystery and detective stories, Investigation, Mystery, Fiction, mystery & detective, general, Poirot, hercule (fictitious character), fiction, Private investigators, fiction, Large type books, English Detective and mystery stories, English literature, Actors, Detective and mystery fiction, Literatura inglesa, Romance policial, Zhen tan xiao shuo, Chang pian xiao shuo, Fiction, mystery & detective, traditional, England, fiction",1934,No page count available,"chi, ger, eng, spa, jpn, ara, pol, fre",No rating,https://openlibrary.org/works/OL471765W,https://covers.openlibrary.org/b/id/6874620-M.jpg
The Godfather,Mario Puzo,"Amerigo Bonasera sat in New York Criminal Court Number 3 and waited for justice; vengeance on the men who had so cruelly hurt his daughter, who had tried to dishonor her.","Detective and mystery stories, Organized crime, Criminals, Italian Americans, Mafia, Fiction, Criminals in fiction, Drama, Italian Americans in fiction, Mafia in fiction, Organized crime in fiction, Romance, Corleone family (Fictitious characters), English fiction, Crime, fiction, Criminals, fiction, Italian americans, fiction, New york (n.y.), fiction, Fiction, mystery & detective, general, Large type books, Corleone family (Personajes literarios), Novela, Crimen organizado, German language (Texts), Accessible book, Chinese books (Simplified characters), Crime",1969,No page count available,"jpn, ger, spa, rus, vie, dut, eng, chi, fre, pol, ita",No rating,https://openlibrary.org/works/OL1673205W,https://covers.openlibrary.org/b/id/6507069-M.jpg
Genji monogatari,Murasaki Shikibu,"Among the women in the palace of the Emperor was one named Kiritsubo (Paulownia Court), who though only an Imperial Concubine enjoyed the Emperor's undivided affection.","Classic Literature, Concordances, Fiction, Illustrations, Japanese fiction, Literature, Social life and customs, Princes, Aristocracy (Social class), Manners and customs, Aristocracy (Political science), Man-woman relationships,  fiction, Translations into English, Japanese literature, LITERATURA JAPONESA, Near and far eastern fiction (fictional works by one author), Japan, fiction, Fiction, general, Fiction, history and criticism, Fiction, historical, Fiction, historical, general, LITERARY CRITICISM, Asian, Japanese, Medieval, General, Romance, Court and courtiers, Courts and courtiers, Japan -- Fiction",1900,No page count available,"eng, rus, fre, ger, jpn, pan, chi",No rating,https://openlibrary.org/works/OL2564006W,https://covers.openlibrary.org/b/id/6614001-M.jpg
The Awakening,Kate Chopin,"A GREEN AND YELLOW parrot, which hung in a cage outside the door, kept repeating over and over: ""Allez vous-en! Allez vous-en! Sapristi! That's all right!""","Adultery, American literature, Classic Literature, Criticism and interpretation, feminist fiction, feminist literature, Fiction, History, Interpersonal attraction, Interpersonal relations, literary fiction, Louisiana Creoles, Man-woman relationships, fiction, manners and customs, Marriage, Married people, Married women, Modern Literature, Psychological fiction, Psychology, Romance fiction, Self-actualization (Psychology), Short Stories, Social conditions, Social life and customs, Women, American fiction (fictional works by one author), Married people, fiction, New Orleans (la.), fiction, Fiction, psychological, Louisiana, fiction",1899,No page count available,"cat, pol, fre, ger, spa, eng",No rating,https://openlibrary.org/works/OL65430W,https://covers.openlibrary.org/b/id/8750241-M.jpg
The Portrait Of A Lady,Luther T. Smith,No description available,"Fiction, Americans, Inheritance and succession, Triangles (Interpersonal relations), Isabel Archer (Fictitious character), Fathers and daughters, Married women, Young women, Married people, Social life and customs, Domestic relations, Readers, Marriage, Classic Literature, Historical Fiction, Romance, Composition and exercises, Latin language, Grammar, Problems, exercises, Long Now Manual for Civilization, Archer, Isabel (Fictitious character) -- Fiction, Romance Norte Americano, Manners and customs, Film, Fathers and daughters, fiction, Italy, fiction, Man-woman relationships, fiction, Married people, fiction, Archer, isabel (fictitious character), fiction, American fiction (fictional works by one author), Fiction, psychological, American literature, James, henry, 1843-1916, Large type books, Young women--fiction, Americans--italy--fiction, Inheritance and succession--fiction, Married people--fiction, Triangles (interpersonal relations)--fiction, Ps2116 .p6 2009, 813/.4, James, henry , 1843-1916, Archer, isabel (fictitious character), Archer, isabel (fictitious character)--fiction, Fathers and daughters--fiction, Married women--fiction, Ps2116 .p6 1995",1881,No page count available,"swe, urd, dut, spa, lat, ger, eng",No rating,https://openlibrary.org/works/OL276370W,https://covers.openlibrary.org/b/id/8236992-M.jpg
Ethan Frome,Edith Wharton,"I HAD THE STORY, bit by bit, from various people, and, as generally happens in such cases, each time it was a different story.","Accident victims, American fiction (fictional works by one author), American literature, Children's fiction, Classic Literature, domestic fiction, English fiction, Family life, Farm life, Fiction, Guardian and ward, Interpersonal relations, Love, Manners and customs, Marriage, Married people, poor, Poverty, Readers, Romance, Rural poor, Social life and customs, Study and teaching (Secondary), Triangles (Interpersonal relations), Young women, Married people, fiction, Massachusetts, fiction, Man-woman relationships, fiction, Wharton, edith, 1862-1937, Young women, fiction, Fiction, romance, general, Unrequited love, New england, fiction, English language, textbooks for foreign speakers, Single women, fiction, Fiction, historical, general, Fiction, general, Triangle (Relations humaines), Romans, nouvelles, Victimes d'accidents, Couples mariés, Pauvres en milieu rural, Vie à la ferme, Large type books, Exhibitions, Chinese language, Writing, Seal style, Paste papers, Specimens, Triangles (Interpersonal relations) -- Fiction, Accident victims -- Fiction, Married people -- Fiction, Rural poor -- Fiction, Farm life -- Fiction, Massachusetts -- Fiction, Massachusetts, England, fiction, Women as authors",1910,No page count available,"eng, kor, fre, ger, pol, chi, ita, spa",No rating,https://openlibrary.org/works/OL98501W,https://covers.openlibrary.org/b/id/8303480-M.jpg
The Secret Agent,Joseph Conrad,"The bell, hung on the door by means of a curved ribbon of steel, was difficult to circumvent.","Anarchists, fiction, Conspiracies, fiction, Bombings, fiction, Terrorism, fiction, Royal Greenwich Observatory, fiction, Drama, Trading companies, Dutch, Classic Literature, Moles (Spies), Political, British and Irish fiction (fictional works by one author), English literature, Africa, fiction, Fiction, psychological, London (England), fiction, Fiction, political, Large type books, English Romances, Romance Ingles, English fiction, Drama (dramatic works by one author), Terrorists, fiction, Fiction, thrillers, espionage, General, Jewish, Christian, Biographical, Medical, Suspense, Science Fiction, Religious, Psychological, Occult & Supernatural, Mystery & Detective, Hard-Boiled, Historical, Fantasy, Classics, Modern & contemporary fiction (post c 1945), Radicalism, Collected works (single author, multi-form), Fiction, mystery & detective, general, Novela policíaca inglesa, American fiction (fictional works by one author), England, fiction, Children's fiction, Mystery and detective stories, Conrad, Joseph, 1857-1924. Secret agent, Conrad, Joseph, Secret agent (Conrad, Joseph), Conspiration -- Romans, nouvelles, etc, Anarchistes -- Romans, nouvelles, etc, Attentats à la bombe -- Romans, nouvelles, etc, Play, Terrorism, Fiction, Conspiracies, Anarchists, Bombings",1907,No page count available,"ger, ara, spa, ita, eng, fre",No rating,https://openlibrary.org/works/OL39108W,https://covers.openlibrary.org/b/id/8239401-M.jpg
Les Trois Mousquetaires,"Alexandre Dumas, Auguste Maquet","On the first Monday of the month of April, 1626, the market-town of Meung, in which the author of the ""Romance of the rose"" was born, appeared to be in as perfect a state of revolution as if the Huguenots had just made a second Rochelle of it.","History, Fiction, Swordsmen, France in fiction, Accessible book, Protected DAISY, Vietnamese language books, Swordplay, Juvenile fiction, Adventure and adventurers, Spanish language materials, Romans, nouvelles, etc. pour la jeunesse, Histoire, Combat au sabre, Novela juvenil, Historia, Adventure fiction, Spanish language, Reading materials, Fiction, historical, France, fiction, Continental european fiction (fictional works by one author), Three musketeers (fictitious characters), fiction, Fiction, action & adventure, French language materials, Social conditions, Adventure stories, General, French fiction, Ying yu, Yu yan du wu, Chang pian xiao shuo, Romance literature, Fiction, historical, general, Children's fiction, Adventure and adventurers, fiction, Paris (france), fiction, Mongolian literature, Historical fiction, Abenteuerroman, Russian language materials, Classic Literature, OverDrive, New York Times reviewed, France, Comics & graphic novels, historical fiction, France -- History -- Louis XIII, 1610-1643 -- Fiction, Adventure and adventurers -- Fiction, Swordsmen -- Fiction, Épéistes, Fiction, general, France -- History -- Louis XIII, 1610-1643 -- Fiction., Fiction, romance, historical, general, Continental european drama (dramatic works by one author)",1844,No page count available,"pol, ger, mon, vie, wel, chi, fre, fin, ita, tur, und, swe, heb, dut, spa, enm, gre, rus, eng, hun, por, glg, alb",No rating,https://openlibrary.org/works/OL36861W,https://covers.openlibrary.org/b/id/11929973-M.jpg
